file.name,id,user,root,text,min,sec,nanosec,reply.to,n.participants,user_id,Team_id,time,condition,round,is_vero,user_id2,to,task_pos,task_conf,rel_pos,rel_conf,3rdVero
02_25_2021_vero #1_task_round 1_otter.ai,5390,Participant 697,5257,So what did y'all say for brick?,11,39,NA,5389,3,697,1_1_1,699,taskwork,1,FALSE,682,all,,,,,
02_25_2021_vero #1_task_round 1_otter.ai,5391,Participant 682,5257,A brick can be used to build a house could be used to smash a window,11,41,NA,5390,3,682,1_1_1,701,taskwork,1,FALSE,697,697,,,,,
02_25_2021_vero #1_task_round 1_otter.ai,5392,Participant 959,5257,"No no just go one by one. So we should write right. To build your house. ,",11,45,NA,5391,3,959,1_1_1,705,taskwork,1,FALSE,682,697,,1,,,
02_25_2021_vero #1_task_round 1_otter.ai,5393,Participant 697,5257,"Okay, so let's move on. It's my we only have one brick.",11,53,NA,5392,3,697,1_1_1,713,taskwork,1,FALSE,959,959,,1,,,
02_25_2021_vero #1_task_round 1_otter.ai,5394,Participant 959,5257,"No, no, it's not like that",11,56,NA,5393,3,959,1_1_1,716,taskwork,1,FALSE,697,697,,1,,,
02_25_2021_vero #1_task_round 1_otter.ai,5395,Participant 697,5257,it says a brick.,12,1,NA,5394,3,697,1_1_1,721,taskwork,1,FALSE,959,959,,1,,,
02_25_2021_vero #1_task_round 1_otter.ai,5396,Participant 682,5257,A brick. It's a brick,12,3,NA,5395,3,682,1_1_1,723,taskwork,1,FALSE,697,959,,1,,,
02_25_2021_vero #1_task_round 1_otter.ai,5397,NA,5257,Unknown Speaker  12:05,12,3,NA,5396,3,682,1_1_1,723,taskwork,1,FALSE,682,,,,,,
02_25_2021_vero #1_task_round 1_otter.ai,5398,Participant 682,5257,one brick.,12,3,NA,5397,3,682,1_1_1,723,taskwork,1,FALSE,682,959,,1,,,
02_25_2021_vero #1_task_round 1_otter.ai,5399,Participant 959,5257,"Oh,",12,6,NA,5398,3,959,1_1_1,726,taskwork,1,FALSE,682,all,,,,,
02_25_2021_vero #1_task_round 1_otter.ai,5400,NA,5257,Unknown Speaker  12:07,12,6,NA,5399,3,959,1_1_1,726,taskwork,1,FALSE,959,,,,,,
02_25_2021_vero #1_task_round 1_otter.ai,5401,Participant 697,5257,yeah. So I said kill people.,12,6,NA,5400,3,959,1_1_1,726,taskwork,1,FALSE,959,all,,,,,
02_25_2021_vero #1_task_round 1_otter.ai,5402,Participant 682,5257,That is true.,12,10,NA,5401,3,682,1_1_1,730,taskwork,1,FALSE,959,697,1,,,,
02_25_2021_vero #1_task_round 1_otter.ai,5403,Participant 697,5257,"Well, that's what I said for the first thing. I said kill people and break windows.",12,12,NA,5402,3,697,1_1_1,732,taskwork,1,FALSE,682,682,,,,,
02_25_2021_vero #1_task_round 1_otter.ai,5404,Participant 682,5257,Yeah that is true,12,15,NA,5403,3,682,1_1_1,735,taskwork,1,FALSE,697,697,1,,,,
02_25_2021_vero #1_task_round 1_otter.ai,5405,Participant 697,5257,Do Y'all and just kind of go in a circle and be like one at a time. Just say one thing and we'll just keep going,12,17,NA,5404,3,697,1_1_1,737,taskwork,1,FALSE,682,all,,,,,
02_25_2021_vero #1_task_round 1_otter.ai,5406,Participant 682,5257,That's good yeah I like it.,12,21,NA,5405,3,682,1_1_1,741,taskwork,1,FALSE,697,697,2,,,,
02_25_2021_vero #1_task_round 1_otter.ai,5407,Participant 959,5257,So what did you say?,12,22,NA,5406,3,959,1_1_1,742,taskwork,1,FALSE,682,697,,,,,
02_25_2021_vero #1_task_round 1_otter.ai,5408,Participant 697,5257,I said kill people and break windows.,12,24,NA,5407,3,697,1_1_1,744,taskwork,1,FALSE,959,959,,,,,
02_25_2021_vero #1_task_round 1_otter.ai,5409,Participant 959,5257,break a window?,12,28,NA,5408,3,959,1_1_1,748,taskwork,1,FALSE,697,697,,,,,
02_25_2021_vero #1_task_round 1_otter.ai,5410,Participant 697,5257,Yeah. All right.,12,30,NA,5409,3,697,1_1_1,750,taskwork,1,FALSE,959,959,,,,,
02_25_2021_vero #1_task_round 1_otter.ai,5411,Participant 697,5257,Go ahead.,12,30,NA,5410,3,697,1_1_1,750,taskwork,1,FALSE,697,all,,,,,
02_25_2021_vero #1_task_round 1_otter.ai,5412,Participant 682,5257,"Um, it's ridiculous but holding up something or holding down so it can be a paperweight paperweight? Okay, a paperweight? All right,",12,33,NA,5411,3,682,1_1_1,753,taskwork,1,FALSE,697,all,,,,,
02_25_2021_vero #1_task_round 1_otter.ai,5413,Participant 697,5257,"Okay, next",12,41,NA,5412,3,697,1_1_1,761,taskwork,1,FALSE,682,all,,,,,
02_25_2021_vero #1_task_round 1_otter.ai,5414,Participant 697,5257,"well, what did y'all put for your responses when you did the individual writing, I put hammer?",12,41,NA,5413,3,697,1_1_1,761,taskwork,1,FALSE,697,all,,,,,
02_25_2021_vero #1_task_round 1_otter.ai,5415,Participant 682,5257,Yeah you could use it as a hammer. Yeah.,12,59,NA,5414,3,682,1_1_1,779,taskwork,1,FALSE,697,697,1,,,,
02_25_2021_vero #1_task_round 1_otter.ai,5416,Participant 697,5257,What else did I put? I put hammer. I put tenderizing meat.,13,2,NA,5415,3,697,1_1_1,782,taskwork,1,FALSE,682,all,,,,,
02_25_2021_vero #1_task_round 1_otter.ai,5417,Participant 682,5257,That could be a thing actually. Yeah.,13,9,NA,5416,3,682,1_1_1,789,taskwork,1,FALSE,697,697,1,,,,
02_25_2021_vero #1_task_round 1_otter.ai,5418,Participant 697,5257,"Yeah, I put a doorstop.",13,12,NA,5417,3,697,1_1_1,792,taskwork,1,FALSE,682,all,,,,,
02_25_2021_vero #1_task_round 1_otter.ai,5419,Participant 682,5257,That was good. I like that. doorstops,13,16,NA,5418,3,682,1_1_1,796,taskwork,1,FALSE,697,697,2,,,,
02_25_2021_vero #1_task_round 1_otter.ai,5420,Participant 697,5257,"I put step stool you can use a brick as chalk on like, pavement. Have you ever done that? You just use",13,19,NA,5419,3,697,1_1_1,799,taskwork,1,FALSE,682,all,,,,,
02_25_2021_vero #1_task_round 1_otter.ai,5421,Participant 682,5257,"I have not no, I get the idea.",13,27,NA,5420,3,682,1_1_1,807,taskwork,1,FALSE,697,697,,,,,
02_25_2021_vero #1_task_round 1_otter.ai,5422,Participant 682,5257,brick is like a piece of chalk.,13,27,NA,5421,3,682,1_1_1,807,taskwork,1,FALSE,682,697,,,,,
02_25_2021_vero #1_task_round 1_otter.ai,5423,Participant 682,5257,Mm hmm.,13,27,NA,5422,3,682,1_1_1,807,taskwork,1,FALSE,682,697,,,,,
02_25_2021_vero #1_task_round 1_otter.ai,5424,Participant 697,5257,I said as a car stop which is kind of the same thing as a doorstop.,13,32,NA,5423,3,697,1_1_1,812,taskwork,1,FALSE,682,all,,,,,
02_25_2021_vero #1_task_round 1_otter.ai,5425,Participant 697,5257,Exercise weights.,13,32,NA,5424,3,697,1_1_1,812,taskwork,1,FALSE,697,all,,,,,
02_25_2021_vero #1_task_round 1_otter.ai,5426,Participant 682,5257,"Well, that's true, too.",13,40,NA,5425,3,682,1_1_1,820,taskwork,1,FALSE,697,697,1,,,,
02_25_2021_vero #1_task_round 1_otter.ai,5427,Participant 697,5257,"I said like a canvas to paint on or draw on or whatever. And I said decoration like if you just have a brick in your house as decoration. Yeah, so what did y'all put?",13,42,NA,5426,3,697,1_1_1,822,taskwork,1,FALSE,682,all,,,,,
02_25_2021_vero #1_task_round 1_otter.ai,5428,Participant 682,5257,"They could be used to lift a book. I don't know what, Why did I say that? I don't know the idea of it. But like, or like, or you can it use as a prop for phone. So like, if you want to lean your phone against the brick",14,3,NA,5427,3,682,1_1_1,843,taskwork,1,FALSE,697,697,,,,,
02_25_2021_vero #1_task_round 1_otter.ai,5429,Participant 697,5257,Yeah as a phone prop.,14,17,NA,5428,3,697,1_1_1,857,taskwork,1,FALSE,682,682,1,,,,
02_25_2021_vero #1_task_round 1_otter.ai,5430,Participant 682,5257,"Yeah,",14,19,NA,5429,3,682,1_1_1,859,taskwork,1,FALSE,697,697,,,,,
02_25_2021_vero #1_task_round 1_otter.ai,5431,Participant 697,5257,what else did you put? Did you mean like a Like a table? Or like a lap desk?,14,20,NA,5430,3,697,1_1_1,860,taskwork,1,FALSE,682,682,,,,,
02_25_2021_vero #1_task_round 1_otter.ai,5432,Participant 682,5257,You can do that too? Yeah.,14,25,NA,5431,3,682,1_1_1,865,taskwork,1,FALSE,697,697,,,,,
02_25_2021_vero #1_task_round 1_otter.ai,5433,Participant 697,5257,What else did you write?,14,29,NA,5432,3,697,1_1_1,869,taskwork,1,FALSE,682,682,,,,,
02_25_2021_vero #1_task_round 1_otter.ai,5434,Participant 682,5257,"Um then the other idea that was that I had was like, like, you know like the bricks face this way. Right? And then the phone just leans on that that way if you want to watch something like",14,32,NA,5433,3,682,1_1_1,872,taskwork,1,FALSE,697,697,,,,,
02_25_2021_vero #1_task_round 1_otter.ai,5435,Participant 697,5257,"okay, yeah, cool. Okay,",14,39,NA,5434,3,697,1_1_1,879,taskwork,1,FALSE,682,682,1,,,,
02_25_2021_vero #1_task_round 1_otter.ai,5436,Participant 682,5257,yeah.,14,40,NA,5435,3,682,1_1_1,880,taskwork,1,FALSE,697,697,,,,,
02_25_2021_vero #1_task_round 1_otter.ai,5437,Participant 697,5257,Alright anything else?,14,43,NA,5436,3,697,1_1_1,883,taskwork,1,FALSE,682,all,,,,,
02_25_2021_vero #1_task_round 1_otter.ai,5438,Participant 959,5257,Place an object at a height. Oh,14,44,NA,5437,3,959,1_1_1,884,taskwork,1,FALSE,697,697,,,,,
02_25_2021_vero #1_task_round 1_otter.ai,5439,Participant 697,5257,"Like a like a, shoot what are they called?",14,47,NA,5438,3,697,1_1_1,887,taskwork,1,FALSE,959,959,,,,,
02_25_2021_vero #1_task_round 1_otter.ai,5440,Participant 697,5257,"A desk?Oh, we already said lapdesk. What else did you put?",14,47,NA,5439,3,697,1_1_1,887,taskwork,1,FALSE,697,all,,,,,
02_25_2021_vero #1_task_round 1_otter.ai,5441,Participant 682,5257,That's all I had,15,7,NA,5440,3,682,1_1_1,907,taskwork,1,FALSE,697,697,,,,,
02_25_2021_vero #1_task_round 1_otter.ai,5442,Participant 959,5257,the broken brick can be used as a filler.,15,9,NA,5441,3,959,1_1_1,909,taskwork,1,FALSE,682,697,,,,,
02_25_2021_vero #1_task_round 1_otter.ai,5443,Participant 697,5257,A filler?,15,12,NA,5442,3,697,1_1_1,912,taskwork,1,FALSE,959,959,,,,,
02_25_2021_vero #1_task_round 1_otter.ai,5444,Participant 959,5257,"The Broken brick, madefrom the broken brick.",15,14,NA,5443,3,959,1_1_1,914,taskwork,1,FALSE,697,697,,,,,
02_25_2021_vero #1_task_round 1_otter.ai,5445,Participant 697,5257,Yeah breakto make like fillers. Okay.,15,17,NA,5444,3,697,1_1_1,917,taskwork,1,FALSE,959,959,,,,,
02_25_2021_vero #1_task_round 1_otter.ai,5446,Participant 697,5257,"Oh, you know a broken break. Can be used as like a like a cutting tool?",15,17,NA,5445,3,697,1_1_1,917,taskwork,1,FALSE,697,all,,,,,
02_25_2021_vero #1_task_round 1_otter.ai,5447,Participant 682,5257,It is true like a knife. Yeah. Knife. Yeah.,15,30,NA,5446,3,682,1_1_1,930,taskwork,1,FALSE,697,697,1,,,,
02_25_2021_vero #1_task_round 1_otter.ai,5448,Participant 697,5257,Break to make a knife,15,34,NA,5447,3,697,1_1_1,934,taskwork,1,FALSE,682,682,,,,,
02_25_2021_vero #1_task_round 1_otter.ai,5449,Participant 697,5257,"What else? What else you got? I feel like can you use a brick to do laundry? You know, like in a river you have like those washboards, Can you use a brick for that?",15,34,NA,5448,3,697,1_1_1,934,taskwork,1,FALSE,697,all,,,,,
02_25_2021_vero #1_task_round 1_otter.ai,5450,Participant 959,5257,A brick is too small for that,15,57,NA,5449,3,959,1_1_1,957,taskwork,1,FALSE,697,697,,1,,,
02_25_2021_vero #1_task_round 1_otter.ai,5451,Participant 697,5257,"you think it's too small? Um, let's see what else. A brick could be used",16,0,NA,5450,3,697,1_1_1,960,taskwork,1,FALSE,959,959,,,,,
02_25_2021_vero #1_task_round 1_otter.ai,5452,Participant 959,5257,"To plant a tree to plant? I mean, uhhh what do you call it?",16,12,NA,5451,3,959,1_1_1,972,taskwork,1,FALSE,697,697,,,,,
02_25_2021_vero #1_task_round 1_otter.ai,5453,NA,5257,Unknown Speaker  16:23,16,12,NA,5452,3,959,1_1_1,972,taskwork,1,FALSE,959,,,,,,
02_25_2021_vero #1_task_round 1_otter.ai,5454,Participant 697,5257,Here okay. Listen to this. Okay. What? What are some things you guys like to do? Maybe there's a way to use a brick in that. So what do you like to do for fun?,16,12,NA,5453,3,959,1_1_1,972,taskwork,1,FALSE,959,all,,,,,
02_25_2021_vero #1_task_round 1_otter.ai,5455,Participant 682,5257,"Wait, it's dumb as hell I like to say so used as a microphone.",16,34,NA,5454,3,682,1_1_1,994,taskwork,1,FALSE,959,697,,,,,
02_25_2021_vero #1_task_round 1_otter.ai,5456,Participant 959,5257,I used I could use it to break it. Like I know karate.,16,41,NA,5455,3,959,1_1_1,1001,taskwork,1,FALSE,682,697,,,,,
02_25_2021_vero #1_task_round 1_otter.ai,5457,Participant 682,5257,"Oh, yes. that's Using that too. Yeah.",16,45,NA,5456,3,682,1_1_1,1005,taskwork,1,FALSE,959,959,,,,,
02_25_2021_vero #1_task_round 1_otter.ai,5458,Participant 697,5257,What is that called? karate chop it.,16,48,NA,5457,3,697,1_1_1,1008,taskwork,1,FALSE,682,all,,,,,
02_25_2021_vero #1_task_round 1_otter.ai,5459,Participant 682,5257,"Yes, yeah.",16,53,NA,5458,3,682,1_1_1,1013,taskwork,1,FALSE,697,697,,,,,
02_25_2021_vero #1_task_round 1_otter.ai,5460,Participant 697,5257,karate demonstration.,16,54,NA,5459,3,697,1_1_1,1014,taskwork,1,FALSE,682,all,,,,,
02_25_2021_vero #1_task_round 1_otter.ai,5461,Participant 682,5257,Martial Arts demonstration. Use as a prop in a martial arts demonstration,16,57,NA,5460,3,682,1_1_1,1017,taskwork,1,FALSE,697,697,,,,,
02_25_2021_vero #1_task_round 1_otter.ai,5462,Participant 697,5257,What else do you guys like to do?,17,2,NA,5461,3,697,1_1_1,1022,taskwork,1,FALSE,682,all,,,,,
02_25_2021_vero #1_task_round 1_otter.ai,5463,Participant 682,5257,"I remember watching his videos, like in kung fu as long as that but like these monks say like they test your mind. But like him brick smashing into their head. So smashing head,",17,9,NA,5462,3,682,1_1_1,1029,taskwork,1,FALSE,697,697,,,,,
02_25_2021_vero #1_task_round 1_otter.ai,5464,Participant 697,5257,"smash it on your head. That made me think of something, smash it on your head. Um Balanced training, you can like balance on the brick, you know?",17,22,NA,5463,3,697,1_1_1,1042,taskwork,1,FALSE,682,682,,,,,
02_25_2021_vero #1_task_round 1_otter.ai,5465,Participant 682,5257,"Oh that's true, balance training.",17,33,NA,5464,3,682,1_1_1,1053,taskwork,1,FALSE,697,697,1,,,,
02_25_2021_vero #1_task_round 1_otter.ai,5466,Participant 959,5257,"So, for testing out strength or big, I mean...",17,36,NA,5465,3,959,1_1_1,1056,taskwork,1,FALSE,682,all,,,,,
02_25_2021_vero #1_task_round 1_otter.ai,5467,Participant 697,5257,Wait to test the strength. Like I kind of get whatyou're saying,17,46,NA,5466,3,697,1_1_1,1066,taskwork,1,FALSE,959,959,,,,,
02_25_2021_vero #1_task_round 1_otter.ai,5468,Participant 959,5257,"there is an apparatus for that, to test the strength of the brain. So in normal British use.",17,49,NA,5467,3,959,1_1_1,1069,taskwork,1,FALSE,697,all,,,,,
02_25_2021_vero #1_task_round 1_otter.ai,5469,Participant 697,5257,Oh so use the brick to test the strength of other things.,17,58,NA,5468,3,697,1_1_1,1078,taskwork,1,FALSE,959,959,,,,,
02_25_2021_vero #1_task_round 1_otter.ai,5470,Participant 959,5257,"No there will be two jaws, upper jaw lower jaw. There a brick is placed. And then there will be compression.",18,1,NA,5469,3,959,1_1_1,1081,taskwork,1,FALSE,697,all,,,,,
02_25_2021_vero #1_task_round 1_otter.ai,5471,Participant 697,5257,"Oh, to compress it. What is that called?",18,11,NA,5470,3,697,1_1_1,1091,taskwork,1,FALSE,959,959,,,,,
02_25_2021_vero #1_task_round 1_otter.ai,5472,Participant 959,5257,"Yeah, for testing the strength of brick. That will do.",18,16,NA,5471,3,959,1_1_1,1096,taskwork,1,FALSE,697,697,,,,,
02_25_2021_vero #1_task_round 1_otter.ai,5473,Participant 697,5257,"Yeah, okay.",18,19,NA,5472,3,697,1_1_1,1099,taskwork,1,FALSE,959,959,,,,,
02_25_2021_vero #1_task_round 1_otter.ai,5474,Participant 682,5257,"Oh, actually, I kind of get the idea yeah.",18,20,NA,5473,3,682,1_1_1,1100,taskwork,1,FALSE,697,959,,,,,
02_25_2021_vero #1_task_round 1_otter.ai,5475,Participant 697,5257,I'm just gonna say for testing the strength of objects because that that can like test both things at the same time. What else can we use a brick for? I am trying to think,18,23,NA,5474,3,697,1_1_1,1103,taskwork,1,FALSE,682,all,,,,,
02_25_2021_vero #1_task_round 1_otter.ai,5476,Participant 959,5257,"I mean, yeah, I think",18,52,NA,5475,3,959,1_1_1,1132,taskwork,1,FALSE,697,697,,,,,
02_25_2021_vero #1_task_round 1_otter.ai,5477,Participant 697,5257,"Yeah,",18,55,NA,5476,3,697,1_1_1,1135,taskwork,1,FALSE,959,959,,,,,
02_25_2021_vero #1_task_round 1_otter.ai,5478,Participant 959,5257,when I when I'm making my childhood I use wood bricks as wickets. You know when we used to play cricket in my neighborhood. They are used as wickets,18,55,NA,5477,3,959,1_1_1,1135,taskwork,1,FALSE,697,697,,,,,
02_25_2021_vero #1_task_round 1_otter.ai,5479,Participant 697,5257,How do you spell that?,19,8,NA,5478,3,697,1_1_1,1148,taskwork,1,FALSE,959,959,,,,,
02_25_2021_vero #1_task_round 1_otter.ai,5480,Participant 959,5257,Do you know what is called wicket,19,9,NA,5479,3,959,1_1_1,1149,taskwork,1,FALSE,697,697,,,,,
02_25_2021_vero #1_task_round 1_otter.ai,5481,Participant 697,5257,Wicket?,19,11,NA,5480,3,697,1_1_1,1151,taskwork,1,FALSE,959,959,,,,,
02_25_2021_vero #1_task_round 1_otter.ai,5482,Participant 682,5257,Wicket?,19,13,NA,5481,3,682,1_1_1,1153,taskwork,1,FALSE,697,959,,,,,
02_25_2021_vero #1_task_round 1_otter.ai,5483,Participant 959,5257,"Yeah, it is a game called cricket.",19,14,NA,5482,3,959,1_1_1,1154,taskwork,1,FALSE,682,all,,,,,
02_25_2021_vero #1_task_round 1_otter.ai,5484,Participant 682,5257,Oh Cricket.,19,17,NA,5483,3,682,1_1_1,1157,taskwork,1,FALSE,959,959,,,,,
02_25_2021_vero #1_task_round 1_otter.ai,5485,Participant 959,5257,Cricket,19,19,NA,5484,3,959,1_1_1,1159,taskwork,1,FALSE,682,682,,,,,
02_25_2021_vero #1_task_round 1_otter.ai,5486,Participant 697,5257,Cricket,19,20,NA,5485,3,697,1_1_1,1160,taskwork,1,FALSE,959,959,,,,,
02_25_2021_vero #1_task_round 1_otter.ai,5487,Participant 682,5257,"Yeah. Oh, yeah.",19,24,NA,5486,3,682,1_1_1,1164,taskwork,1,FALSE,697,959,,,,,
02_25_2021_vero #1_task_round 1_otter.ai,5488,Participant 697,5257,to play cricket. Awesome.,19,26,NA,5487,3,697,1_1_1,1166,taskwork,1,FALSE,682,959,1,,,,
02_25_2021_vero #1_task_round 1_otter.ai,5489,Participant 959,5257,You can put it like that. Break as wicket in cricket. Brick as wicket in cricket.,19,28,NA,5488,3,959,1_1_1,1168,taskwork,1,FALSE,697,all,,,,,
02_25_2021_vero #1_task_round 1_otter.ai,5490,Participant 682,5257,Say that again,19,37,NA,5489,3,682,1_1_1,1177,taskwork,1,FALSE,959,959,,,,,
02_25_2021_vero #1_task_round 1_otter.ai,5491,Participant 959,5257,brick as cricket. Brick as wicket in cricket.,19,39,NA,5490,3,959,1_1_1,1179,taskwork,1,FALSE,682,682,,,,,
02_25_2021_vero #1_task_round 1_otter.ai,5492,Participant 697,5257,"Brick as a wicked in cricket. Okay,",19,44,NA,5491,3,697,1_1_1,1184,taskwork,1,FALSE,959,959,,,,,
02_25_2021_vero #1_task_round 1_otter.ai,5493,Participant 959,5257,"yeah, like",19,46,NA,5492,3,959,1_1_1,1186,taskwork,1,FALSE,697,697,,,,,
02_25_2021_vero #1_task_round 1_otter.ai,5494,Participant 682,5257,I got it. Okay. It's... I was thinking. I remember reading a third night clues books and they were talking they were like talking about hollwing  out the brick to put like in documents or something like that,19,48,NA,5493,3,682,1_1_1,1188,taskwork,1,FALSE,959,"959,all",,,,,
02_25_2021_vero #1_task_round 1_otter.ai,5495,Participant 697,5257,"So, um, to, to, uh,what's it called? to transfer confidential documents?",20,0,NA,5494,3,697,1_1_1,1200,taskwork,1,FALSE,682,682,,,,,
02_25_2021_vero #1_task_round 1_otter.ai,5496,Participant 682,5257,"Yeah, you can do that. Yeah.",20,10,NA,5495,3,682,1_1_1,1210,taskwork,1,FALSE,697,697,,,,,
02_25_2021_vero #1_task_round 1_otter.ai,5497,Participant 697,5257,Okay. That also makes me think of some people hide their keys in bricks.,20,11,NA,5496,3,697,1_1_1,1211,taskwork,1,FALSE,682,682,,,,,
02_25_2021_vero #1_task_round 1_otter.ai,5498,Participant 682,5257,"Oh, that's true.",20,19,NA,5497,3,682,1_1_1,1219,taskwork,1,FALSE,697,697,1,,,,
02_25_2021_vero #1_task_round 1_otter.ai,5499,Participant 697,5257,"So if you say to hide your spare keys,",20,21,NA,5498,3,697,1_1_1,1221,taskwork,1,FALSE,682,682,,,,,
02_25_2021_vero #1_task_round 1_otter.ai,5500,Participant 697,5257,"um, what else?What else? Oh, you can, um, tie it to people. And then if they like, get thrown in a river, they'll sink or like to make things sink.",20,21,NA,5499,3,697,1_1_1,1221,taskwork,1,FALSE,697,all,,,,,
02_25_2021_vero #1_task_round 1_otter.ai,5501,Participant 682,5257,"Or you could tie it to something to make things sink, yeah, yeah. Or person to be",20,43,NA,5500,3,682,1_1_1,1243,taskwork,1,FALSE,697,697,,,,,
02_25_2021_vero #1_task_round 1_otter.ai,5502,Participant 697,5257,"Tie it to an object or person and sink. Okay, um, what else? We have like 20 seconds. As as a as a companion like Wilson in Castaway.",20,48,NA,5501,3,697,1_1_1,1248,taskwork,1,FALSE,682,"682,all",,,,,
02_25_2021_vero #1_task_round 1_otter.ai,5503,Participant 682,5257,"Oh, you could try that. Yeah, if you're lonely.",21,11,NA,5502,3,682,1_1_1,1271,taskwork,1,FALSE,697,697,1,,,,
02_25_2021_vero #1_task_round 1_otter.ai,5504,Participant 697,5257,"It's a companion. All right. I think that's all the time we have. Okay. We'll respond to these questions individually. Alright, so we just have to do this. Okay, cool.",21,16,NA,5503,3,697,1_1_1,1276,taskwork,1,FALSE,682,all,,,,,
02_25_2021_vero #1_task_round 1_otter.ai,5505,Participant 697,5257,We all done?,21,16,NA,5504,3,697,1_1_1,1276,taskwork,1,FALSE,697,all,,,,,
02_25_2021_vero #1_task_round 1_otter.ai,5506,Participant 682,5257,"Yeah, so we're early.",25,44,0,5505,3,682,1_1_1,1544,taskwork,1,FALSE,697,697,,,,,
02_25_2021_vero #1_task_round 1_otter.ai,5507,Participant 697,5257,"So we're, we're gonna have like a AI for the next two.",25,48,0,5506,3,697,1_1_1,1548,taskwork,1,FALSE,682,all,,,,,
02_25_2021_vero #1_task_round 1_otter.ai,5508,Participant 682,5257,I think. Yeah.,25,52,0,5507,3,682,1_1_1,1552,taskwork,1,FALSE,697,697,,,,,
02_25_2021_vero #1_task_round 1_otter.ai,5509,Participant 697,5257,All right. Okay.,25,56,0,5508,3,697,1_1_1,1556,taskwork,1,FALSE,682,682,,,,,
02_25_2021_vero #1_task_round 1_otter.ai,5510,Participant 697,5257,"I think this space one was just hard because we were like, We can't take off our suits, but I feel like the other ones will be pretty okay.",25,56,0,5509,3,697,1_1_1,1556,taskwork,1,FALSE,697,all,,,,,
02_25_2021_vero #1_task_round 1_otter.ai,5511,Participant 682,5257,"Yeah, just the stuff about the water. Apparently they do drink water out of like I forgot it was, but sometimes it will put water in concentrated foods and I'm like that makes sense, but you can't have like a",26,9,0,5510,3,682,1_1_1,1569,taskwork,1,FALSE,697,697,,,,,
02_25_2021_vero #1_task_round 1_otter.ai,5512,Participant 697,5257,"thing where they have a straw inside their suit, which is why I was confused because I was like, So did they fill it up before theyleft?",26,20,0,5511,3,697,1_1_1,1580,taskwork,1,FALSE,682,682,,,,,
02_25_2021_vero #1_task_round 1_otter.ai,5513,Participant 959,5257,Maybe they have straw in their suits as a provision for carrying?,26,29,0,5512,3,959,1_1_1,1589,taskwork,1,FALSE,697,697,,,,,
02_25_2021_vero #1_task_round 1_otter.ai,5514,Participant 697,5257,"Hmm. Yeah, like, Uh huh. All right. Okay. Oh, we'll bring you back to the main room very soon. I don't know like how they're evaluating us. Like, how are they deciding how well our team is doing?",26,37,0,5513,3,697,1_1_1,1597,taskwork,1,FALSE,959,"959,all",,,,,
02_25_2021_vero #1_task_round 1_otter.ai,5515,Participant 682,5257,"Yeah. That's very subjective, right?",27,9,0,5514,3,682,1_1_1,1629,taskwork,1,FALSE,697,697,,,,,
02_25_2021_vero #1_task_round 1_otter.ai,5516,Participant 697,5257,"I'm like, well,",27,13,0,5515,3,697,1_1_1,1633,taskwork,1,FALSE,682,682,,,,,
02_25_2021_vero #1_task_round 1_otter.ai,5517,Participant 682,5257,Unless they are doing jeopardy style.,27,15,0,5516,3,682,1_1_1,1635,taskwork,1,FALSE,697,697,,,,,
02_25_2021_vero #1_task_round 1_otter.ai,5518,Participant 697,5257,"Very true. where it's like, each answers points. How many points?",27,20,0,5517,3,697,1_1_1,1640,taskwork,1,FALSE,682,682,1,,,,
02_25_2021_vero #1_task_round 1_otter.ai,5519,Participant 682,5257,"Yeah,",27,24,0,5518,3,682,1_1_1,1644,taskwork,1,FALSE,697,697,,,,,
02_25_2021_vero #1_task_round 1_otter.ai,5520,Participant 959,5257,"Well we have to enter teammates names, Yeah?",27,27,0,5519,3,959,1_1_1,1647,taskwork,1,FALSE,682,all,,,,,
02_25_2021_vero #1_task_round 1_otter.ai,5521,Participant 682,5257,We didn't have a third.,27,32,0,5520,3,682,1_1_1,1652,taskwork,1,FALSE,959,all,,,,,
02_25_2021_vero #1_task_round 1_otter.ai,5522,Participant 697,5257,"We didn't. We didn't, I think, where it's like we have an AI. So we need that third space.",27,33,0,5521,3,697,1_1_1,1653,taskwork,1,FALSE,682,682,,,,,
02_25_2021_vero #1_task_round 1_otter.ai,5523,Participant 682,5257,Yeah.,27,39,0,5522,3,682,1_1_1,1659,taskwork,1,FALSE,697,697,,,,,
02_25_2021_vero #1_task_round 1_otter.ai,5524,Participant 959,5257,So continue with our answering. Then I had to submit continue with answering,27,41,0,5523,3,959,1_1_1,1661,taskwork,1,FALSE,682,all,,,,,
02_25_2021_vero #1_task_round 1_otter.ai,5525,Participant 682,5257,"basically continuing until you get to the pages to stop. Yeah. Yeah, I'm there right now. No,",27,47,0,5524,3,682,1_1_1,1667,taskwork,1,FALSE,959,959,,,,,
02_25_2021_vero #1_task_round 1_otter.ai,5526,Participant 959,5257,"It says proceed, it is asking me. Did you answer the question?",27,53,0,5525,3,959,1_1_1,1673,taskwork,1,FALSE,682,682,,,,,
02_25_2021_vero #1_task_round 1_otter.ai,5527,Participant 682,5257,Say that again. Did you get to the page?,28,2,0,5526,3,682,1_1_1,1682,taskwork,1,FALSE,959,959,,,,,
02_25_2021_vero #1_task_round 1_otter.ai,5528,Participant 959,5257,Yeah.,28,13,0,5527,3,959,1_1_1,1693,taskwork,1,FALSE,682,682,,,,,
02_25_2021_vero #1_task_round 1_otter.ai,5529,Participant 682,5257,"The stopPage, right.",28,14,0,5528,3,682,1_1_1,1694,taskwork,1,FALSE,959,959,,,,,
