file.name,id,user,root,text,min,sec,nanosec,reply.to,n.participants,user_id,Team_id,time,condition,round,is_vero,user_id2,to,task_pos,task_conf,rel_pos,rel_conf,3rdVero
01_21_2021_vero #8_round 2_otter.ai,4215,Participant 10,4075,"No, I know if you if you straighten it out to use as a needle. But then where are you going to thread it through the end?",17,53,NA,4214,2,10,NA,1073,NA,2,FALSE,370,370,0,2,0,0,0
01_21_2021_vero #8_round 2_otter.ai,4216,Participant 370,4075,I guess the end part you can bend it a little bit.,18,1,NA,4215,2,370,NA,1081,NA,2,FALSE,10,10,0,1,0,0,0
01_21_2021_vero #8_round 2_otter.ai,4217,Participant 10,4075,Hmm.,18,6,NA,4216,2,10,NA,1086,NA,2,FALSE,370,370,0,0,0,0,0
01_21_2021_vero #8_round 2_otter.ai,4218,Participant 10,4075,I do a lot quite a bit of sewing. And I'm very skeptical of this.,18,6,NA,4217,2,10,NA,1086,NA,2,FALSE,10,all,0,2,0,0,0
01_21_2021_vero #8_round 2_otter.ai,4219,Participant 370,4075,The fabric though because the,18,12,NA,4218,2,370,NA,1092,NA,2,FALSE,10,all,0,0,0,0,0
01_21_2021_vero #8_round 2_otter.ai,4220,Participant 10,4075,"the the paperclip is big, like",18,17,NA,4219,2,10,NA,1097,NA,2,FALSE,370,all,0,0,0,0,0
01_21_2021_vero #8_round 2_otter.ai,4221,Participant 370,4075,Then maybe not for sewing maybe for other things. Needle that doesn't need that,18,21,NA,4220,2,370,NA,1101,NA,2,FALSE,10,all,0,0,0,0,0
01_21_2021_vero #8_round 2_otter.ai,4222,Participant 10,4075,"It doesn't matter if it makes a hole in it. Could be like hole punch. Right? You can use it as a whole punch. Yeah,",18,28,NA,4221,2,10,NA,1108,NA,2,FALSE,370,all,0,0,0,0,0
01_21_2021_vero #8_round 2_otter.ai,4223,Participant 370,4075,yes. Yes. Yes. Can you use it to scratch? Things like lottery tickets?,18,38,NA,4222,2,370,NA,1118,NA,2,FALSE,10,"10,all","1,0","0,0","0,0","0,0","0,0"
01_21_2021_vero #8_round 2_otter.ai,4224,Participant 10,4075,Yeah. That's definitely a use,19,15,NA,4223,2,10,NA,1155,NA,2,FALSE,370,370,1,0,0,0,0
01_21_2021_vero #8_round 2_otter.ai,4225,Participant 370,4075,"Oh, fish hook from the previous survival task.",19,19,NA,4224,2,370,NA,1159,NA,2,FALSE,10,all,0,0,0,0,0
01_21_2021_vero #8_round 2_otter.ai,4226,Participant 10,4075,Oh.,19,35,NA,4225,2,10,NA,1175,NA,2,FALSE,370,370,0,0,0,0,0
01_21_2021_vero #8_round 2_otter.ai,4227,Participant 10,4075,Good idea.,19,35,NA,4226,2,10,NA,1175,NA,2,FALSE,10,370,1,0,0,0,0
01_21_2021_vero #8_round 2_otter.ai,4228,Vero,4075,I have an idea. What about as a splint?,19,39,NA,4227,2,NA,NA,1179,NA,2,TRUE,10,all,0,0,0,0,0
01_21_2021_vero #8_round 2_otter.ai,4229,Participant 10,4075,A what?,19,42,NA,4228,2,10,NA,1182,NA,2,FALSE,NA,0,0,0,0,0,0
01_21_2021_vero #8_round 2_otter.ai,4230,Vero,4075,As a splint,19,44,NA,4229,2,NA,NA,1184,NA,2,TRUE,10,10,0,0,0,0,0
01_21_2021_vero #8_round 2_otter.ai,4231,Participant 10,4075,What is a splint?,19,46,NA,4230,2,10,NA,1186,NA,2,FALSE,NA,0,0,0,0,0,0
01_21_2021_vero #8_round 2_otter.ai,4232,Vero,4075,a splint is a piece of rigid material that can be used to support a broken bone and keep it in position when it has been set back in place.,19,48,NA,4231,2,NA,NA,1188,NA,2,TRUE,10,10,0,0,0,0,0
01_21_2021_vero #8_round 2_otter.ai,4233,Participant 10,4075,I don't think I know any bone that that's tiny. Maybe maybe animal bones like if there was like a tiny bird or something like that.,19,57,NA,4232,2,10,NA,1197,NA,2,FALSE,NA,0,0,2,0,0,0
01_21_2021_vero #8_round 2_otter.ai,4234,Participant 370,4075,Yeah.,20,9,NA,4233,2,370,NA,1209,NA,2,FALSE,10,10,0,0,0,0,0
01_21_2021_vero #8_round 2_otter.ai,4235,Participant 10,4075,I would write like splint for tiny animals.,20,12,NA,4234,2,10,NA,1212,NA,2,FALSE,370,all,0,0,0,0,0
01_21_2021_vero #8_round 2_otter.ai,4236,Participant 370,4075,How do you spell? Vero how do you spell splint?,20,26,NA,4235,2,370,NA,1226,NA,2,FALSE,10,"all,0","0,0","0,0","0,0","0,0","0,0"
01_21_2021_vero #8_round 2_otter.ai,4237,Vero,4075,It's spelled s p l i n t,20,32,NA,4236,2,NA,NA,1232,NA,2,TRUE,370,370,0,0,0,0,0
01_21_2021_vero #8_round 2_otter.ai,4238,Vero,4075,i have an idea what about as a button pusher?,20,32,NA,4237,2,NA,NA,1232,NA,2,TRUE,NA,all,0,0,0,0,0
01_21_2021_vero #8_round 2_otter.ai,4239,Participant 10,4075,button pusher sure,21,1,NA,4238,2,10,NA,1261,NA,2,FALSE,NA,0,1,0,0,0,0
01_21_2021_vero #8_round 2_otter.ai,4240,Participant 10,4075,He has a lot of ideas which is good cuz I don't think I have that many,21,1,NA,4239,2,10,NA,1261,NA,2,FALSE,10,all,1,0,1,0,2
01_21_2021_vero #8_round 2_otter.ai,4241,Vero,4075,I have an idea what about as a bubble wand,21,42,NA,4240,2,NA,NA,1302,NA,2,TRUE,10,all,0,0,0,0,0
01_21_2021_vero #8_round 2_otter.ai,4242,Participant 370,4075,as a what?,21,47,NA,4241,2,370,NA,1307,NA,2,FALSE,NA,0,0,0,0,0,0
01_21_2021_vero #8_round 2_otter.ai,4243,Participant 10,4075,A bubble wand. But isn't it too tiny to like effectively use as a bubble wand,21,48,NA,4242,2,10,NA,1308,NA,2,FALSE,370,370,0,2,0,0,0
01_21_2021_vero #8_round 2_otter.ai,4244,Participant 370,4075,"I guess if you want to make tiny bubbles,",21,58,NA,4243,2,370,NA,1318,NA,2,FALSE,10,10,0,0,0,0,0
01_21_2021_vero #8_round 2_otter.ai,4245,Participant 10,4075,tiny bubbles. Okay sure,21,59,NA,4244,2,10,NA,1319,NA,2,FALSE,370,370,1,0,0,0,0
01_21_2021_vero #8_round 2_otter.ai,4246,Vero,4075,I have an idea. What about as a twist tie?,22,20,NA,4245,2,NA,NA,1340,NA,2,TRUE,10,all,0,0,0,0,0
01_21_2021_vero #8_round 2_otter.ai,4247,Participant 10,4075,My survey just timed out.,22,27,NA,4246,2,10,NA,1347,NA,2,FALSE,NA,all,0,0,0,0,0
01_21_2021_vero #8_round 2_otter.ai,4248,Participant 370,4075,Oh mine too,22,32,NA,4247,2,370,NA,1352,NA,2,FALSE,10,10,0,0,0,0,0
01_21_2021_vero #8_round 2_otter.ai,4249,Participant 10,4075,okay. Okay we have survey questions.,22,33,NA,4248,2,10,NA,1353,NA,2,FALSE,370,"370,all","0,0","0,0","0,0","0,0","0,0"
