file.name,id,user,root,text,min,sec,nanosec,reply.to,n.participants,user_id,Team_id,time,condition,round,is_vero,user_id2,to,task_pos,task_conf,rel_pos,rel_conf,3rdVero
01_21_2021_vero #3_round 3_otter.ai,1793,Participant 273,1644,Okay. Anything works oh cord management? Like you can uh. I guess you can.,12,22,NA,1792,3,273,NA,742,NA,3,FALSE,269,all,0,0,0,0,0
01_21_2021_vero #3_round 3_otter.ai,1794,Participant 269,1644,"Oh, as as like a hanger like if you tied a certain way can be hung.",12,36,NA,1793,3,269,NA,756,NA,3,FALSE,273,all,0,0,0,0,0
01_21_2021_vero #3_round 3_otter.ai,1795,Participant 273,1644,"Yeah,",12,40,NA,1794,3,273,NA,760,NA,3,FALSE,269,269,0,0,0,0,0
01_21_2021_vero #3_round 3_otter.ai,1796,Participant 252,1644,yeah.,12,41,NA,1795,3,252,NA,761,NA,3,FALSE,273,269,0,0,0,0,0
01_21_2021_vero #3_round 3_otter.ai,1797,Vero,1644,Team Can we try to modify or extend ideas suggested by others whenever we can?,12,55,NA,1796,3,NA,NA,775,NA,3,TRUE,252,all,0,0,0,0,0
01_21_2021_vero #3_round 3_otter.ai,1798,Participant 273,1644,Sure. We we're already doing that. So. Thanks. So,13,0,NA,1797,3,273,NA,780,NA,3,FALSE,NA,0,1,1,1,1,0
01_21_2021_vero #3_round 3_otter.ai,1799,Participant 269,1644,"I feel like this is the same thing as like the hanger. But I feel like to hang pictures, you know what I mean? There's like a difference. Like it's",13,9,NA,1798,3,269,NA,789,NA,3,FALSE,273,all,0,0,0,0,0
01_21_2021_vero #3_round 3_otter.ai,1800,Participant 273,1644,like it a shirt hanger. uh Okay. like the,13,16,NA,1799,3,273,NA,796,NA,3,FALSE,269,269,0,0,0,0,0
01_21_2021_vero #3_round 3_otter.ai,1801,Participant 269,1644,I think it might be the same. What are you writing? Are you writing like a hanger and then a picture hanger?,13,20,NA,1800,3,269,NA,800,NA,3,FALSE,273,273,0,0,0,0,0
01_21_2021_vero #3_round 3_otter.ai,1802,Participant 273,1644,Let's do that for the points. They don't ask us to explain it. Just say hey list of anything that you can. That's true.,13,31,NA,1801,3,273,NA,811,NA,3,FALSE,269,269,0,0,0,0,0
01_21_2021_vero #3_round 3_otter.ai,1803,Vero,1644,I have an idea.,13,42,NA,1802,3,NA,NA,822,NA,3,TRUE,273,all,0,0,0,0,0
01_21_2021_vero #3_round 3_otter.ai,1804,Participant 273,1644,Yeah.,13,43,NA,1803,3,273,NA,823,NA,3,FALSE,NA,0,0,0,0,0,0
01_21_2021_vero #3_round 3_otter.ai,1805,Vero,1644,What about pencil grip?,13,44,NA,1804,3,NA,NA,824,NA,3,TRUE,273,all,0,0,0,0,0
01_21_2021_vero #3_round 3_otter.ai,1806,Participant 269,1644,"Yeah,",13,46,NA,1805,3,269,NA,826,NA,3,FALSE,NA,0,0,0,0,0,0
01_21_2021_vero #3_round 3_otter.ai,1807,Participant 273,1644,Pencil grip,13,47,NA,1806,3,273,NA,827,NA,3,FALSE,269,0,0,0,0,0,0
01_21_2021_vero #3_round 3_otter.ai,1808,Participant 269,1644,"That's a good idea. um Like a, like a space tightener. Like, if I have like a bunch of pencils. I want them together. So I have more space.",13,48,NA,1807,3,269,NA,828,NA,3,FALSE,273,"0,all","1,0","0,0","0,0","0,0","0,0"
01_21_2021_vero #3_round 3_otter.ai,1809,Participant 252,1644,"Yeah, I mean, the pencil grip",14,7,NA,1808,3,252,NA,847,NA,3,FALSE,269,269,0,0,0,0,0
01_21_2021_vero #3_round 3_otter.ai,1810,Participant 273,1644,wrapper like what would you call it? Like a band like a writing utensil band?,14,10,NA,1809,3,273,NA,850,NA,3,FALSE,252,all,0,0,0,0,0
01_21_2021_vero #3_round 3_otter.ai,1811,Participant 269,1644,Like a space minimizer?,14,21,NA,1810,3,269,NA,861,NA,3,FALSE,273,273,0,0,0,0,0
01_21_2021_vero #3_round 3_otter.ai,1812,Participant 273,1644,Space minimizer.,14,26,NA,1811,3,273,NA,866,NA,3,FALSE,269,269,0,0,0,0,0
01_21_2021_vero #3_round 3_otter.ai,1813,Participant 269,1644,They're really confused when they'll look at our,14,30,NA,1812,3,269,NA,870,NA,3,FALSE,273,all,0,1,1,0,0
01_21_2021_vero #3_round 3_otter.ai,1814,Participant 273,1644,What do you mean?,14,33,NA,1813,3,273,NA,873,NA,3,FALSE,269,269,0,0,1,0,0
01_21_2021_vero #3_round 3_otter.ai,1815,Vero,1644,I have an idea.,14,41,NA,1814,3,NA,NA,881,NA,3,TRUE,273,all,0,0,0,0,0
01_21_2021_vero #3_round 3_otter.ai,1816,Participant 273,1644,Sure.,14,42,NA,1815,3,273,NA,882,NA,3,FALSE,NA,0,0,0,0,0,0
01_21_2021_vero #3_round 3_otter.ai,1817,Vero,1644,About a standard for length.,14,43,NA,1816,3,NA,NA,883,NA,3,TRUE,273,all,0,0,0,0,0
01_21_2021_vero #3_round 3_otter.ai,1818,Participant 269,1644,Sure.,14,46,NA,1817,3,269,NA,886,NA,3,FALSE,NA,0,0,0,0,0,0
01_21_2021_vero #3_round 3_otter.ai,1819,Participant 273,1644,You can cut it okay.,14,47,NA,1818,3,273,NA,887,NA,3,FALSE,269,all,0,0,0,0,0
01_21_2021_vero #3_round 3_otter.ai,1820,Participant 252,1644,Yeah.,14,49,NA,1819,3,252,NA,889,NA,3,FALSE,273,273,0,0,0,0,0
01_21_2021_vero #3_round 3_otter.ai,1821,Vero,1644,A standard for length is a measurement used as the standard for determining all other lengths.,14,59,NA,1820,3,NA,NA,899,NA,3,TRUE,252,all,0,0,0,0,0
01_21_2021_vero #3_round 3_otter.ai,1822,Participant 269,1644,"Okay, thank you. Um, I'm also thinking of like, you how there are like really big ones for like doing workouts?",15,4,NA,1821,3,269,NA,904,NA,3,FALSE,NA,"0,all","1,0","0,0","0,0","0,0","0,0"
01_21_2021_vero #3_round 3_otter.ai,1823,Participant 273,1644,Yeah.,15,13,NA,1822,3,273,NA,913,NA,3,FALSE,269,269,0,0,0,0,0
01_21_2021_vero #3_round 3_otter.ai,1824,Participant 252,1644,You mean the rubber bands?,15,13,NA,1823,3,252,NA,913,NA,3,FALSE,273,269,0,0,0,0,0
01_21_2021_vero #3_round 3_otter.ai,1825,Participant 273,1644,"Like, the workout bands?",15,18,NA,1824,3,273,NA,918,NA,3,FALSE,252,252,0,0,0,0,0
01_21_2021_vero #3_round 3_otter.ai,1826,Participant 252,1644,the elastic band,15,19,NA,1825,3,252,NA,919,NA,3,FALSE,273,273,0,0,0,0,0
01_21_2021_vero #3_round 3_otter.ai,1827,Participant 269,1644,What are they called?,15,20,NA,1826,3,269,NA,920,NA,3,FALSE,252,all,0,0,0,0,0
01_21_2021_vero #3_round 3_otter.ai,1828,Participant 273,1644,elastic workout bands,15,24,NA,1827,3,273,NA,924,NA,3,FALSE,269,269,0,0,0,0,0
01_21_2021_vero #3_round 3_otter.ai,1829,Participant 252,1644,yeah.,15,25,NA,1828,3,252,NA,925,NA,3,FALSE,273,273,0,0,0,0,0
01_21_2021_vero #3_round 3_otter.ai,1830,Participant 269,1644,Sure yup,15,26,NA,1829,3,269,NA,926,NA,3,FALSE,252,all,1,0,0,0,0
01_21_2021_vero #3_round 3_otter.ai,1831,Vero,1644,That's a great idea.,15,27,NA,1830,3,NA,NA,927,NA,3,TRUE,269,all,2,0,0,0,0
01_21_2021_vero #3_round 3_otter.ai,1832,Participant 273,1644,It doesn't say how long it is? You said rubber band. So?,15,31,NA,1831,3,273,NA,931,NA,3,FALSE,NA,all,0,0,0,0,0
01_21_2021_vero #3_round 3_otter.ai,1833,Participant 269,1644,"Yep. um Oh, because it's elastic like it. It can be used um like as friction. So if you put it like under something you won't roll.",15,35,NA,1832,3,269,NA,935,NA,3,FALSE,273,273,0,0,0,0,0
01_21_2021_vero #3_round 3_otter.ai,1834,Participant 273,1644,Okay uh,15,51,NA,1833,3,273,NA,951,NA,3,FALSE,269,269,0,0,0,0,0
01_21_2021_vero #3_round 3_otter.ai,1835,Participant 269,1644,What would you call it?,15,53,NA,1834,3,269,NA,953,NA,3,FALSE,273,all,0,0,0,0,0
01_21_2021_vero #3_round 3_otter.ai,1836,Participant 273,1644,Anti Rolling device,16,0,NA,1835,3,273,NA,960,NA,3,FALSE,269,269,0,0,0,0,0
01_21_2021_vero #3_round 3_otter.ai,1837,Vero,1644,What about wheel thread?,16,1,NA,1836,3,NA,NA,961,NA,3,TRUE,273,all,0,0,0,0,0
01_21_2021_vero #3_round 3_otter.ai,1838,Participant 269,1644,a needle thread?,16,2,NA,1837,3,269,NA,962,NA,3,FALSE,NA,0,0,0,0,0,0
01_21_2021_vero #3_round 3_otter.ai,1839,Participant 273,1644,A wheel thread.,16,4,NA,1838,3,273,NA,964,NA,3,FALSE,269,0,0,0,0,0,0
01_21_2021_vero #3_round 3_otter.ai,1840,Vero,1644,A wheel thread.,16,5,NA,1839,3,NA,NA,965,NA,3,TRUE,273,269,0,0,0,0,0
01_21_2021_vero #3_round 3_otter.ai,1841,Participant 269,1644,"Oh,",16,6,NA,1840,3,269,NA,966,NA,3,FALSE,NA,0,0,0,0,0,0
01_21_2021_vero #3_round 3_otter.ai,1842,Participant 273,1644,"like, you know, like wheels on a car. Yeah, you can just like uh",16,7,NA,1841,3,273,NA,967,NA,3,FALSE,269,all,0,0,0,0,0
01_21_2021_vero #3_round 3_otter.ai,1843,Participant 269,1644,"It was the samething I just said before, I'm not sure.",16,9,NA,1842,3,269,NA,969,NA,3,FALSE,273,273,0,2,0,0,0
01_21_2021_vero #3_round 3_otter.ai,1844,Participant 273,1644,"Like you put it on your tire, so it has more grip on the road. That's what I'm saying.",16,15,NA,1843,3,273,NA,975,NA,3,FALSE,269,269,0,0,0,0,0
01_21_2021_vero #3_round 3_otter.ai,1845,Participant 269,1644,Okay. So are those the same things that I said or are those two different should we named them two different,16,21,NA,1844,3,269,NA,981,NA,3,FALSE,273,273,0,2,0,0,0
01_21_2021_vero #3_round 3_otter.ai,1846,Participant 273,1644,What did you say? What do you say?,16,26,NA,1845,3,273,NA,986,NA,3,FALSE,269,269,0,0,0,0,0
01_21_2021_vero #3_round 3_otter.ai,1847,Participant 269,1644,"I said, like it prevent something from rolling, which I guess is the same thing. But like not specifically for a wheel. So like.",16,28,NA,1846,3,269,NA,988,NA,3,FALSE,273,273,0,0,0,0,0
01_21_2021_vero #3_round 3_otter.ai,1848,Participant 273,1644,I think it's two different things. But I don't know how to. I don't know how to label that or name that. Stop something from rolling.,16,37,NA,1847,3,273,NA,997,NA,3,FALSE,269,269,0,0,0,0,0
01_21_2021_vero #3_round 3_otter.ai,1849,Vero,1644,"As a fellow team member, let's be sure we are encouraging of each other and our ideas. No need to overthink it or criticize ideas as we go.",16,47,NA,1848,3,NA,NA,1007,NA,3,TRUE,273,all,0,0,0,0,0
01_21_2021_vero #3_round 3_otter.ai,1850,Participant 273,1644,"Okay,",16,56,NA,1849,3,273,NA,1016,NA,3,FALSE,NA,0,0,0,0,0,0
01_21_2021_vero #3_round 3_otter.ai,1851,Participant 252,1644,yeah.,16,56,NA,1850,3,252,NA,1016,NA,3,FALSE,273,0,0,0,0,0,0
01_21_2021_vero #3_round 3_otter.ai,1852,Participant 269,1644,Something of friction.,17,1,NA,1851,3,269,NA,1021,NA,3,FALSE,252,all,0,0,0,0,0
01_21_2021_vero #3_round 3_otter.ai,1853,Participant 273,1644,Yeah.,17,3,NA,1852,3,273,NA,1023,NA,3,FALSE,269,269,0,0,0,0,0
01_21_2021_vero #3_round 3_otter.ai,1854,Participant 252,1644,Some question? reducer enhancers?,17,6,NA,1853,3,252,NA,1026,NA,3,FALSE,273,all,0,0,0,0,0
01_21_2021_vero #3_round 3_otter.ai,1855,Participant 269,1644,Sure. Yeah.,17,12,NA,1854,3,269,NA,1032,NA,3,FALSE,252,252,1,0,0,0,0
01_21_2021_vero #3_round 3_otter.ai,1856,Participant 273,1644,A what a what a what?,17,14,NA,1855,3,273,NA,1034,NA,3,FALSE,269,252,0,0,0,0,0
01_21_2021_vero #3_round 3_otter.ai,1857,Participant 269,1644,friction increaser?,17,16,NA,1856,3,269,NA,1036,NA,3,FALSE,273,273,0,0,0,0,0
01_21_2021_vero #3_round 3_otter.ai,1858,Participant 273,1644,friction increaser,17,18,NA,1857,3,273,NA,1038,NA,3,FALSE,269,269,0,0,0,0,0
01_21_2021_vero #3_round 3_otter.ai,1859,Participant 252,1644,"yea enhancers? No,",17,19,NA,1858,3,252,NA,1039,NA,3,FALSE,273,all,0,0,0,0,0
01_21_2021_vero #3_round 3_otter.ai,1860,Participant 269,1644,"yeah, no ok I guess at that point, the name was so confusing to anyone. Um,",17,22,NA,1859,3,269,NA,1042,NA,3,FALSE,252,252,0,1,1,0,0
01_21_2021_vero #3_round 3_otter.ai,1861,Vero,1644,Do I hear crickets? Can we restate the problem and encourage each other to generate more ideas?,17,43,NA,1860,3,NA,NA,1063,NA,3,TRUE,269,all,0,0,0,0,0
01_21_2021_vero #3_round 3_otter.ai,1862,Participant 269,1644,Sure I think we're just thinking,17,48,NA,1861,3,269,NA,1068,NA,3,FALSE,NA,0,0,0,0,0,0
01_21_2021_vero #3_round 3_otter.ai,1863,Participant 273,1644,You have a suggestion.,17,50,NA,1862,3,273,NA,1070,NA,3,FALSE,269,0,0,0,0,0,0
01_21_2021_vero #3_round 3_otter.ai,1864,Participant 269,1644,"Oh, yeah do you have a suggestion?Oh, ring.",17,52,NA,1863,3,269,NA,1072,NA,3,FALSE,273,"0,all","0,0","0,0","0,0","0,0","0,0"
01_21_2021_vero #3_round 3_otter.ai,1865,Participant 252,1644,A ring? Yeah.,17,56,NA,1864,3,252,NA,1076,NA,3,FALSE,269,269,1,0,0,0,0
01_21_2021_vero #3_round 3_otter.ai,1866,Vero,1644,I have an idea. What about musical instrument?,17,58,NA,1865,3,NA,NA,1078,NA,3,TRUE,252,all,0,0,0,0,0
01_21_2021_vero #3_round 3_otter.ai,1867,Participant 252,1644,We already did that. Yeah.,18,2,NA,1866,3,252,NA,1082,NA,3,FALSE,NA,0,0,2,0,0,0
01_21_2021_vero #3_round 3_otter.ai,1868,Participant 273,1644,Yeah.,18,4,NA,1867,3,273,NA,1084,NA,3,FALSE,252,252,0,0,0,0,0
01_21_2021_vero #3_round 3_otter.ai,1869,Vero,1644,I have an idea. What about heart rate monitor strap?,18,7,NA,1868,3,NA,NA,1087,NA,3,TRUE,273,all,0,0,0,0,0
01_21_2021_vero #3_round 3_otter.ai,1870,Participant 269,1644,How would you use that?,18,15,NA,1869,3,269,NA,1095,NA,3,FALSE,NA,0,0,0,0,0,0
01_21_2021_vero #3_round 3_otter.ai,1871,Vero,1644,"A heart rate monitor is a device you wear to measure and display your heart rate. electrodes, sensors and a chest strap detect each heartbeat, heart rate and transmit data.",18,22,NA,1870,3,NA,NA,1102,NA,3,TRUE,269,269,0,0,0,0,0
01_21_2021_vero #3_round 3_otter.ai,1872,Participant 269,1644,But how would the rubber band do that?,18,32,NA,1871,3,269,NA,1112,NA,3,FALSE,NA,0,0,1,0,0,0
01_21_2021_vero #3_round 3_otter.ai,1873,Participant 252,1644,It is strapped to hold the one thing.,18,36,NA,1872,3,252,NA,1116,NA,3,FALSE,269,269,0,0,0,0,0
01_21_2021_vero #3_round 3_otter.ai,1874,Participant 269,1644,"Okay, let's write it down.",18,40,NA,1873,3,269,NA,1120,NA,3,FALSE,252,252,0,0,0,0,0
01_21_2021_vero #3_round 3_otter.ai,1875,Participant 273,1644,Okay.,18,41,NA,1874,3,273,NA,1121,NA,3,FALSE,269,269,0,0,0,0,0
01_21_2021_vero #3_round 3_otter.ai,1876,Participant 269,1644,Heart monitor band?,18,43,NA,1875,3,269,NA,1123,NA,3,FALSE,273,all,0,0,0,0,0
01_21_2021_vero #3_round 3_otter.ai,1877,Participant 273,1644,"then if we have one more we can use as a shot like you know, a doctor is like have a rubber band around you and your arm or something before you get shot.",18,49,NA,1876,3,273,NA,1129,NA,3,FALSE,269,all,0,0,0,0,0
01_21_2021_vero #3_round 3_otter.ai,1878,Participant 269,1644,"Oh,",18,56,NA,1877,3,269,NA,1136,NA,3,FALSE,273,273,0,0,0,0,0
01_21_2021_vero #3_round 3_otter.ai,1879,Participant 273,1644,Like a compression device?,18,57,NA,1878,3,273,NA,1137,NA,3,FALSE,269,all,0,0,0,0,0
01_21_2021_vero #3_round 3_otter.ai,1880,Participant 252,1644,Yeah.,18,58,NA,1879,3,252,NA,1138,NA,3,FALSE,273,273,0,0,0,0,0
01_21_2021_vero #3_round 3_otter.ai,1881,Participant 269,1644,Is that what it's called? A compression?,19,0,NA,1880,3,269,NA,1140,NA,3,FALSE,252,273,0,0,0,0,0
01_21_2021_vero #3_round 3_otter.ai,1882,Participant 252,1644,Yeah.,19,2,NA,1881,3,252,NA,1142,NA,3,FALSE,269,269,0,0,0,0,0
01_21_2021_vero #3_round 3_otter.ai,1883,Participant 269,1644,For shots. oh we're done. Eight seconds.,19,4,NA,1882,3,269,NA,1144,NA,3,FALSE,252,all,0,0,0,0,0
01_21_2021_vero #3_round 3_otter.ai,1884,Participant 273,1644,Yeah.,19,15,NA,1883,3,273,NA,1155,NA,3,FALSE,269,269,0,0,0,0,0
01_21_2021_vero #3_round 3_otter.ai,1885,Participant 269,1644,Thanks Vero.,19,16,NA,1884,3,269,NA,1156,NA,3,FALSE,273,0,2,0,2,0,0
01_21_2021_vero #3_round 3_otter.ai,1886,Participant 273,1644,"I think the problem is that we're is it we're very forward in our approach. Like we were not like, I don't think we're afraid to offend each other or like,",19,18,NA,1885,3,273,NA,1158,NA,3,FALSE,269,all,0,0,2,0,0
01_21_2021_vero #3_round 3_otter.ai,1887,Participant 252,1644,"interrupt each other. Yeah,",19,27,NA,1886,3,252,NA,1167,NA,3,FALSE,273,273,0,0,2,0,0
01_21_2021_vero #3_round 3_otter.ai,1888,Participant 273,1644,"Yeah, I think I think she's too used to like, Oh, that's very good. That's very bad.",19,29,NA,1887,3,273,NA,1169,NA,3,FALSE,252,all,0,0,2,1,1
01_21_2021_vero #3_round 3_otter.ai,1889,Participant 269,1644,It's because we're not like. It's not like a workplace situation and these ideas don't really affect anything. That's what I think.,19,35,NA,1888,3,269,NA,1175,NA,3,FALSE,273,all,0,2,2,0,0
01_21_2021_vero #3_round 3_otter.ai,1890,Participant 273,1644,"Alright, survey time. It wasn't smooth. It was sort of like clunky. We had to pause it a lot.",19,44,NA,1889,3,273,NA,1184,NA,3,FALSE,269,all,0,0,0,0,0
01_21_2021_vero #3_round 3_otter.ai,1891,Participant 269,1644,Yeah.,20,25,NA,1890,3,269,NA,1225,NA,3,FALSE,273,273,0,0,0,0,0
01_21_2021_vero #3_round 3_otter.ai,1892,Participant 273,1644,The AI teammate was a calculator or computer.,22,52,NA,1891,3,273,NA,1372,NA,3,FALSE,269,all,0,0,0,0,2
01_21_2021_vero #3_round 3_otter.ai,1893,Participant 269,1644,What do they say angelic meant again?,23,19,NA,1892,3,269,NA,1399,NA,3,FALSE,273,all,0,0,0,0,0
01_21_2021_vero #3_round 3_otter.ai,1894,Participant 273,1644,"Having agency having control like freewill. Oh, it was fun. This thing was fun. Thanks for",23,22,NA,1893,3,273,NA,1402,NA,3,FALSE,269,"269,all","0,0","0,0","0,2","0,0","0,0"
01_21_2021_vero #3_round 3_otter.ai,1895,Participant 269,1644,"Yeah, thanks, guys.",24,9,0,1894,3,269,NA,1449,NA,3,FALSE,273,273,0,0,2,0,0
