file.name,id,user,root,text,min,sec,nanosec,reply.to,n.participants,user_id,Team_id,time,condition,round,is_vero,user_id2,to,task_pos,task_conf,rel_pos,rel_conf,3rdVero
02_27_2021_vero #3_task_round 1_otter.ai,12323,Participant 330,12187,Yeah. Okay. Are we allowed to use the chat you think list of what we already put in the chat or...,14,33,NA,12322,3,330,1_3_4,873,taskwork,1,FALSE,766,all,0,0,0,0,0
02_27_2021_vero #3_task_round 1_otter.ai,12324,Participant 766,12187,"I think it goes to everyone. You could change it to individual people, but I don't think we can send it to just this group. It seems like we can put like other people's ideas just not your you don't need to put your own ones individually idea recorded in your pre survey do not need to be rewritten",14,53,NA,12323,3,766,1_3_4,893,taskwork,1,FALSE,330,all,0,0,0,0,0
02_27_2021_vero #3_task_round 1_otter.ai,12325,Participant 424,12187,well yeah they will be counted towards the team score.,15,15,NA,12324,3,424,1_3_4,915,taskwork,1,FALSE,766,766,0,1,0,0,0
02_27_2021_vero #3_task_round 1_otter.ai,12326,Participant 766,12187,Oh okay okay so new ones okay okay you put like building material weapon,15,20,NA,12325,3,766,1_3_4,920,taskwork,1,FALSE,424,all,0,0,0,0,0
02_27_2021_vero #3_task_round 1_otter.ai,12327,Participant 424,12187,yeah I used I used both of those,15,37,NA,12326,3,424,1_3_4,937,taskwork,1,FALSE,766,766,0,1,0,0,0
02_27_2021_vero #3_task_round 1_otter.ai,12328,Participant 766,12187,yeah let's see what,15,39,NA,12327,3,766,1_3_4,939,taskwork,1,FALSE,424,all,0,0,0,0,0
02_27_2021_vero #3_task_round 1_otter.ai,12329,Participant 330,12187,window smasher if you're trapped in a car,15,42,NA,12328,3,330,1_3_4,942,taskwork,1,FALSE,766,all,0,0,0,0,0
02_27_2021_vero #3_task_round 1_otter.ai,12330,Participant 330,12187,and paper tools.,15,42,NA,12329,3,330,1_3_4,942,taskwork,1,FALSE,330,all,0,0,0,0,0
02_27_2021_vero #3_task_round 1_otter.ai,12331,Participant 766,12187,Oh that's a good one,15,46,NA,12330,3,766,1_3_4,946,taskwork,1,FALSE,330,330,2,0,0,0,0
02_27_2021_vero #3_task_round 1_otter.ai,12332,Participant 330,12187,spider or bug squasher bridge weight for a pulley book prop,15,48,NA,12331,3,330,1_3_4,948,taskwork,1,FALSE,766,all,0,0,0,0,0
02_27_2021_vero #3_task_round 1_otter.ai,12333,Participant 424,12187,yeah,15,56,NA,12332,3,424,1_3_4,956,taskwork,1,FALSE,330,330,0,0,0,0,0
02_27_2021_vero #3_task_round 1_otter.ai,12334,Participant 766,12187,it's pretty good,15,58,NA,12333,3,766,1_3_4,958,taskwork,1,FALSE,424,330,1,0,0,0,0
02_27_2021_vero #3_task_round 1_otter.ai,12335,Participant 330,12187,stepstool,15,59,NA,12334,3,330,1_3_4,959,taskwork,1,FALSE,766,all,0,0,0,0,0
02_27_2021_vero #3_task_round 1_otter.ai,12336,Participant 766,12187,oh I think I used a nail filer,16,7,NA,12335,3,766,1_3_4,967,taskwork,1,FALSE,330,all,0,0,0,0,0
02_27_2021_vero #3_task_round 1_otter.ai,12337,Participant 330,12187,oh yeah that's like similar to my sandpaper yes,16,10,NA,12336,3,330,1_3_4,970,taskwork,1,FALSE,766,766,0,0,0,0,0
02_27_2021_vero #3_task_round 1_otter.ai,12338,Participant 766,12187,let's see oh weight to dump bodies underwater and,16,18,NA,12337,3,766,1_3_4,978,taskwork,1,FALSE,330,all,0,0,0,0,0
02_27_2021_vero #3_task_round 1_otter.ai,12339,Participant 424,12187,yeah that's a good time I don't think any of us said that one,16,27,NA,12338,3,424,1_3_4,987,taskwork,1,FALSE,766,766,2,0,0,0,0
02_27_2021_vero #3_task_round 1_otter.ai,12340,Participant 330,12187,"Wait, what did you say",16,31,NA,12339,3,330,1_3_4,991,taskwork,1,FALSE,424,766,0,0,0,0,0
02_27_2021_vero #3_task_round 1_otter.ai,12341,Participant 766,12187,a weight to tie to like a dead body so you can toss it in the ocean,16,33,NA,12340,3,766,1_3_4,993,taskwork,1,FALSE,330,330,0,0,0,0,0
02_27_2021_vero #3_task_round 1_otter.ai,12342,Participant 424,12187,So dead body anchor,16,37,NA,12341,3,424,1_3_4,997,taskwork,1,FALSE,766,766,0,0,0,0,0
02_27_2021_vero #3_task_round 1_otter.ai,12343,Participant 330,12187,general anchor,16,41,NA,12342,3,330,1_3_4,1001,taskwork,1,FALSE,424,all,0,0,0,0,0
02_27_2021_vero #3_task_round 1_otter.ai,12344,Participant 766,12187,Yeah. What else,16,42,NA,12343,3,766,1_3_4,1002,taskwork,1,FALSE,330,330,0,0,0,0,0
02_27_2021_vero #3_task_round 1_otter.ai,12345,Participant 330,12187,did you write nail filer in your in your pre survey?,17,2,NA,12344,3,330,1_3_4,1022,taskwork,1,FALSE,766,766,0,0,0,0,0
02_27_2021_vero #3_task_round 1_otter.ai,12346,Participant 766,12187,"Yeah, I already did. Maybe if you like pulverized it you could get sand or something to do with it?",17,5,NA,12345,3,766,1_3_4,1025,taskwork,1,FALSE,330,330,0,0,0,0,0
02_27_2021_vero #3_task_round 1_otter.ai,12347,Participant 424,12187,I think you can use that as a hammer or like it's a meat tenderizer,17,42,NA,12346,3,424,1_3_4,1062,taskwork,1,FALSE,766,766,0,0,0,0,0
02_27_2021_vero #3_task_round 1_otter.ai,12348,Participant 330,12187,Those are good,17,52,NA,12347,3,330,1_3_4,1072,taskwork,1,FALSE,424,all,2,0,0,0,0
02_27_2021_vero #3_task_round 1_otter.ai,12349,Participant 424,12187,"yeah, that works.",18,10,NA,12348,3,424,1_3_4,1090,taskwork,1,FALSE,330,766,1,0,0,0,0
02_27_2021_vero #3_task_round 1_otter.ai,12350,Participant 766,12187,Weight for exercise.,18,24,NA,12349,3,766,1_3_4,1104,taskwork,1,FALSE,424,all,0,0,0,0,0
02_27_2021_vero #3_task_round 1_otter.ai,12351,Participant 424,12187,That's what I was just thinking.,18,26,NA,12350,3,424,1_3_4,1106,taskwork,1,FALSE,766,766,1,0,0,0,0
02_27_2021_vero #3_task_round 1_otter.ai,12352,Participant 330,12187,Sound Effects,18,52,NA,12351,3,330,1_3_4,1132,taskwork,1,FALSE,424,all,0,0,0,0,0
02_27_2021_vero #3_task_round 1_otter.ai,12353,Participant 330,12187,Yes.,18,52,NA,12352,3,330,1_3_4,1132,taskwork,1,FALSE,330,all,0,0,0,0,0
02_27_2021_vero #3_task_round 1_otter.ai,12354,Participant 766,12187,That's good.,18,59,NA,12353,3,766,1_3_4,1139,taskwork,1,FALSE,330,330,1,0,0,0,0
02_27_2021_vero #3_task_round 1_otter.ai,12355,Participant 424,12187,You know the food plantains. You know how you have to squash them between something. You can use a plantain squasher.,19,9,NA,12354,3,424,1_3_4,1149,taskwork,1,FALSE,766,all,0,0,0,0,0
02_27_2021_vero #3_task_round 1_otter.ai,12356,Participant 330,12187,"Plantain grape squash, grape grape squasher too?",19,19,NA,12355,3,330,1_3_4,1159,taskwork,1,FALSE,424,424,0,0,0,0,0
02_27_2021_vero #3_task_round 1_otter.ai,12357,Participant 424,12187,Yeah.,19,22,NA,12356,3,424,1_3_4,1162,taskwork,1,FALSE,330,330,0,0,0,0,0
02_27_2021_vero #3_task_round 1_otter.ai,12358,Participant 766,12187,Delicious.,19,24,NA,12357,3,766,1_3_4,1164,taskwork,1,FALSE,424,all,1,0,0,0,0
02_27_2021_vero #3_task_round 1_otter.ai,12359,Participant 424,12187,I think you can use it to do something yoga related. Because Don't they have that like brick that they already?,20,7,NA,12358,3,424,1_3_4,1207,taskwork,1,FALSE,766,all,0,0,0,0,0
02_27_2021_vero #3_task_round 1_otter.ai,12360,Participant 766,12187,I don't know anything about yoga.,20,17,NA,12359,3,766,1_3_4,1217,taskwork,1,FALSE,424,424,0,0,0,0,0
02_27_2021_vero #3_task_round 1_otter.ai,12361,Participant 424,12187,"But I think they have like this little, like styrofoam brick that they use. Yeah, and then like they prop themselves up on it with one hand. I've seen that on TV anyway.",20,20,NA,12360,3,424,1_3_4,1220,taskwork,1,FALSE,766,all,0,0,0,0,0
02_27_2021_vero #3_task_round 1_otter.ai,12362,Participant 330,12187,So yoga yoga brick.,20,32,NA,12361,3,330,1_3_4,1232,taskwork,1,FALSE,424,424,0,0,0,0,0
02_27_2021_vero #3_task_round 1_otter.ai,12363,Participant 766,12187,whoever reads this is gonna be like what's that,20,39,NA,12362,3,766,1_3_4,1239,taskwork,1,FALSE,330,all,0,0,1,0,0
02_27_2021_vero #3_task_round 1_otter.ai,12364,Participant 330,12187,something like that for gymnastics students? Like a balanced beam. Would you like a hot? Like a hot board? If you have something that's hot? You don't want it to touch the table?,20,44,NA,12363,3,330,1_3_4,1244,taskwork,1,FALSE,766,all,0,0,0,0,0
02_27_2021_vero #3_task_round 1_otter.ai,12365,Participant 424,12187,trivet,21,49,NA,12364,3,424,1_3_4,1309,taskwork,1,FALSE,330,330,0,0,0,0,0
02_27_2021_vero #3_task_round 1_otter.ai,12366,Participant 330,12187,Is that what you call it?,21,50,NA,12365,3,330,1_3_4,1310,taskwork,1,FALSE,424,424,0,0,0,0,0
02_27_2021_vero #3_task_round 1_otter.ai,12367,Participant 330,12187,How do you spell that?,21,50,NA,12366,3,330,1_3_4,1310,taskwork,1,FALSE,330,424,0,0,0,0,0
02_27_2021_vero #3_task_round 1_otter.ai,12368,Participant 424,12187,t r i v e t trivet,21,54,NA,12367,3,424,1_3_4,1314,taskwork,1,FALSE,330,330,0,0,0,0,0
02_27_2021_vero #3_task_round 1_otter.ai,12369,Participant 766,12187,Good idea. Do you think it can carry water since he has a lot of pores? Like a bucket except a lot worse? like a sponge that doesn't squish?,22,1,NA,12368,3,766,1_3_4,1321,taskwork,1,FALSE,424,all,2,0,0,0,0
02_27_2021_vero #3_task_round 1_otter.ai,12370,Participant 330,12187,Yeah. Like we did we say cutting board yet on the cutting. Or like a stamp. Sort of like if you put like ink on it or something,22,44,NA,12369,3,330,1_3_4,1364,taskwork,1,FALSE,766,766,0,0,0,0,0
02_27_2021_vero #3_task_round 1_otter.ai,12371,Participant 766,12187,That works.,23,14,NA,12370,3,766,1_3_4,1394,taskwork,1,FALSE,330,330,1,0,0,0,0
02_27_2021_vero #3_task_round 1_otter.ai,12372,Participant 330,12187,"No, I need that like",23,24,NA,12371,3,330,1_3_4,1404,taskwork,1,FALSE,766,all,0,0,0,0,0
02_27_2021_vero #3_task_round 1_otter.ai,12373,Participant 330,12187,"no, I need it. I'm gonna study...",23,24,NA,12372,3,330,1_3_4,1404,taskwork,1,FALSE,330,all,0,0,0,0,0
02_27_2021_vero #3_task_round 1_otter.ai,12374,Participant 424,12187,Use it as a ruler.,23,29,NA,12373,3,424,1_3_4,1409,taskwork,1,FALSE,330,all,0,0,0,0,0
02_27_2021_vero #3_task_round 1_otter.ai,12375,Participant 766,12187,"Ruler works. Yeah, that's usually...",23,35,NA,12374,3,766,1_3_4,1415,taskwork,1,FALSE,424,424,1,0,0,0,0
02_27_2021_vero #3_task_round 1_otter.ai,12376,Participant 424,12187,Like a straight edge.,23,37,NA,12375,3,424,1_3_4,1417,taskwork,1,FALSE,766,all,0,0,0,0,0
02_27_2021_vero #3_task_round 1_otter.ai,12377,Participant 766,12187,"Yep, I'm running up.",23,47,NA,12376,3,766,1_3_4,1427,taskwork,1,FALSE,424,all,0,0,0,0,0
02_27_2021_vero #3_task_round 1_otter.ai,12378,Participant 424,12187,Did we get a password.,23,56,NA,12377,3,424,1_3_4,1436,taskwork,1,FALSE,766,all,0,0,0,0,0
02_27_2021_vero #3_task_round 1_otter.ai,12379,Participant 766,12187,It says just complete the next one individually. I think I missed a password.,24,0,0,12378,3,766,1_3_4,1440,taskwork,1,FALSE,424,424,0,0,0,0,0
02_27_2021_vero #3_task_round 1_otter.ai,12380,Participant 330,12187,I don't know what to expect you to see this. If you're like on that tab. You're not,24,14,0,12379,3,330,1_3_4,1454,taskwork,1,FALSE,766,all,0,0,0,0,0
02_27_2021_vero #3_task_round 1_otter.ai,12381,Participant 424,12187,"Yeah, I wasn't looking at zoom at all.",24,20,0,12380,3,424,1_3_4,1460,taskwork,1,FALSE,330,330,1,0,0,0,0
02_27_2021_vero #3_task_round 1_otter.ai,12382,Participant 766,12187,I'll put a message in,24,33,0,12381,3,766,1_3_4,1473,taskwork,1,FALSE,424,all,0,0,0,0,0
02_27_2021_vero #3_task_round 1_otter.ai,12383,Participant 424,12187,Do you think we can just use feel again?,25,13,0,12382,3,424,1_3_4,1513,taskwork,1,FALSE,766,all,0,0,0,0,0
02_27_2021_vero #3_task_round 1_otter.ai,12384,Participant 330,12187,Pack,25,15,0,12383,3,330,1_3_4,1515,taskwork,1,FALSE,424,424,0,0,0,0,0
02_27_2021_vero #3_task_round 1_otter.ai,12385,Participant 766,12187,Pack! We just saw it,25,16,0,12384,3,766,1_3_4,1516,taskwork,1,FALSE,330,424,0,0,0,0,0
02_27_2021_vero #3_task_round 1_otter.ai,12386,Participant 424,12187,is it p a c k?,25,21,0,12385,3,424,1_3_4,1521,taskwork,1,FALSE,766,all,0,0,0,0,0
02_27_2021_vero #3_task_round 1_otter.ai,12387,Participant 766,12187,That's right,25,22,0,12386,3,766,1_3_4,1522,taskwork,1,FALSE,424,424,1,0,0,0,0
