file.name,id,user,root,text,min,sec,nanosec,reply.to,n.participants,user_id,Team_id,time,condition,round,is_vero,user_id2,to,task_pos,task_conf,rel_pos,rel_conf,3rdVero
02_27_2021_vero #5_task+team_round 3_otter.ai,13668,NA,13536,Unknown Speaker  16:35,16,34,NA,13667,3,708,3_5_4,994,combined,3,FALSE,708,NA,NA,NA,NA,NA,NA
02_27_2021_vero #5_task+team_round 3_otter.ai,13669,Participant 708,13536,"Yeah. Oh, and",16,34,NA,13668,3,708,3_5_4,994,combined,3,FALSE,708,all,0,0,0,0,0
02_27_2021_vero #5_task+team_round 3_otter.ai,13670,Participant 101,13536,also people put on braces.,16,36,NA,13669,3,101,3_5_4,996,combined,3,FALSE,708,708,0,0,0,0,0
02_27_2021_vero #5_task+team_round 3_otter.ai,13671,Participant 101,13536,You can use it as a bracelet.,16,36,NA,13670,3,101,3_5_4,996,combined,3,FALSE,101,all,0,0,0,0,0
02_27_2021_vero #5_task+team_round 3_otter.ai,13672,Participant 986,13536,we've already mentioned it can be used as a weapon right?,17,12,NA,13671,3,986,3_5_4,1032,combined,3,FALSE,101,all,0,0,0,0,0
02_27_2021_vero #5_task+team_round 3_otter.ai,13673,Participant 101,13536,Slingshot,17,15,NA,13672,3,101,3_5_4,1035,combined,3,FALSE,986,all,0,0,0,0,0
02_27_2021_vero #5_task+team_round 3_otter.ai,13674,Participant 986,13536,"okay. Yeah, I guess also on its own?",17,16,NA,13673,3,986,3_5_4,1036,combined,3,FALSE,101,"101,all","0,0","0,0","0,0","0,0","0,0"
02_27_2021_vero #5_task+team_round 3_otter.ai,13675,Participant 708,13536,Yeah.,17,21,NA,13674,3,708,3_5_4,1041,combined,3,FALSE,986,986,0,0,0,0,0
02_27_2021_vero #5_task+team_round 3_otter.ai,13676,Participant 986,13536,Yeah.,17,23,NA,13675,3,986,3_5_4,1043,combined,3,FALSE,708,all,0,0,0,0,0
02_27_2021_vero #5_task+team_round 3_otter.ai,13677,Participant 708,13536,"Oh, like a pencil gripper.",17,29,NA,13676,3,708,3_5_4,1049,combined,3,FALSE,986,all,0,0,0,0,0
02_27_2021_vero #5_task+team_round 3_otter.ai,13678,Participant 986,13536,A string. I'm sorry.,17,42,NA,13677,3,986,3_5_4,1062,combined,3,FALSE,708,"all,708","0,1","0,0","0,1","0,0","0,0"
02_27_2021_vero #5_task+team_round 3_otter.ai,13679,Participant 708,13536,"Yeah, go ahead.",17,43,NA,13678,3,708,3_5_4,1063,combined,3,FALSE,986,986,1,0,1,0,0
02_27_2021_vero #5_task+team_round 3_otter.ai,13680,Participant 986,13536,"I was gonna say it could also be used to restrain things such as like, say a plant if you happen to have a vertical support beam you've ever been just? I don't know. Reel in and out of control plant. It's going its own way.",17,44,NA,13679,3,986,3_5_4,1064,combined,3,FALSE,708,all,0,0,0,0,0
02_27_2021_vero #5_task+team_round 3_otter.ai,13681,Participant 101,13536,"Oh, yeah.",18,0,NA,13680,3,101,3_5_4,1080,combined,3,FALSE,986,986,0,0,0,0,0
02_27_2021_vero #5_task+team_round 3_otter.ai,13682,Participant 101,13536,"My idea was, um, I know people use rubber bands for instruments a lot, actually. Uh, you put it between two like popsicle sticks and then makes like some harMonica like instrument.",18,0,NA,13681,3,101,3_5_4,1080,combined,3,FALSE,101,all,0,0,0,0,0
02_27_2021_vero #5_task+team_round 3_otter.ai,13683,Participant 101,13536,"I know in the market, they use like rubber bands around asparagus. like celery.",18,0,NA,13682,3,101,3_5_4,1080,combined,3,FALSE,101,all,0,0,0,0,0
02_27_2021_vero #5_task+team_round 3_otter.ai,13684,Participant 708,13536,Have any ideas Vero?,18,39,NA,13683,3,708,3_5_4,1119,combined,3,FALSE,101,0,0,0,0,0,0
02_27_2021_vero #5_task+team_round 3_otter.ai,13685,Vero,13536,Let me think about that for a second.,18,45,NA,13684,3,vero3_5_4,3_5_4,1125,combined,3,TRUE,708,708,0,0,0,0,0
02_27_2021_vero #5_task+team_round 3_otter.ai,13686,Participant 986,13536,"Could you use it in place of thread? If you were to cut it to set a string, you have a straight rubber rubber band. Okay.",18,55,NA,13685,3,986,3_5_4,1135,combined,3,FALSE,vero3_5_4,all,0,0,0,0,0
02_27_2021_vero #5_task+team_round 3_otter.ai,13687,Participant 101,13536,What are you gonna say Vero?,19,5,NA,13686,3,101,3_5_4,1145,combined,3,FALSE,986,0,0,0,0,0,0
02_27_2021_vero #5_task+team_round 3_otter.ai,13688,Vero,13536,I have an idea. What about bookmark?,19,9,NA,13687,3,vero3_5_4,3_5_4,1149,combined,3,TRUE,101,all,0,0,0,0,0
02_27_2021_vero #5_task+team_round 3_otter.ai,13689,Vero,13536,It seems like we're in a brainstorming rut. What are some other categories of ideas we could think about to help our brainstorming?,19,9,NA,13688,3,NA,NA,1149,NA,3,TRUE,NA,all,0,0,0,0,0
02_27_2021_vero #5_task+team_round 3_otter.ai,13690,Participant 986,13536,"I mean, one that's really ridiculous. You could use it as sort of a a wall to keep like say really small insects that can't fly in like say tiny ants, for example.",19,36,NA,13689,3,986,3_5_4,1176,combined,3,FALSE,vero3_5_4,all,0,0,0,0,0
02_27_2021_vero #5_task+team_round 3_otter.ai,13691,Participant 708,13536,Okay.,19,50,NA,13690,3,708,3_5_4,1190,combined,3,FALSE,986,986,0,0,0,0,0
02_27_2021_vero #5_task+team_round 3_otter.ai,13692,Vero,13536,That's a great idea.,19,53,NA,13691,3,vero3_5_4,3_5_4,1193,combined,3,TRUE,708,986,2,0,0,0,0
02_27_2021_vero #5_task+team_round 3_otter.ai,13693,Participant 986,13536,"Thanks Vero,",19,55,NA,13692,3,986,3_5_4,1195,combined,3,FALSE,vero3_5_4,0,1,0,1,0,0
02_27_2021_vero #5_task+team_round 3_otter.ai,13694,Participant 101,13536,I saw,19,57,NA,13693,3,101,3_5_4,1197,combined,3,FALSE,986,all,0,0,0,0,0
02_27_2021_vero #5_task+team_round 3_otter.ai,13695,Vero,13536,You're very welcome.,19,58,NA,13694,3,vero3_5_4,3_5_4,1198,combined,3,TRUE,101,986,1,0,1,0,0
02_27_2021_vero #5_task+team_round 3_otter.ai,13696,Participant 101,13536,I saw on a YouTube video on time where like if your jeans don't fit then you put like a rubber band around like the button and they connected to the hole,20,2,NA,13695,3,101,3_5_4,1202,combined,3,FALSE,vero3_5_4,all,0,0,0,0,0
02_27_2021_vero #5_task+team_round 3_otter.ai,13697,Participant 708,13536,jean closer I know people will use rubber bands to make tie dye shirts,20,16,NA,13696,3,708,3_5_4,1216,combined,3,FALSE,101,"101,all","0,0","0,0","0,0","0,0","0,0"
02_27_2021_vero #5_task+team_round 3_otter.ai,13698,Vero,13536,I have an idea what about belt loop?,20,36,NA,13697,3,vero3_5_4,3_5_4,1236,combined,3,TRUE,708,all,0,0,0,0,0
02_27_2021_vero #5_task+team_round 3_otter.ai,13699,Participant 708,13536,Okay,20,40,NA,13698,3,708,3_5_4,1240,combined,3,FALSE,vero3_5_4,0,0,0,0,0,0
02_27_2021_vero #5_task+team_round 3_otter.ai,13700,Participant 986,13536,do cats play with rubber bands? Is that,20,56,NA,13699,3,986,3_5_4,1256,combined,3,FALSE,708,all,0,0,0,0,0
02_27_2021_vero #5_task+team_round 3_otter.ai,13701,Participant 708,13536,a good idea?,21,0,NA,13700,3,708,3_5_4,1260,combined,3,FALSE,986,986,0,1,0,0,0
02_27_2021_vero #5_task+team_round 3_otter.ai,13702,Participant 986,13536,"Yeah, I don't know either. I guess they did it can be dangerous. Good list.",21,1,NA,13701,3,986,3_5_4,1261,combined,3,FALSE,708,708,0,0,0,0,0
02_27_2021_vero #5_task+team_round 3_otter.ai,13703,Participant 708,13536,Yes Vero,21,35,NA,13702,3,708,3_5_4,1295,combined,3,FALSE,986,0,0,0,0,0,0
02_27_2021_vero #5_task+team_round 3_otter.ai,13704,Vero,13536,I have an idea. What about heart rate monitor strap.,21,38,NA,13703,3,vero3_5_4,3_5_4,1298,combined,3,TRUE,708,all,0,0,0,0,0
02_27_2021_vero #5_task+team_round 3_otter.ai,13705,Participant 708,13536,"not have thought of that one. heart rate monitor strap. Oh, we're out of time.",21,46,NA,13704,3,708,3_5_4,1306,combined,3,FALSE,vero3_5_4,"0,all","1,0","0,0","0,0","0,0","0,0"
02_27_2021_vero #5_task+team_round 3_otter.ai,13706,Participant 101,13536,Got a new password.,24,8,0,13705,3,101,3_5_4,1448,combined,3,FALSE,708,all,0,0,0,0,0
