file.name,id,user,root,text,min,sec,nanosec,reply.to,n.participants,user_id,Team_id,time,condition,round,is_vero,user_id2,to,task_pos,task_conf,rel_pos,rel_conf,3rdVero
02_25_2021_vero #2_task_round 3_otter.ai,6655,Participant 346,6515,Yes.,15,53,NA,6654,3,346,121,953,taskwork,3,FALSE,177,177,1,0,0,0,0
02_25_2021_vero #2_task_round 3_otter.ai,6656,Participant 823,6515,"Ah, I'm getting there.",15,55,NA,6655,3,823,121,955,taskwork,3,FALSE,346,177,0,0,0,0,0
02_25_2021_vero #2_task_round 3_otter.ai,6657,Participant 177,6515,Okay.,15,59,NA,6656,3,177,121,959,taskwork,3,FALSE,823,823,0,0,0,0,0
02_25_2021_vero #2_task_round 3_otter.ai,6658,Participant 823,6515,I bet six minutes 30 seconds. So within a minute and a half I'll be able to move forward but you guys go ahead.,16,1,NA,6657,3,823,121,961,taskwork,3,FALSE,177,all,0,0,0,0,0
02_25_2021_vero #2_task_round 3_otter.ai,6659,Participant 177,6515,"We can start copying pasting stuff, I guess.",16,9,NA,6658,3,177,121,969,taskwork,3,FALSE,823,all,0,0,0,0,0
02_25_2021_vero #2_task_round 3_otter.ai,6660,Participant 346,6515,"Yeah, I'm just waiting for you again.",16,11,NA,6659,3,346,121,971,taskwork,3,FALSE,177,177,0,0,0,0,0
02_25_2021_vero #2_task_round 3_otter.ai,6661,Participant 177,6515,Vero. Do you have any uses for a rubber band?,16,22,NA,6660,3,177,121,982,taskwork,3,FALSE,346,0,0,0,0,0,0
02_25_2021_vero #2_task_round 3_otter.ai,6662,Vero,6515,I have no idea. What about bracelet?,16,28,NA,6661,3,vero1_2_1,121,988,taskwork,3,TRUE,177,177,0,0,0,0,0
02_25_2021_vero #2_task_round 3_otter.ai,6663,Participant 177,6515,Vero? Do you have five ideas for a rubber band?,16,33,NA,6662,3,177,121,993,taskwork,3,FALSE,vero1_2_1,0,0,0,0,0,0
02_25_2021_vero #2_task_round 3_otter.ai,6664,Vero,6515,I have an idea. What about wheel tread? I have an idea. What about slingshot? I have an idea. What about pencil grip? I have an idea. What about heart rate monitor strap? I have an idea. What about snare?,16,40,NA,6663,3,vero1_2_1,121,1000,taskwork,3,TRUE,177,177,0,0,0,0,0
02_25_2021_vero #2_task_round 3_otter.ai,6665,Participant 346,6515,I just sent the list with all the ideas. So you can just cut and paste it.,16,57,NA,6664,3,346,121,1017,taskwork,3,FALSE,vero1_2_1,all,0,0,0,0,0
02_25_2021_vero #2_task_round 3_otter.ai,6666,Participant 177,6515,Thank you. Vero do you have five ideas for a rubber band.,17,23,NA,6665,3,177,121,1043,taskwork,3,FALSE,346,"346,0","1,0","0,0","0,0","0,0","0,0"
02_25_2021_vero #2_task_round 3_otter.ai,6667,Vero,6515,That is not in my database.,17,34,NA,6666,3,vero1_2_1,121,1054,taskwork,3,TRUE,177,177,0,0,0,0,0
02_25_2021_vero #2_task_round 3_otter.ai,6668,Participant 823,6515,Maybe he maxes out after giving so many suggestions.,17,40,NA,6667,3,823,121,1060,taskwork,3,FALSE,vero1_2_1,all,0,0,0,0,2
02_25_2021_vero #2_task_round 3_otter.ai,6669,Participant 177,6515,"Yeah, sounds like it.",17,44,NA,6668,3,177,121,1064,taskwork,3,FALSE,823,823,1,0,0,0,0
02_25_2021_vero #2_task_round 3_otter.ai,6670,Participant 346,6515,Next up,18,58,NA,6669,3,346,121,1138,taskwork,3,FALSE,177,all,0,0,0,0,0
02_25_2021_vero #2_task_round 3_otter.ai,6671,Participant 823,6515,Any other last minute ideas?,19,57,NA,6670,3,823,121,1197,taskwork,3,FALSE,346,all,0,0,0,0,0
02_25_2021_vero #2_task_round 3_otter.ai,6672,Participant 823,6515,I can't,19,57,NA,6671,3,823,121,1197,taskwork,3,FALSE,823,all,0,0,0,0,0
02_25_2021_vero #2_task_round 3_otter.ai,6673,Vero,6515,I have no idea. What about bookmark?,20,7,NA,6672,3,vero1_2_1,121,1207,taskwork,3,TRUE,823,823,0,0,0,0,0
02_25_2021_vero #2_task_round 3_otter.ai,6674,Participant 177,6515,Rubber band as a bookmark?,20,11,NA,6673,3,177,121,1211,taskwork,3,FALSE,vero1_2_1,0,0,1,0,0,0
02_25_2021_vero #2_task_round 3_otter.ai,6675,Participant 823,6515,Yeah you can put it like lengthwise.,20,14,NA,6674,3,823,121,1214,taskwork,3,FALSE,177,177,0,0,0,0,0
02_25_2021_vero #2_task_round 3_otter.ai,6676,Participant 177,6515,"Oh, does it damage the book if it's paperback",20,17,NA,6675,3,177,121,1217,taskwork,3,FALSE,823,823,0,0,0,0,0
02_25_2021_vero #2_task_round 3_otter.ai,6677,Participant 823,6515,"Um, probably depends on the size of the book and the size of the elastic.",20,21,NA,6676,3,823,121,1221,taskwork,3,FALSE,177,177,0,0,0,0,0
02_25_2021_vero #2_task_round 3_otter.ai,6678,Participant 177,6515,Okay.,20,26,NA,6677,3,177,121,1226,taskwork,3,FALSE,823,823,0,0,0,0,0
02_25_2021_vero #2_task_round 3_otter.ai,6679,Participant 346,6515,That's actually quite clever.,20,27,NA,6678,3,346,121,1227,taskwork,3,FALSE,177,all,2,0,1,0,0
