file.name,id,user,root,text,min,sec,nanosec,reply.to,n.participants,user_id,Team_id,time,condition,round,is_vero,user_id2,to,task_pos,task_conf,rel_pos,rel_conf,3rdVero
02_27_2021_vero #1_task_round 1_otter.ai,11061,Participant 992,10930,"I was thinking of that rule, but again, because I didn't say this your way we could get",13,30,NA,11060,3,992,1_1_4,810,taskwork,1,FALSE,213,"213,all","0,0","0,0","0,0","0,0","0,0"
02_27_2021_vero #1_task_round 1_otter.ai,11062,Participant 213,10930,that depending on what you want to use it for. You might,13,41,NA,11061,3,213,1_1_4,821,taskwork,1,FALSE,992,992,0,0,0,0,0
02_27_2021_vero #1_task_round 1_otter.ai,11063,Participant 213,10930,need,13,41,NA,11062,3,213,1_1_4,821,taskwork,1,FALSE,213,all,0,0,0,0,0
02_27_2021_vero #1_task_round 1_otter.ai,11064,Participant 992,10930,"to get the rope and the raft together to this fall, the oxygen cans and everything else that we are taking with us but",13,45,NA,11063,3,992,1_1_4,825,taskwork,1,FALSE,213,all,0,0,0,0,0
02_27_2021_vero #1_task_round 1_otter.ai,11065,Participant 213,10930,"That would probably be useful in that way. Oh,",13,52,NA,11064,3,213,1_1_4,832,taskwork,1,FALSE,992,992,0,0,0,0,0
02_27_2021_vero #1_task_round 1_otter.ai,11066,Participant 992,10930,okay. That's the question.,13,57,NA,11065,3,992,1_1_4,837,taskwork,1,FALSE,213,213,0,0,0,0,0
02_27_2021_vero #1_task_round 1_otter.ai,11067,Participant 992,10930,What do you think?,13,57,NA,11066,3,992,1_1_4,837,taskwork,1,FALSE,992,587,0,0,0,0,0
02_27_2021_vero #1_task_round 1_otter.ai,11068,Participant 587,10930,"Wait, sorry. Um, I think we should put the food I think we can assume that you can eat. Like, if you can't, then I don't see how you would survive anyway.",14,3,NA,11067,3,587,1_1_4,843,taskwork,1,FALSE,992,992,0,0,0,0,0
02_27_2021_vero #1_task_round 1_otter.ai,11069,Participant 992,10930,I guess you could survive without food. Especially I think when you have a low gravity face if you could just,14,16,NA,11068,3,992,1_1_4,856,taskwork,1,FALSE,587,all,0,0,0,0,0
02_27_2021_vero #1_task_round 1_otter.ai,11070,Participant 587,10930,make things like a 200 mile trip though. I don't I don't know.,14,24,NA,11069,3,587,1_1_4,864,taskwork,1,FALSE,992,992,0,0,0,0,0
02_27_2021_vero #1_task_round 1_otter.ai,11071,Participant 213,10930,"Yeah. Oh. Maybe okay, but the food concentrate is seven.",14,31,NA,11070,3,213,1_1_4,871,taskwork,1,FALSE,587,"992,all","0,0","0,0","0,0","0,0","0,0"
02_27_2021_vero #1_task_round 1_otter.ai,11072,Participant 992,10930,Okay.,14,40,NA,11071,3,992,1_1_4,880,taskwork,1,FALSE,213,213,0,0,0,0,0
02_27_2021_vero #1_task_round 1_otter.ai,11073,Participant 587,10930,I only have like 30 seconds left on my timer. So yeah.,14,42,NA,11072,3,587,1_1_4,882,taskwork,1,FALSE,992,all,0,0,0,0,0
02_27_2021_vero #1_task_round 1_otter.ai,11074,Participant 213,10930,"Food concentrate. Dehydrated milk is eight. Oh,",14,48,NA,11073,3,213,1_1_4,888,taskwork,1,FALSE,587,all,0,0,0,0,0
02_27_2021_vero #1_task_round 1_otter.ai,11075,Participant 587,10930,nine is rope.,14,56,NA,11074,3,587,1_1_4,896,taskwork,1,FALSE,213,all,0,0,0,0,0
02_27_2021_vero #1_task_round 1_otter.ai,11076,Participant 992,10930,Nine is Rope 10 is raft.,14,57,NA,11075,3,992,1_1_4,897,taskwork,1,FALSE,587,all,0,0,0,0,0
02_27_2021_vero #1_task_round 1_otter.ai,11077,Participant 587,10930,11 Let's do parachute I guess.,15,1,NA,11076,3,587,1_1_4,901,taskwork,1,FALSE,992,all,0,0,0,0,0
02_27_2021_vero #1_task_round 1_otter.ai,11078,Participant 992,10930,"twelve, heating unit 13 matchstick stands for still okay, pistol 15 match 14",15,15,NA,11077,3,992,1_1_4,915,taskwork,1,FALSE,587,all,0,0,0,0,0
02_27_2021_vero #1_task_round 1_otter.ai,11079,Participant 587,10930,yeah,15,27,NA,11078,3,587,1_1_4,927,taskwork,1,FALSE,992,992,0,0,0,0,0
02_27_2021_vero #1_task_round 1_otter.ai,11080,Participant 992,10930,Should we just confirm? first is oxygen second is water third is the FM transmitter fourth is the compass 5th is the stellar map six is the signal flares seven the food concentrate eighth is milk. Ninth is the rope 10th is the raft 11 is the silk. Twelfth is to first aid kit 13th is the heating unit 14th is the matches and 15 is the pistols. password for the creativity task was shared but I've seen that,15,33,NA,11079,3,992,1_1_4,933,taskwork,1,FALSE,587,all,0,0,0,0,0
02_27_2021_vero #1_task_round 1_otter.ai,11081,Participant 587,10930,do it feel,16,12,NA,11080,3,587,1_1_4,972,taskwork,1,FALSE,992,all,0,0,0,0,0
02_27_2021_vero #1_task_round 1_otter.ai,11082,Participant 992,10930,"sorry, what",16,16,NA,11081,3,992,1_1_4,976,taskwork,1,FALSE,587,587,0,0,0,0,0
02_27_2021_vero #1_task_round 1_otter.ai,11083,Participant 587,10930,feel like F-E-E-L,16,17,NA,11082,3,587,1_1_4,977,taskwork,1,FALSE,992,992,0,0,0,0,0
02_27_2021_vero #1_task_round 1_otter.ai,11084,Participant 992,10930,Okay who wants to go first.,16,25,NA,11083,3,992,1_1_4,985,taskwork,1,FALSE,587,all,0,0,0,0,0
02_27_2021_vero #1_task_round 1_otter.ai,11085,Participant 213,10930,"I'm not creative at all. But I said you could break a smaller fragile object um a paperweight to hold something in place or like keep something suspended. or you can use it as like in a building project or something. You could use it to build I wasn't sure if I guess you can't if it's just one break, but maybe if it's more than one brick, like to build something",16,33,NA,11084,3,213,1_1_4,993,taskwork,1,FALSE,992,all,0,0,0,0,0
02_27_2021_vero #1_task_round 1_otter.ai,11086,Participant 213,10930,on a wall,16,33,NA,11085,3,213,1_1_4,993,taskwork,1,FALSE,213,all,0,0,0,0,0
02_27_2021_vero #1_task_round 1_otter.ai,11087,Participant 213,10930,or something.,16,33,NA,11086,3,213,1_1_4,993,taskwork,1,FALSE,213,all,0,0,0,0,0
02_27_2021_vero #1_task_round 1_otter.ai,11088,Participant 992,10930,So everyone's writing is great.,17,14,NA,11087,3,992,1_1_4,1034,taskwork,1,FALSE,213,all,0,0,0,0,0
02_27_2021_vero #1_task_round 1_otter.ai,11089,Participant 992,10930,We have to write everyone's ideas.,17,15,NA,11088,3,213,1_1_4,1035,taskwork,1,FALSE,992,all,0,0,0,0,0
02_27_2021_vero #1_task_round 1_otter.ai,11090,Participant 213,10930,"Oh, yeah, we have to write ideas.",17,15,NA,11089,3,213,1_1_4,1035,taskwork,1,FALSE,213,992,0,0,0,0,0
02_27_2021_vero #1_task_round 1_otter.ai,11091,Participant 587,10930,It sounds like any ideas recorded in our pre survey though don't need to be rewritten so like if you wrote those down.,17,20,NA,11090,3,587,1_1_4,1040,taskwork,1,FALSE,213,all,0,0,0,0,0
02_27_2021_vero #1_task_round 1_otter.ai,11092,Participant 587,10930,"Oh, look at that it will still count.",17,20,NA,11091,3,587,1_1_4,1040,taskwork,1,FALSE,587,all,0,0,0,0,0
02_27_2021_vero #1_task_round 1_otter.ai,11093,Participant 992,10930,Oh,17,30,NA,11092,3,992,1_1_4,1050,taskwork,1,FALSE,587,587,0,0,0,0,0
02_27_2021_vero #1_task_round 1_otter.ai,11094,Participant 587,10930,so like I think we only have to write down new ideas that none of us came up with before.,17,32,NA,11093,3,587,1_1_4,1052,taskwork,1,FALSE,992,all,0,0,0,0,0
02_27_2021_vero #1_task_round 1_otter.ai,11095,Participant 992,10930,"Literally, let me just give a what I thought and then maybe we can collectively brainstorm. I wrote as a as construction and construction or building things as Kim said, as maybe a weapon if you are getting attacked by someone you could retaliate. It's self defense, whatever. That's one you could use it as maybe you know coloration to mark something if you have like it's basically has some chalky component, right? So you could draw a line a red line something or you could use it as weights for working out or out of equipment. Yeah, then as a weight for paper weight distinctly sweet to keep something in check. be in a position marker if you have to like to was getting desperate for it. So I just saw that. You could use it as a road blocker and people saw a little bit of the road just to prevent her from going if you had to. I don't know if it works, but that's what I had. What did you have Hannah?",17,39,NA,11094,3,992,1_1_4,1059,taskwork,1,FALSE,587,"all,587","0,0","0,0","0,0","0,0","0,0"
02_27_2021_vero #1_task_round 1_otter.ai,11096,Participant 587,10930,"Um, pretty much some of the same things. I put like the door stop or a foot rest like a weapon too, use as like a stool. Like if you're really small. decoration.",18,47,NA,11095,3,587,1_1_4,1127,taskwork,1,FALSE,992,992,0,0,0,0,0
02_27_2021_vero #1_task_round 1_otter.ai,11097,Participant 992,10930,"Yes, falling short of the range. So what properties have we been using? We've been using its weight we've been using its its coloration property they've been using its decorative properties. Defense strength, maybe what else? The properties of a brick that we have not yet. size, it's not that big. Does that give some possible uses? It's very dense and it's not that big for paper we're putting holding things down makes sense. Anything else that we can do with its size?",19,9,NA,11096,3,992,1_1_4,1149,taskwork,1,FALSE,587,"587,all","0,0","0,0","0,0","0,0","0,0"
02_27_2021_vero #1_task_round 1_otter.ai,11098,Participant 992,10930,"You got to dig psychology. Right? If you presented a breakthrough, whether your word criminally minded does it, does it help you learn something about that? Oh,",19,9,NA,11097,3,992,1_1_4,1149,taskwork,1,FALSE,992,213,0,0,0,0,0
02_27_2021_vero #1_task_round 1_otter.ai,11099,Participant 213,10930,that's not really what I studied but.,21,7,NA,11098,3,213,1_1_4,1267,taskwork,1,FALSE,992,992,0,0,0,0,0
02_27_2021_vero #1_task_round 1_otter.ai,11100,Participant 992,10930,"I guess we could use it in some kind of experimentation, right? Exactly what these people are using it for. Give a brick to a person and why what this is how we respond, try to figure out what that person is inclined to like if, if they are someone who comes to weapon as the first thing that gives us some idea about the site or the intentions or something. It could be a psychological experiment to see how people respond to the users of a brick. Just thinking of ideas, feel free to say how stupid it sounds. Okay.",21,15,NA,11099,3,992,1_1_4,1275,taskwork,1,FALSE,213,all,0,0,0,0,0
02_27_2021_vero #1_task_round 1_otter.ai,11101,Participant 587,10930,I think we got a lot like in our pre surveys,22,40,NA,11100,3,587,1_1_4,1360,taskwork,1,FALSE,992,all,0,0,0,0,0
02_27_2021_vero #1_task_round 1_otter.ai,11102,Participant 213,10930,category of things before.,22,47,NA,11101,3,213,1_1_4,1367,taskwork,1,FALSE,587,587,0,0,0,0,0
02_27_2021_vero #1_task_round 1_otter.ai,11103,Participant 992,10930,"I guess you could always use it in some other experiments, like you know, if you want to measure gravity, you just drop it and measure the time it takes to fall and that gives you an idea of",22,53,NA,11102,3,992,1_1_4,1373,taskwork,1,FALSE,213,all,0,0,0,0,0
02_27_2021_vero #1_task_round 1_otter.ai,11104,Participant 213,10930,"um, I just put the example that you gave me about the experiment thing.",23,45,NA,11103,3,213,1_1_4,1425,taskwork,1,FALSE,992,992,0,0,0,0,0
02_27_2021_vero #1_task_round 1_otter.ai,11105,Participant 992,10930,"Yeah, so this one could be your regular it scientific experiments one could be a psychological thought experiment which to get an insight into a person's way of thinking so I think two ideas about what we had already written in our pre surveys. Okay. Do we have a password?",23,53,NA,11104,3,992,1_1_4,1433,taskwork,1,FALSE,213,all,0,0,0,0,0
02_27_2021_vero #1_task_round 1_otter.ai,11106,Participant 587,10930,"No, I didn't see one. I can see.",24,19,0,11105,3,587,1_1_4,1459,taskwork,1,FALSE,992,992,0,0,0,0,0
02_27_2021_vero #1_task_round 1_otter.ai,11107,Participant 213,10930,"I think either way, we need a password. Oh, yeah.",24,38,0,11106,3,213,1_1_4,1478,taskwork,1,FALSE,587,all,0,0,0,0,0
02_27_2021_vero #1_task_round 1_otter.ai,11108,Participant 587,10930,"Ask for help. And I it says the host is currently helping others,",24,52,0,11107,3,587,1_1_4,1492,taskwork,1,FALSE,213,all,0,0,0,0,0
02_27_2021_vero #1_task_round 1_otter.ai,11109,Participant 992,10930,maybe just put the password in the chat or something would have been easier,25,10,0,11108,3,992,1_1_4,1510,taskwork,1,FALSE,587,all,0,0,0,0,0
02_27_2021_vero #1_task_round 1_otter.ai,11110,Participant 587,10930,"Okay, here we go.",25,16,0,11109,3,587,1_1_4,1516,taskwork,1,FALSE,992,992,0,0,0,0,0
