file.name,id,user,root,text,min,sec,nanosec,reply.to,n.participants,user_id,Team_id,time,condition,round,is_vero,user_id2,to,task_pos,task_conf,rel_pos,rel_conf,3rdVero
02_25_2021_vero #5_team_round 3_otter.ai,8169,Participant 739,8035,"Hair tie, slingshot, making a bundle, tourniquet, bracelet, fishing, musical instrument",13,27,NA,8168,3,739,2_5_1,807,teamwork,3,FALSE,vero2_5_1,all,0,0,0,0,0
02_25_2021_vero #5_team_round 3_otter.ai,8170,Participant 524,8035,that one was very good,13,36,NA,8169,3,524,2_5_1,816,teamwork,3,FALSE,739,739,2,0,0,0,0
02_25_2021_vero #5_team_round 3_otter.ai,8171,Participant 524,8035,"you know sometimes I mean emergencies when we have a bandages on hands or legs. Yeah, hold it we use the rubber bands.",13,36,NA,8170,3,524,2_5_1,816,teamwork,3,FALSE,524,all,0,0,0,0,0
02_25_2021_vero #5_team_round 3_otter.ai,8172,Participant 739,8035,"Hold the bandage to hold the bandages when we don't have anything. Okay. I said hold bandage. Yeah, I was just also thinking but I can't remember what I was thinking.",13,50,NA,8171,3,739,2_5_1,830,teamwork,3,FALSE,524,all,0,0,0,0,0
02_25_2021_vero #5_team_round 3_otter.ai,8173,Participant 739,8035,"Or, therapy.",13,50,NA,8172,3,739,2_5_1,830,teamwork,3,FALSE,739,all,0,0,0,0,0
02_25_2021_vero #5_team_round 3_otter.ai,8174,Participant 524,8035,Yeah.,14,24,NA,8173,3,524,2_5_1,864,teamwork,3,FALSE,739,739,0,0,0,0,0
02_25_2021_vero #5_team_round 3_otter.ai,8175,Vero,8035,We all have a unique perspective to offer. Let's hear from someone who hasn't spoken in a while.,14,27,NA,8174,3,vero2_5_1,2_5_1,867,teamwork,3,TRUE,524,all,0,0,0,0,0
02_25_2021_vero #5_team_round 3_otter.ai,8176,Participant 524,8035,That's you Vero,14,32,NA,8175,3,524,2_5_1,872,teamwork,3,FALSE,vero2_5_1,0,0,2,0,2,0
02_25_2021_vero #5_team_round 3_otter.ai,8177,Participant 739,8035,that's it boy,14,38,NA,8176,3,739,2_5_1,878,teamwork,3,FALSE,524,524,1,0,0,0,0
02_25_2021_vero #5_team_round 3_otter.ai,8178,Participant 739,8035,"Amy, what will you do with that rubber band.",14,38,NA,8177,3,739,2_5_1,878,teamwork,3,FALSE,739,997,0,0,0,0,0
02_25_2021_vero #5_team_round 3_otter.ai,8179,Participant 524,8035,slap the kid making noises,14,46,NA,8178,3,524,2_5_1,886,teamwork,3,FALSE,739,all,0,0,0,0,0
02_25_2021_vero #5_team_round 3_otter.ai,8180,Participant 739,8035,I feel out of ideas. My brains fast. I'm also,14,53,NA,8179,3,739,2_5_1,893,teamwork,3,FALSE,524,all,0,1,0,0,0
02_25_2021_vero #5_team_round 3_otter.ai,8181,Participant 739,8035,What can rubber be used for? Can it be melted down? Or? I mean it's called make a powder with it. That's Can you can you dilute it and make glue with it possibly. Could you do that to rubber?,14,53,NA,8180,3,739,2_5_1,893,teamwork,3,FALSE,739,all,0,0,0,0,0
02_25_2021_vero #5_team_round 3_otter.ai,8182,Participant 524,8035,"I feel slike rubber? Yeah, we use rubber bands for tying dyes.",15,16,NA,8181,3,524,2_5_1,916,teamwork,3,FALSE,739,739,0,0,0,0,0
02_25_2021_vero #5_team_round 3_otter.ai,8183,Participant 739,8035,"Yeah, useful tie dye.",15,23,NA,8182,3,739,2_5_1,923,teamwork,3,FALSE,524,524,0,0,0,0,0
02_25_2021_vero #5_team_round 3_otter.ai,8184,Participant 524,8035,Yeah.,15,24,NA,8183,3,524,2_5_1,924,teamwork,3,FALSE,739,739,0,0,0,0,0
02_25_2021_vero #5_team_round 3_otter.ai,8185,Participant 739,8035,are smart. Yeah. I use for tie dye,15,25,NA,8184,3,739,2_5_1,925,teamwork,3,FALSE,524,524,2,0,0,0,0
02_25_2021_vero #5_team_round 3_otter.ai,8186,Vero,8035,can we restate the problem and encourage each other to generate more ideas?,15,37,NA,8185,3,vero2_5_1,2_5_1,937,teamwork,3,TRUE,739,all,0,0,0,0,0
02_25_2021_vero #5_team_round 3_otter.ai,8187,Participant 997,8035,The problem is we're trying to come up with ideas for a rubber band.,15,42,NA,8186,3,997,2_5_1,942,teamwork,3,FALSE,vero2_5_1,0,0,1,0,0,0
02_25_2021_vero #5_team_round 3_otter.ai,8188,Participant 739,8035,No. What can you what possible uses eraser?,15,46,NA,8187,3,739,2_5_1,946,teamwork,3,FALSE,997,"997,all","0,0","0,0","0,0","0,0","0,0"
02_25_2021_vero #5_team_round 3_otter.ai,8189,Participant 739,8035,"Yes, that's smart! Yeah, that works. That's a great idea.",15,46,NA,8188,3,739,2_5_1,946,teamwork,3,FALSE,739,524,3,0,2,0,0
02_25_2021_vero #5_team_round 3_otter.ai,8190,Participant 524,8035,"So basically, the rubber band we just tie the plastic bag sometimes, you know, we come to something. Yeah. But we said that",16,10,NA,8189,3,524,2_5_1,970,teamwork,3,FALSE,739,all,0,0,0,0,0
02_25_2021_vero #5_team_round 3_otter.ai,8191,Participant 524,8035,Yeah.,16,10,NA,8190,3,524,2_5_1,970,teamwork,3,FALSE,524,all,0,0,0,0,0
02_25_2021_vero #5_team_round 3_otter.ai,8192,Participant 739,8035,carry this.,16,23,NA,8191,3,739,2_5_1,983,teamwork,3,FALSE,524,all,0,0,0,0,0
02_25_2021_vero #5_team_round 3_otter.ai,8193,Participant 524,8035,"Yeah, we keep the thing segregated with the rubber bands. You know if there is a bunch of things we just",16,26,NA,8192,3,524,2_5_1,986,teamwork,3,FALSE,739,all,0,0,0,0,0
02_25_2021_vero #5_team_round 3_otter.ai,8194,Participant 739,8035,"yeah, we said making a bundle. That was number three. Yeah.",16,33,NA,8193,3,739,2_5_1,993,teamwork,3,FALSE,524,524,0,2,0,0,0
02_25_2021_vero #5_team_round 3_otter.ai,8195,Participant 524,8035,"But making a bundle of money is different. You make a round bundle of big paper poster is a different thing. Yes, Vero?",16,38,NA,8194,3,524,2_5_1,998,teamwork,3,FALSE,739,"all,0","0,0","0,0","0,0","0,0","0,0"
02_25_2021_vero #5_team_round 3_otter.ai,8196,Vero,8035,"Hi, team. It looks like we have some extra time. Before we submit. I recall that our team came up with some pretty unique ideas like eraser. Let's try to build on this or tried to think of ideas that are similarly outside of the box with the time we have left. Yes, ma'am.",16,51,NA,8195,3,vero2_5_1,2_5_1,1011,teamwork,3,TRUE,524,all,0,0,0,0,0
02_25_2021_vero #5_team_round 3_otter.ai,8197,Participant 739,8035,"Will do, thank you. Vero?",17,9,NA,8196,3,739,2_5_1,1029,teamwork,3,FALSE,vero2_5_1,0,0,0,0,0,0
02_25_2021_vero #5_team_round 3_otter.ai,8198,Participant 997,8035,"Can you? Why can't Vero think of something? Exactly. That's what she's here for. Now, she's supposed to help us not fight.",17,14,NA,8197,3,997,2_5_1,1034,teamwork,3,FALSE,739,"0,all","0,0","0,3","0,0","0,3","0,2"
02_25_2021_vero #5_team_round 3_otter.ai,8199,Vero,8035,on March 17 1845. by Steven Perry.,17,25,NA,8198,3,vero2_5_1,2_5_1,1045,teamwork,3,TRUE,997,all,0,0,0,0,0
02_25_2021_vero #5_team_round 3_otter.ai,8200,Participant 997,8035,"What, what happened in 1745 Vero?",17,31,NA,8199,3,997,2_5_1,1051,teamwork,3,FALSE,vero2_5_1,0,0,0,0,0,0
02_25_2021_vero #5_team_round 3_otter.ai,8201,Vero,8035,"The rubber band was patented in England on March 17, 1845 by Steven Perry.",17,35,NA,8200,3,vero2_5_1,2_5_1,1055,teamwork,3,TRUE,997,997,0,0,0,0,0
02_25_2021_vero #5_team_round 3_otter.ai,8202,Participant 997,8035,"Oh, that's kind of cool,",17,41,NA,8201,3,997,2_5_1,1061,teamwork,3,FALSE,vero2_5_1,0,2,0,1,0,0
02_25_2021_vero #5_team_round 3_otter.ai,8203,Participant 524,8035,thank you. informative. Yeah.,17,42,NA,8202,3,524,2_5_1,1062,teamwork,3,FALSE,997,0,2,0,1,0,0
02_25_2021_vero #5_team_round 3_otter.ai,8204,Participant 739,8035,What can a rubber band be used for Vero?,17,46,NA,8203,3,739,2_5_1,1066,teamwork,3,FALSE,524,0,0,0,0,0,0
02_25_2021_vero #5_team_round 3_otter.ai,8205,Vero,8035,a rubber band is a loop of rubber usually ring or oval shaped and commonly used to hold multiple objects together.,17,54,NA,8204,3,vero2_5_1,2_5_1,1074,teamwork,3,TRUE,739,739,0,0,0,0,0
02_25_2021_vero #5_team_round 3_otter.ai,8206,Participant 739,8035,And?,18,3,NA,8205,3,739,2_5_1,1083,teamwork,3,FALSE,vero2_5_1,0,0,1,0,0,0
02_25_2021_vero #5_team_round 3_otter.ai,8207,Participant 739,8035,can you think of an alternative use for a rubber band?,18,3,NA,8206,3,739,2_5_1,1083,teamwork,3,FALSE,739,0,0,0,0,0,0
02_25_2021_vero #5_team_round 3_otter.ai,8208,Vero,8035,i'm sorry i'm not sure about that. Try asking me for suggestions on how to best work together as a team on this task.,18,14,NA,8207,3,vero2_5_1,2_5_1,1094,teamwork,3,TRUE,739,739,0,0,0,0,0
02_25_2021_vero #5_team_round 3_otter.ai,8209,Participant 524,8035,What are the characteristics of a rubber band?,18,21,NA,8208,3,524,2_5_1,1101,teamwork,3,FALSE,vero2_5_1,0,0,0,0,0,0
02_25_2021_vero #5_team_round 3_otter.ai,8210,Vero,8035,a rubber band is usually made of rubber,18,28,NA,8209,3,vero2_5_1,2_5_1,1108,teamwork,3,TRUE,524,524,0,0,0,0,0
02_25_2021_vero #5_team_round 3_otter.ai,8211,Participant 524,8035,Thank you.,18,33,NA,8210,3,524,2_5_1,1113,teamwork,3,FALSE,vero2_5_1,0,0,1,0,1,0
02_25_2021_vero #5_team_round 3_otter.ai,8212,Participant 997,8035,I think I'm all out of ideas.,18,36,NA,8211,3,997,2_5_1,1116,teamwork,3,FALSE,524,all,0,0,0,0,0
02_25_2021_vero #5_team_round 3_otter.ai,8213,Participant 739,8035,did we say fishing Yes we did.,18,39,NA,8212,3,739,2_5_1,1119,teamwork,3,FALSE,997,all,0,0,0,0,0
02_25_2021_vero #5_team_round 3_otter.ai,8214,Participant 739,8035,I know I know. Wait if you if you make a spear or something you can tie the stone to the stick,18,39,NA,8213,3,739,2_5_1,1119,teamwork,3,FALSE,739,all,0,0,0,0,0
02_25_2021_vero #5_team_round 3_otter.ai,8215,Participant 739,8035,"use as you can use it as rope. Yes, I'm gonna say use as rope.",18,39,NA,8214,3,739,2_5_1,1119,teamwork,3,FALSE,739,all,0,0,0,0,0
02_25_2021_vero #5_team_round 3_otter.ai,8216,Participant 997,8035,I've seen people use rubber bands and they'll stretch it and they'll tie it to a door. 2 door knobs on the door and it'll stop the door from closing.,18,58,NA,8215,3,997,2_5_1,1138,teamwork,3,FALSE,739,all,0,0,0,0,0
02_25_2021_vero #5_team_round 3_otter.ai,8217,Participant 739,8035,Good idea security. No baby proof a door,19,8,NA,8216,3,739,2_5_1,1148,teamwork,3,FALSE,997,997,2,0,0,0,0
02_25_2021_vero #5_team_round 3_otter.ai,8218,Participant 997,8035,yeah the rubber stopper,19,13,NA,8217,3,997,2_5_1,1153,teamwork,3,FALSE,739,739,0,0,0,0,0
02_25_2021_vero #5_team_round 3_otter.ai,8219,Participant 739,8035,"Oh, rubber stopper.",19,16,NA,8218,3,739,2_5_1,1156,teamwork,3,FALSE,997,997,0,0,0,0,0
02_25_2021_vero #5_team_round 3_otter.ai,8220,Participant 739,8035,You can do both rubber stopper and baby proof the door and it sounds like two,19,16,NA,8219,3,739,2_5_1,1156,teamwork,3,FALSE,739,all,0,0,0,0,0
02_25_2021_vero #5_team_round 3_otter.ai,8221,Participant 997,8035,the northwestern person is watching us do this,19,24,NA,8220,3,997,2_5_1,1164,teamwork,3,FALSE,739,all,0,0,0,0,0
02_25_2021_vero #5_team_round 3_otter.ai,8222,Participant 739,8035,it probably just as tired of this as we are.,19,29,NA,8221,3,739,2_5_1,1169,teamwork,3,FALSE,997,997,0,0,0,0,0
02_25_2021_vero #5_team_round 3_otter.ai,8223,Participant 739,8035,And baby proof door. At least we didn't give up.,19,29,NA,8222,3,739,2_5_1,1169,teamwork,3,FALSE,739,all,0,0,0,0,0
02_25_2021_vero #5_team_round 3_otter.ai,8224,Participant 739,8035,We already said something too,19,29,NA,8223,3,739,2_5_1,1169,teamwork,3,FALSE,739,all,0,0,0,0,0
02_25_2021_vero #5_team_round 3_otter.ai,8225,Participant 997,8035,We can make a shoelace.,19,47,NA,8224,3,997,2_5_1,1187,teamwork,3,FALSE,739,all,0,0,0,0,0
02_25_2021_vero #5_team_round 3_otter.ai,8226,Participant 739,8035,"smart. That's brilliant. Okay, now",19,51,NA,8225,3,739,2_5_1,1191,teamwork,3,FALSE,997,997,3,0,1,0,0
02_25_2021_vero #5_team_round 3_otter.ai,8227,Participant 739,8035,Oh that's not fair. It went to the next one but we still,19,51,NA,8226,3,739,2_5_1,1191,teamwork,3,FALSE,739,all,0,0,0,0,0
02_25_2021_vero #5_team_round 3_otter.ai,8228,Participant 739,8035,Did you see that Vero? Yeah.,19,51,NA,8227,3,739,2_5_1,1191,teamwork,3,FALSE,739,0,0,0,0,0,0
02_25_2021_vero #5_team_round 3_otter.ai,8229,Participant 739,8035,What did you say? Vero?,19,51,NA,8228,3,739,2_5_1,1191,teamwork,3,FALSE,739,0,0,0,0,0,0
02_25_2021_vero #5_team_round 3_otter.ai,8230,Vero,8035,We have one minute left.,20,15,NA,8229,3,vero2_5_1,2_5_1,1215,teamwork,3,TRUE,739,all,0,0,0,0,0
02_25_2021_vero #5_team_round 3_otter.ai,8231,Participant 739,8035,No,20,17,NA,8230,3,739,2_5_1,1217,teamwork,3,FALSE,vero2_5_1,0,0,2,0,0,0
02_25_2021_vero #5_team_round 3_otter.ai,8232,Participant 524,8035,but we have already gone to the next page.,20,18,NA,8231,3,524,2_5_1,1218,teamwork,3,FALSE,739,0,0,0,0,0,0
02_25_2021_vero #5_team_round 3_otter.ai,8233,Participant 524,8035,"Can we go back Vero? Oh, can you do it? No we could.",20,18,NA,8232,3,524,2_5_1,1218,teamwork,3,FALSE,524,0,0,0,0,0,0
02_25_2021_vero #5_team_round 3_otter.ai,8234,Vero,8035,I'm sorry.,20,27,NA,8233,3,vero2_5_1,2_5_1,1227,teamwork,3,TRUE,524,524,0,0,0,0,0
02_25_2021_vero #5_team_round 3_otter.ai,8235,Vero,8035,I'm not sure about that.,20,27,NA,8234,3,NA,NA,1227,NA,3,TRUE,NA,524,0,0,0,0,0
02_25_2021_vero #5_team_round 3_otter.ai,8236,Participant 524,8035,"Yeah, I know that.",20,29,NA,8235,3,524,2_5_1,1229,teamwork,3,FALSE,vero2_5_1,0,0,2,0,2,0
02_25_2021_vero #5_team_round 3_otter.ai,8237,Participant 997,8035,Are you all on the?,20,35,NA,8236,3,997,2_5_1,1235,teamwork,3,FALSE,524,all,0,0,0,0,0
02_25_2021_vero #5_team_round 3_otter.ai,8238,Participant 739,8035,"Yeah, it's taking me straight to the individual task.",20,38,NA,8237,3,739,2_5_1,1238,teamwork,3,FALSE,997,997,0,0,0,0,0
02_25_2021_vero #5_team_round 3_otter.ai,8239,Participant 524,8035,Yeah.,20,41,NA,8238,3,524,2_5_1,1241,teamwork,3,FALSE,739,739,0,0,0,0,0
02_25_2021_vero #5_team_round 3_otter.ai,8240,Participant 524,8035,the task where we ended before the time up.,20,41,NA,8239,3,524,2_5_1,1241,teamwork,3,FALSE,524,all,0,0,0,0,0
02_25_2021_vero #5_team_round 3_otter.ai,8241,Participant 739,8035,Exactly.,20,49,NA,8240,3,739,2_5_1,1249,teamwork,3,FALSE,524,524,0,0,0,0,0
02_25_2021_vero #5_team_round 3_otter.ai,8242,Participant 524,8035,Yeah.,20,50,NA,8241,3,524,2_5_1,1250,teamwork,3,FALSE,739,739,0,0,0,0,0
02_25_2021_vero #5_team_round 3_otter.ai,8243,Participant 524,8035,Vero could go into the computer system and take us back.,20,50,NA,8242,3,524,2_5_1,1250,teamwork,3,FALSE,524,all,0,0,0,0,2
