file.name,id,user,root,text,min,sec,nanosec,reply.to,n.participants,user_id,Team_id,time,condition,round,is_vero,user_id2,to,task_pos,task_conf,rel_pos,rel_conf,3rdVero
03_02_2021_vero #1_task_round 2_otter.ai,15118,Participant 241,14990,"Oh, it just pops up there and they don't put it in the chat. So you gotta pay attention.",12,35,NA,15117,3,241,1_1_5,755,taskwork,2,FALSE,597,"597,all","0,0","0,0","0,0","0,0","0,0"
03_02_2021_vero #1_task_round 2_otter.ai,15119,Participant 597,14990,"All right. paperclip,",12,41,NA,15118,3,597,1_1_5,761,taskwork,2,FALSE,241,all,0,0,0,0,0
03_02_2021_vero #1_task_round 2_otter.ai,15120,Participant 718,14990,paperclip.,12,50,NA,15119,3,718,1_1_5,770,taskwork,2,FALSE,597,all,0,0,0,0,0
03_02_2021_vero #1_task_round 2_otter.ai,15121,Participant 597,14990,"Oh, individual ideas do not need to be",12,52,NA,15120,3,597,1_1_5,772,taskwork,2,FALSE,718,all,0,0,0,0,0
03_02_2021_vero #1_task_round 2_otter.ai,15122,Vero,14990,I'm ready to begin the creativity task.,12,54,NA,15121,3,vero1_1_5,1_1_5,774,taskwork,2,TRUE,597,all,0,0,0,0,0
03_02_2021_vero #1_task_round 2_otter.ai,15123,Participant 597,14990,"Oh, fabulous. Okay.",12,58,NA,15122,3,597,1_1_5,778,taskwork,2,FALSE,vero1_1_5,0,1,0,0,0,0
03_02_2021_vero #1_task_round 2_otter.ai,15124,Participant 597,14990,Let's see.,12,58,NA,15123,3,597,1_1_5,778,taskwork,2,FALSE,597,all,0,0,0,0,0
03_02_2021_vero #1_task_round 2_otter.ai,15125,Participant 241,14990,"So can be used as a toothpick. I mean, you can open it up and then use it as a toothpick, right?",13,9,NA,15124,3,241,1_1_5,789,taskwork,2,FALSE,597,all,0,0,0,0,0
03_02_2021_vero #1_task_round 2_otter.ai,15126,Participant 718,14990,Yeah.,13,14,NA,15125,3,718,1_1_5,794,taskwork,2,FALSE,241,241,0,0,0,0,0
03_02_2021_vero #1_task_round 2_otter.ai,15127,Participant 597,14990,"Obviously, holding paper.",13,16,NA,15126,3,597,1_1_5,796,taskwork,2,FALSE,718,all,0,0,0,0,0
03_02_2021_vero #1_task_round 2_otter.ai,15128,Participant 241,14990,There we go.,13,18,NA,15127,3,241,1_1_5,798,taskwork,2,FALSE,597,597,0,0,0,0,0
03_02_2021_vero #1_task_round 2_otter.ai,15129,Participant 241,14990,"You can, if you use a couple of them, you can create like a phone stand, where you can lean your phone against it and you can sort of lean up and watch movies and stuff.",13,18,NA,15128,3,241,1_1_5,798,taskwork,2,FALSE,241,all,0,0,0,0,0
03_02_2021_vero #1_task_round 2_otter.ai,15130,Participant 718,14990,But it says a paperclip. We are limited to one.,13,32,NA,15129,3,718,1_1_5,812,taskwork,2,FALSE,241,241,0,2,0,0,0
03_02_2021_vero #1_task_round 2_otter.ai,15131,Participant 597,14990,I think you could you could use it to like pop out a SIM card.,13,38,NA,15130,3,597,1_1_5,818,taskwork,2,FALSE,718,all,0,0,0,0,0
03_02_2021_vero #1_task_round 2_otter.ai,15132,Participant 241,14990,There we go. Yeah.,13,42,NA,15131,3,241,1_1_5,822,taskwork,2,FALSE,597,597,1,0,0,0,0
03_02_2021_vero #1_task_round 2_otter.ai,15133,Participant 597,14990,"You could also use it to like, hold back to hair a little bit.",13,45,NA,15132,3,597,1_1_5,825,taskwork,2,FALSE,241,all,0,0,0,0,0
03_02_2021_vero #1_task_round 2_otter.ai,15134,Participant 718,14990,Uh huh. Can we use it as a tweezer?,13,51,NA,15133,3,718,1_1_5,831,taskwork,2,FALSE,597,"597,all","0,0","0,0","0,0","0,0","0,0"
03_02_2021_vero #1_task_round 2_otter.ai,15135,Participant 597,14990,Sure.,14,1,NA,15134,3,597,1_1_5,841,taskwork,2,FALSE,718,718,0,0,0,0,0
03_02_2021_vero #1_task_round 2_otter.ai,15136,Participant 718,14990,Okay.,14,2,NA,15135,3,718,1_1_5,842,taskwork,2,FALSE,597,597,0,0,0,0,0
03_02_2021_vero #1_task_round 2_otter.ai,15137,Participant 597,14990,"If you're, you probably should grab a sort of large object but",14,3,NA,15136,3,597,1_1_5,843,taskwork,2,FALSE,718,all,0,0,0,0,0
03_02_2021_vero #1_task_round 2_otter.ai,15138,Participant 241,14990,"From a girl's point of view, you can use it to clean a comb to get all of your hair sort of out of a brush.",14,9,NA,15137,3,241,1_1_5,849,taskwork,2,FALSE,597,all,0,0,0,0,0
03_02_2021_vero #1_task_round 2_otter.ai,15139,Participant 718,14990,You can sharpen it to be a needle.,14,19,NA,15138,3,718,1_1_5,859,taskwork,2,FALSE,241,all,0,0,0,0,0
03_02_2021_vero #1_task_round 2_otter.ai,15140,Participant 241,14990,"Wow, okay. Yeah, it's real strong protection.",14,23,NA,15139,3,241,1_1_5,863,taskwork,2,FALSE,718,718,1,0,0,0,0
03_02_2021_vero #1_task_round 2_otter.ai,15141,Participant 718,14990,Using the brick from the last activity.,14,28,NA,15140,3,718,1_1_5,868,taskwork,2,FALSE,241,all,0,0,0,0,0
03_02_2021_vero #1_task_round 2_otter.ai,15142,Participant 241,14990,"Yo, weight stone brick.",14,33,NA,15141,3,241,1_1_5,873,taskwork,2,FALSE,718,all,0,0,0,0,0
03_02_2021_vero #1_task_round 2_otter.ai,15143,Participant 718,14990,A key chain. Do you think you'll be a good key chain or key ring? Not a key chain the key ring?,14,38,NA,15142,3,718,1_1_5,878,taskwork,2,FALSE,241,all,0,0,0,0,0
03_02_2021_vero #1_task_round 2_otter.ai,15144,Participant 597,14990,"Yeah, I mean, you can bend it into one you could also bend it into just like a straight up ring.",14,45,NA,15143,3,597,1_1_5,885,taskwork,2,FALSE,718,718,0,0,0,0,0
03_02_2021_vero #1_task_round 2_otter.ai,15145,Participant 718,14990,"Oh, yeah, yeah.",14,55,NA,15144,3,718,1_1_5,895,taskwork,2,FALSE,597,597,0,0,0,0,0
03_02_2021_vero #1_task_round 2_otter.ai,15146,Participant 597,14990,Does Vero have ideas?,15,2,NA,15145,3,597,1_1_5,902,taskwork,2,FALSE,718,0,0,0,0,0,0
03_02_2021_vero #1_task_round 2_otter.ai,15147,Vero,14990,I have an idea. What about battery lead?,15,5,NA,15146,3,vero1_1_5,1_1_5,905,taskwork,2,TRUE,597,597,0,0,0,0,0
03_02_2021_vero #1_task_round 2_otter.ai,15148,Participant 718,14990,Explain yourself Vero.,15,11,NA,15147,3,718,1_1_5,911,taskwork,2,FALSE,vero1_1_5,0,0,0,0,0,0
03_02_2021_vero #1_task_round 2_otter.ai,15149,Vero,14990,A lead is a metal used in batteries to generate electricity.,15,16,NA,15148,3,vero1_1_5,1_1_5,916,taskwork,2,TRUE,718,718,0,0,0,0,0
03_02_2021_vero #1_task_round 2_otter.ai,15150,Participant 597,14990,I've never heard of that.,15,27,NA,15149,3,597,1_1_5,927,taskwork,2,FALSE,vero1_1_5,all,0,0,0,0,0
03_02_2021_vero #1_task_round 2_otter.ai,15151,Participant 718,14990,"I mean, I can see a paperclip being used to like complete an electrical circuit.",15,32,NA,15150,3,718,1_1_5,932,taskwork,2,FALSE,597,all,0,0,0,0,0
03_02_2021_vero #1_task_round 2_otter.ai,15152,Participant 597,14990,Yeah. Like electrical wiring.,15,37,NA,15151,3,597,1_1_5,937,taskwork,2,FALSE,718,718,0,0,0,0,0
03_02_2021_vero #1_task_round 2_otter.ai,15153,Participant 718,14990,"Yeah, exactly.",15,40,NA,15152,3,718,1_1_5,940,taskwork,2,FALSE,597,597,0,0,0,0,0
03_02_2021_vero #1_task_round 2_otter.ai,15154,Participant 597,14990,"Sure. Um,",15,44,NA,15153,3,597,1_1_5,944,taskwork,2,FALSE,718,718,0,0,0,0,0
03_02_2021_vero #1_task_round 2_otter.ai,15155,Participant 718,14990,Vero What else you got?,15,47,NA,15154,3,718,1_1_5,947,taskwork,2,FALSE,597,0,0,0,0,0,0
03_02_2021_vero #1_task_round 2_otter.ai,15156,Vero,14990,I have an idea. What about button pusher?,15,52,NA,15155,3,vero1_1_5,1_1_5,952,taskwork,2,TRUE,718,718,0,0,0,0,0
03_02_2021_vero #1_task_round 2_otter.ai,15157,Participant 718,14990,"Okay, sure. Button pusher?",15,56,NA,15156,3,718,1_1_5,956,taskwork,2,FALSE,vero1_1_5,"0,all","0,0","0,0","0,0","0,0","0,0"
03_02_2021_vero #1_task_round 2_otter.ai,15158,Participant 597,14990,Yeah.,16,1,NA,15157,3,597,1_1_5,961,taskwork,2,FALSE,718,718,0,0,0,0,0
03_02_2021_vero #1_task_round 2_otter.ai,15159,Participant 718,14990,"Someone is writing all these down, right. Okay, perfect.",16,4,NA,15158,3,718,1_1_5,964,taskwork,2,FALSE,597,all,0,0,0,0,0
03_02_2021_vero #1_task_round 2_otter.ai,15160,Participant 597,14990,"Um,",16,11,NA,15159,3,597,1_1_5,971,taskwork,2,FALSE,718,all,0,0,0,0,0
03_02_2021_vero #1_task_round 2_otter.ai,15161,Participant 241,14990,what if you were a mouse or like a really small animal and you could use them as snowshoes,16,12,NA,15160,3,241,1_1_5,972,taskwork,2,FALSE,597,all,0,0,0,0,0
03_02_2021_vero #1_task_round 2_otter.ai,15162,Participant 718,14990,a snowshoe?,16,20,NA,15161,3,718,1_1_5,980,taskwork,2,FALSE,241,241,0,0,0,0,0
03_02_2021_vero #1_task_round 2_otter.ai,15163,Participant 241,14990,"Yeah, a snow. A snowshoe. On like a one legged mouse.",16,23,NA,15162,3,241,1_1_5,983,taskwork,2,FALSE,718,718,0,0,0,0,0
03_02_2021_vero #1_task_round 2_otter.ai,15164,Participant 718,14990,Building off of that. How about a raft? for insects?,16,33,NA,15163,3,718,1_1_5,993,taskwork,2,FALSE,241,all,0,0,0,0,0
03_02_2021_vero #1_task_round 2_otter.ai,15165,Participant 241,14990,"Yeah, but they need some sort of cling form or something to go over it?",16,39,NA,15164,3,241,1_1_5,999,taskwork,2,FALSE,718,718,0,1,0,0,0
03_02_2021_vero #1_task_round 2_otter.ai,15166,Participant 718,14990,Sure. Um How about a pin?,16,44,NA,15165,3,718,1_1_5,1004,taskwork,2,FALSE,241,"241,all","0,0","0,0","0,0","0,0","0,0"
03_02_2021_vero #1_task_round 2_otter.ai,15167,Participant 597,14990,Yeah.,16,57,NA,15166,3,597,1_1_5,1017,taskwork,2,FALSE,718,718,0,0,0,0,0
03_02_2021_vero #1_task_round 2_otter.ai,15168,Participant 241,14990,Like an antenna for like a like a mobile phone if your back your old school imagine that's old school. Motorola's that had the antenna that pulled out that broke off. You could put your pin in there and then just use it as an antenna.,17,1,NA,15167,3,241,1_1_5,1021,taskwork,2,FALSE,597,all,0,0,0,0,0
03_02_2021_vero #1_task_round 2_otter.ai,15169,Participant 718,14990,"Alright. Yes, Vero. What is your idea?",17,18,NA,15168,3,718,1_1_5,1038,taskwork,2,FALSE,241,"241,0","0,0","0,0","0,0","0,0","0,0"
03_02_2021_vero #1_task_round 2_otter.ai,15170,Vero,14990,I have an idea. What about bubble wand?,17,25,NA,15169,3,vero1_1_5,1_1_5,1045,taskwork,2,TRUE,718,718,0,0,0,0,0
03_02_2021_vero #1_task_round 2_otter.ai,15171,Participant 718,14990,"Oh, yeah. Yeah, yeah.",17,29,NA,15170,3,718,1_1_5,1049,taskwork,2,FALSE,vero1_1_5,0,0,0,0,0,0
03_02_2021_vero #1_task_round 2_otter.ai,15172,Participant 718,14990,Good job Vero. Can it be used to seal packages?,17,29,NA,15171,3,718,1_1_5,1049,taskwork,2,FALSE,718,"0,all","1,0","0,0","0,0","0,0","0,0"
03_02_2021_vero #1_task_round 2_otter.ai,15173,Participant 597,14990,"Maybe, you can put it down.",18,2,NA,15172,3,597,1_1_5,1082,taskwork,2,FALSE,718,718,0,0,0,0,0
03_02_2021_vero #1_task_round 2_otter.ai,15174,Participant 718,14990,Okay.,18,5,NA,15173,3,718,1_1_5,1085,taskwork,2,FALSE,597,597,0,0,0,0,0
03_02_2021_vero #1_task_round 2_otter.ai,15175,Participant 597,14990,"So like to unclog like, the caps of things like like glue and stuff.",18,6,NA,15174,3,597,1_1_5,1086,taskwork,2,FALSE,718,all,0,0,0,0,0
03_02_2021_vero #1_task_round 2_otter.ai,15176,Participant 241,14990,"Yeah, that could work.",18,15,NA,15175,3,241,1_1_5,1095,taskwork,2,FALSE,597,597,0,0,0,0,0
03_02_2021_vero #1_task_round 2_otter.ai,15177,Participant 718,14990,Vero. What do you have?,18,49,NA,15176,3,718,1_1_5,1129,taskwork,2,FALSE,241,0,0,0,0,0,0
03_02_2021_vero #1_task_round 2_otter.ai,15178,Vero,14990,I have an idea. What about twist tie?,18,54,NA,15177,3,vero1_1_5,1_1_5,1134,taskwork,2,TRUE,718,718,0,0,0,0,0
03_02_2021_vero #1_task_round 2_otter.ai,15179,Participant 597,14990,"OH yeah. It's kind of like you're like,",18,59,NA,15178,3,597,1_1_5,1139,taskwork,2,FALSE,vero1_1_5,0,0,0,0,0,0
03_02_2021_vero #1_task_round 2_otter.ai,15180,Participant 718,14990,"yeah,",19,2,NA,15179,3,718,1_1_5,1142,taskwork,2,FALSE,597,597,0,0,0,0,0
03_02_2021_vero #1_task_round 2_otter.ai,15181,Participant 597,14990,Yeah. Um,19,3,NA,15180,3,597,1_1_5,1143,taskwork,2,FALSE,718,all,0,0,0,0,0
03_02_2021_vero #1_task_round 2_otter.ai,15182,Participant 597,14990,I'm kind of running out of ideas. Vero Do you have anything else?,19,3,NA,15181,3,597,1_1_5,1143,taskwork,2,FALSE,597,"all,0","0,0","0,0","0,0","0,0","0,0"
03_02_2021_vero #1_task_round 2_otter.ai,15183,Vero,14990,I have an idea. What about corn holder?,19,18,NA,15182,3,vero1_1_5,1_1_5,1158,taskwork,2,TRUE,597,597,0,0,0,0,0
03_02_2021_vero #1_task_round 2_otter.ai,15184,Participant 718,14990,What holder?,19,23,NA,15183,3,718,1_1_5,1163,taskwork,2,FALSE,vero1_1_5,0,0,0,0,0,0
03_02_2021_vero #1_task_round 2_otter.ai,15185,Vero,14990,A utensil or sharp object that can be inserted into the two ends of corn on a cob in order to eat the corn without having to touch it when it is hot.,19,28,NA,15184,3,vero1_1_5,1_1_5,1168,taskwork,2,TRUE,718,718,0,0,0,0,0
03_02_2021_vero #1_task_round 2_otter.ai,15186,Participant 597,14990,"Oh, yeah.",19,39,NA,15185,3,597,1_1_5,1179,taskwork,2,FALSE,vero1_1_5,0,0,0,0,0,0
03_02_2021_vero #1_task_round 2_otter.ai,15187,Participant 718,14990,Isn't it too weak to hold up a whole cob of corn?,19,40,NA,15186,3,718,1_1_5,1180,taskwork,2,FALSE,597,all,0,0,0,0,0
03_02_2021_vero #1_task_round 2_otter.ai,15188,Participant 597,14990,Probably not actually.,19,44,NA,15187,3,597,1_1_5,1184,taskwork,2,FALSE,718,718,0,1,0,0,0
03_02_2021_vero #1_task_round 2_otter.ai,15189,Participant 718,14990,Okay. Yeah.,19,46,NA,15188,3,718,1_1_5,1186,taskwork,2,FALSE,597,597,0,0,0,0,0
03_02_2021_vero #1_task_round 2_otter.ai,15190,Participant 718,14990,Why not then,19,46,NA,15189,3,718,1_1_5,1186,taskwork,2,FALSE,718,all,0,0,0,0,0
03_02_2021_vero #1_task_round 2_otter.ai,15191,Participant 597,14990,"We used to have those at home and they're always like, really like flimsy things. Sure.",19,50,NA,15190,3,597,1_1_5,1190,taskwork,2,FALSE,718,all,0,0,0,0,0
03_02_2021_vero #1_task_round 2_otter.ai,15192,Participant 718,14990,Yeah. Let's put it that. Okay. What up? why don't why don't we put skewer as well? Yeah,19,57,NA,15191,3,718,1_1_5,1197,taskwork,2,FALSE,597,"597,all","0,0","0,0","0,0","0,0","0,0"
03_02_2021_vero #1_task_round 2_otter.ai,15193,Participant 597,14990,I feel like Vero's from the Midwest that's an extreme,20,7,NA,15192,3,597,1_1_5,1207,taskwork,2,FALSE,718,all,0,0,0,0,2
03_02_2021_vero #1_task_round 2_otter.ai,15194,Participant 597,14990,"Yeah,",20,7,NA,15193,3,597,1_1_5,1207,taskwork,2,FALSE,597,all,0,0,0,0,0
03_02_2021_vero #1_task_round 2_otter.ai,15195,Participant 241,14990,Are you a farmer Vero?,20,15,NA,15194,3,241,1_1_5,1215,taskwork,2,FALSE,597,0,0,0,0,0,0
03_02_2021_vero #1_task_round 2_otter.ai,15196,Vero,14990,I'm sorry i'm not sure about that. Try asking me about my thoughts on particular ideas or if I have an idea I'd like to share,20,26,NA,15195,3,vero1_1_5,1_1_5,1226,taskwork,2,TRUE,241,241,0,0,0,0,0
03_02_2021_vero #1_task_round 2_otter.ai,15197,Participant 597,14990,Vero said that's military secrets,20,35,NA,15196,3,597,1_1_5,1235,taskwork,2,FALSE,vero1_1_5,all,0,0,0,0,2
03_02_2021_vero #1_task_round 2_otter.ai,15198,Participant 597,14990,um,20,35,NA,15197,3,597,1_1_5,1235,taskwork,2,FALSE,597,all,0,0,0,0,0
03_02_2021_vero #1_task_round 2_otter.ai,15199,Participant 718,14990,Oh he's jumping again Vero what what idea do you have,20,46,NA,15198,3,718,1_1_5,1246,taskwork,2,FALSE,597,"all,0","0,0","0,0","0,0","0,0","0,0"
03_02_2021_vero #1_task_round 2_otter.ai,15200,Vero,14990,I have an idea what conducter,20,52,NA,15199,3,vero1_1_5,1_1_5,1252,taskwork,2,TRUE,718,718,0,0,0,0,0
03_02_2021_vero #1_task_round 2_otter.ai,15201,Participant 718,14990,"Okay, I think we talked about that that circuit thing.",20,59,NA,15200,3,718,1_1_5,1259,taskwork,2,FALSE,vero1_1_5,"0,all","0,0","0,1","0,0","0,0","0,0"
03_02_2021_vero #1_task_round 2_otter.ai,15202,Participant 597,14990,"Electrical wiring, but yeah, like, yeah.",21,1,NA,15201,3,597,1_1_5,1261,taskwork,2,FALSE,718,718,0,0,0,0,0
03_02_2021_vero #1_task_round 2_otter.ai,15203,Participant 718,14990,We see we said a toothpick already right. I think Jack said that.,21,6,NA,15202,3,718,1_1_5,1266,taskwork,2,FALSE,597,all,0,0,0,0,0
03_02_2021_vero #1_task_round 2_otter.ai,15204,Participant 597,14990,"Yeah, that's the first thing I've got on this list. I think we're like close. We have a minute left.",21,9,NA,15203,3,597,1_1_5,1269,taskwork,2,FALSE,718,"718,all","0,0","0,0","0,0","0,0","0,0"
03_02_2021_vero #1_task_round 2_otter.ai,15205,Participant 718,14990,Okay.,21,19,NA,15204,3,718,1_1_5,1279,taskwork,2,FALSE,597,597,0,0,0,0,0
03_02_2021_vero #1_task_round 2_otter.ai,15206,Participant 597,14990,Vero any last thoughts? Because,21,21,NA,15205,3,597,1_1_5,1281,taskwork,2,FALSE,718,0,0,0,0,0,0
03_02_2021_vero #1_task_round 2_otter.ai,15207,Vero,14990,I have no idea. What about a splint?,21,28,NA,15206,3,vero1_1_5,1_1_5,1288,taskwork,2,TRUE,597,597,0,0,0,0,0
03_02_2021_vero #1_task_round 2_otter.ai,15208,Participant 241,14990,"splint for a mouse? Yeah, that worked fine.",21,36,NA,15207,3,241,1_1_5,1296,taskwork,2,FALSE,vero1_1_5,"0,all","0,0","0,0","0,0","0,0","0,0"
03_02_2021_vero #1_task_round 2_otter.ai,15209,Participant 597,14990,I feel like a broken finger is something,21,40,NA,15208,3,597,1_1_5,1300,taskwork,2,FALSE,241,all,0,0,0,0,0
03_02_2021_vero #1_task_round 2_otter.ai,15210,Vero,14990,A piece of rigid material that can be used to support a broken bone and keep it in position when it has set back in place.,21,43,NA,15209,3,vero1_1_5,1_1_5,1303,taskwork,2,TRUE,597,all,0,0,0,0,0
03_02_2021_vero #1_task_round 2_otter.ai,15211,Participant 718,14990,"Yeah, why not? We'll put it down.",21,55,NA,15210,3,718,1_1_5,1315,taskwork,2,FALSE,vero1_1_5,all,0,0,0,0,0
03_02_2021_vero #1_task_round 2_otter.ai,15212,Participant 597,14990,I'll copy and paste the list. I feel like Vero did a much better job scheduling that appointment.,21,57,NA,15211,3,597,1_1_5,1317,taskwork,2,FALSE,718,all,0,0,0,0,1
03_02_2021_vero #1_task_round 2_otter.ai,15213,Participant 718,14990,Yeah.,22,8,NA,15212,3,718,1_1_5,1328,taskwork,2,FALSE,597,597,0,0,0,0,0
03_02_2021_vero #1_task_round 2_otter.ai,15214,Participant 597,14990,Okay. Yeah. I don't know.,22,14,NA,15213,3,597,1_1_5,1334,taskwork,2,FALSE,718,all,0,0,0,0,0
03_02_2021_vero #1_task_round 2_otter.ai,15215,Participant 718,14990,"Actually. Vero, can you record a list?",22,20,NA,15214,3,718,1_1_5,1340,taskwork,2,FALSE,597,0,0,0,0,0,0
03_02_2021_vero #1_task_round 2_otter.ai,15216,Vero,14990,"That is not in my database. Try asking me about my thoughts on particular ideas, or if I have an idea I'd like to share.",22,32,NA,15215,3,vero1_1_5,1_1_5,1352,taskwork,2,TRUE,718,718,0,0,0,0,0
03_02_2021_vero #1_task_round 2_otter.ai,15217,Participant 718,14990,"Okay. Yes, it's purely informational then.",22,41,NA,15216,3,718,1_1_5,1361,taskwork,2,FALSE,vero1_1_5,all,0,0,0,0,3
03_02_2021_vero #1_task_round 2_otter.ai,15218,Participant 241,14990,Is the password...,22,52,NA,15217,3,241,1_1_5,1372,taskwork,2,FALSE,718,all,0,0,0,0,0
03_02_2021_vero #1_task_round 2_otter.ai,15219,Vero,14990,I have an idea. What about drumstick?,22,54,NA,15218,3,vero1_1_5,1_1_5,1374,taskwork,2,TRUE,241,all,0,0,0,0,0
03_02_2021_vero #1_task_round 2_otter.ai,15220,Participant 597,14990,Like,23,2,NA,15219,3,597,1_1_5,1382,taskwork,2,FALSE,vero1_1_5,all,0,0,0,0,0
03_02_2021_vero #1_task_round 2_otter.ai,15221,Participant 718,14990,I guess like for a drum? Go home Vero you're drunk?,23,4,NA,15220,3,718,1_1_5,1384,taskwork,2,FALSE,597,"all,0","0,0","0,0","0,0","0,2","0,0"
03_02_2021_vero #1_task_round 2_otter.ai,15222,Participant 597,14990,"Yeah, okay. Well, anyways,",23,14,NA,15221,3,597,1_1_5,1394,taskwork,2,FALSE,718,all,0,0,0,0,0
03_02_2021_vero #1_task_round 2_otter.ai,15223,Participant 718,14990,yeah. Okay. What's the password? The password just yet?,23,17,NA,15222,3,718,1_1_5,1397,taskwork,2,FALSE,597,all,0,0,0,0,0
03_02_2021_vero #1_task_round 2_otter.ai,15224,Participant 597,14990,Okay. They always do it right after. I think this is a good list. Good job team.,23,22,NA,15223,3,597,1_1_5,1402,taskwork,2,FALSE,718,all,3,0,0,0,0
03_02_2021_vero #1_task_round 2_otter.ai,15225,Participant 241,14990,Thanks Vero. Work. Has anyone seen that?,23,30,NA,15224,3,241,1_1_5,1410,taskwork,2,FALSE,597,"0,all","1,0","0,0","0,0","0,0","0,0"
03_02_2021_vero #1_task_round 2_otter.ai,15226,Participant 718,14990,Yep.,24,7,0,15225,3,718,1_1_5,1447,taskwork,2,FALSE,241,all,0,0,0,0,0
