file.name,id,user,root,text,min,sec,nanosec,reply.to,n.participants,user_id,Team_id,time,condition,round,is_vero,user_id2,to,task_pos,task_conf,rel_pos,rel_conf,3rdVero
03_04_2021_vero #1_task_round 1_otter.ai,17184,Participant 429,17064,"Yeah, I got an email about it. This the subject lines says to send responses the strong presession survey.",17,9,NA,17183,3,429,116,1029,taskwork,1,FALSE,399,399,0,0,0,0,0
03_04_2021_vero #1_task_round 1_otter.ai,17185,Participant 399,17064,"Hmm. Oh, here",17,18,NA,17184,3,399,116,1038,taskwork,1,FALSE,429,"429,all","0,0","0,0","0,0","0,0","0,0"
03_04_2021_vero #1_task_round 1_otter.ai,17186,Participant 399,17064,"it is. Yeah, I see. What else could we use it for?",17,18,NA,17185,3,399,116,1038,taskwork,1,FALSE,399,all,0,0,0,0,0
03_04_2021_vero #1_task_round 1_otter.ai,17187,Participant 342,17064,"Did we say as um, as some as something to put as an art piece? Like you could paint it?",17,29,NA,17186,3,342 (392),116,1049,taskwork,1,FALSE,399,all,0,0,0,0,0
03_04_2021_vero #1_task_round 1_otter.ai,17188,Participant 399,17064,"Oh, yeah.",17,36,NA,17187,3,399,116,1056,taskwork,1,FALSE,342 (392),342,0,0,0,0,0
03_04_2021_vero #1_task_round 1_otter.ai,17189,Participant 399,17064,As an art piece.,17,36,NA,17188,3,399,116,1056,taskwork,1,FALSE,399,342,0,0,0,0,0
03_04_2021_vero #1_task_round 1_otter.ai,17190,Participant 429,17064,How about as a paperweight too,17,45,NA,17189,3,429,116,1065,taskwork,1,FALSE,399,all,0,0,0,0,0
03_04_2021_vero #1_task_round 1_otter.ai,17191,Participant 399,17064,"I think we wrote that one down. Or I haven't written down. Yeah, for the ones that you said. Oh, I said wait for exercising is something that",17,49,NA,17190,3,399,116,1069,taskwork,1,FALSE,429,"429,all","1,0","1,0","0,0","0,0","0,0"
03_04_2021_vero #1_task_round 1_otter.ai,17192,Participant 429,17064,"Oh, yeah. Yeah.",18,1,NA,17191,3,429,116,1081,taskwork,1,FALSE,399,399,0,0,0,0,0
03_04_2021_vero #1_task_round 1_otter.ai,17193,Participant 399,17064,"Oh, I put like as a circus artist, you know, like sometimes they they have like a bass to put there for a handstand. I guess like as a base for a handstand for circus artists.",18,12,NA,17192,3,399,116,1092,taskwork,1,FALSE,429,all,0,0,0,0,0
03_04_2021_vero #1_task_round 1_otter.ai,17194,Participant 342,17064,Did we say doorstop?,18,41,NA,17193,3,342 (392),116,1121,taskwork,1,FALSE,399,all,0,0,0,0,0
03_04_2021_vero #1_task_round 1_otter.ai,17195,Participant 399,17064,Yes.,18,44,NA,17194,3,399,116,1124,taskwork,1,FALSE,342 (392),342,0,1,0,0,0
03_04_2021_vero #1_task_round 1_otter.ai,17196,Participant 399,17064,"I'm gonna send through the chat what we have already. Um, Oh, I sent it to everybody.",18,44,NA,17195,3,399,116,1124,taskwork,1,FALSE,399,all,0,0,0,0,0
03_04_2021_vero #1_task_round 1_otter.ai,17197,Participant 399,17064,"Everyone, look at our answers.",18,44,NA,17196,3,399,116,1124,taskwork,1,FALSE,399,all,0,0,0,0,0
03_04_2021_vero #1_task_round 1_otter.ai,17198,Participant 399,17064,I'm just gonna use a brick wall.,18,44,NA,17197,3,399,116,1124,taskwork,1,FALSE,399,all,0,0,0,0,0
03_04_2021_vero #1_task_round 1_otter.ai,17199,Participant 342,17064,To build a wall to put,19,27,NA,17198,3,342 (392),116,1167,taskwork,1,FALSE,399,all,0,0,0,0,0
03_04_2021_vero #1_task_round 1_otter.ai,17200,Participant 399,17064,I'm putting in the chat.To build a little wall.,19,34,NA,17199,3,399,116,1174,taskwork,1,FALSE,342 (392),all,0,0,0,0,0
03_04_2021_vero #1_task_round 1_otter.ai,17201,Participant 399,17064,"It can be a pillow. Like a very uncomfortable pillow, but it can be like a place to like lay your head if you're sleeping in a place where that's the only pillow",19,34,NA,17200,3,399,116,1174,taskwork,1,FALSE,399,all,0,0,0,0,0
03_04_2021_vero #1_task_round 1_otter.ai,17202,Participant 429,17064,"You can use it to build a cobblestone street,",19,59,NA,17201,3,429,116,1199,taskwork,1,FALSE,399,all,0,0,0,0,0
03_04_2021_vero #1_task_round 1_otter.ai,17203,Participant 342,17064,yep.,20,4,NA,17202,3,342 (392),116,1204,taskwork,1,FALSE,429,429,0,0,0,0,0
03_04_2021_vero #1_task_round 1_otter.ai,17204,Participant 342,17064,To build a well,20,4,NA,17203,3,342 (392),116,1204,taskwork,1,FALSE,342 (392),all,0,0,0,0,0
03_04_2021_vero #1_task_round 1_otter.ai,17205,Participant 399,17064,"to build a well,",20,17,NA,17204,3,399,116,1217,taskwork,1,FALSE,342 (392),342,0,0,0,0,0
03_04_2021_vero #1_task_round 1_otter.ai,17206,Participant 399,17064,is this something where we can only use one brick? Or is the use of bricks in general?,20,17,NA,17205,3,399,116,1217,taskwork,1,FALSE,399,all,0,0,0,0,0
03_04_2021_vero #1_task_round 1_otter.ai,17207,Participant 429,17064,"Well, I mean, I didn't specify so a brick, it doesn't necessarily mean",20,29,NA,17206,3,429,116,1229,taskwork,1,FALSE,399,399,0,0,0,0,0
03_04_2021_vero #1_task_round 1_otter.ai,17208,Participant 399,17064,"building one brick. Right? Yeah, I just like sitting",20,35,NA,17207,3,399,116,1235,taskwork,1,FALSE,429,429,0,0,0,0,0
03_04_2021_vero #1_task_round 1_otter.ai,17209,Participant 342,17064,on my wall or part of my.,20,38,NA,17208,3,342 (392),116,1238,taskwork,1,FALSE,399,all,0,0,0,0,0
03_04_2021_vero #1_task_round 1_otter.ai,17210,Participant 399,17064,"Yeah, yeah. That was something that I wasn't sure. The first time I was like, this is like, how many bricks do I have?",20,41,NA,17209,3,399,116,1241,taskwork,1,FALSE,342 (392),"342,all","1,0","0,0","0,0","0,0","0,0"
03_04_2021_vero #1_task_round 1_otter.ai,17211,Participant 429,17064,"Yeah, this is open to interpretation. Yeah, I guess so. Um,",20,47,NA,17210,3,429,116,1247,taskwork,1,FALSE,399,399,0,0,0,0,0
03_04_2021_vero #1_task_round 1_otter.ai,17212,Participant 399,17064,"as a I don't know what to call that. But you know, when you have like, a loose sheet of paper, and you have to put it on something as support like,",20,54,NA,17211,3,399,116,1254,taskwork,1,FALSE,429,all,0,0,0,0,0
03_04_2021_vero #1_task_round 1_otter.ai,17213,Participant 429,17064,like a hard surface to write on?,21,1,NA,17212,3,429,116,1261,taskwork,1,FALSE,399,399,0,0,0,0,0
03_04_2021_vero #1_task_round 1_otter.ai,17214,Participant 399,17064,"Yeah, yeah. I guess.",21,4,NA,17213,3,399,116,1264,taskwork,1,FALSE,429,429,1,0,0,0,0
03_04_2021_vero #1_task_round 1_otter.ai,17215,Participant 429,17064,Do we say like a table.,21,18,NA,17214,3,429,116,1278,taskwork,1,FALSE,399,all,0,0,0,0,0
03_04_2021_vero #1_task_round 1_otter.ai,17216,Participant 399,17064,No,21,21,NA,17215,3,399,116,1281,taskwork,1,FALSE,429,429,0,0,0,0,0
03_04_2021_vero #1_task_round 1_otter.ai,17217,Participant 429,17064,Like a very small table.,21,22,NA,17216,3,429,116,1282,taskwork,1,FALSE,399,all,0,0,0,0,0
03_04_2021_vero #1_task_round 1_otter.ai,17218,Participant 399,17064,Very small table.,21,25,NA,17217,3,399,116,1285,taskwork,1,FALSE,429,429,0,0,0,0,0
03_04_2021_vero #1_task_round 1_otter.ai,17219,Participant 342,17064,Use it as a nail file.,21,32,NA,17218,3,342 (392),116,1292,taskwork,1,FALSE,399,all,0,0,0,0,0
03_04_2021_vero #1_task_round 1_otter.ai,17220,Participant 429,17064,"Oh, yeah. That's true",21,35,NA,17219,3,429,116,1295,taskwork,1,FALSE,342 (392),342,1,0,0,0,0
03_04_2021_vero #1_task_round 1_otter.ai,17221,Participant 399,17064,A nail file? Yeah.,21,37,NA,17220,3,399,116,1297,taskwork,1,FALSE,429,342,0,0,0,0,0
03_04_2021_vero #1_task_round 1_otter.ai,17222,Participant 429,17064,"Um,",21,40,NA,17221,3,429,116,1300,taskwork,1,FALSE,399,all,0,0,0,0,0
03_04_2021_vero #1_task_round 1_otter.ai,17223,Participant 399,17064,"maybe you start a fire. Like if you do it with a rock. Like, can you start a fire with a brick?",21,41,NA,17222,3,399,116,1301,taskwork,1,FALSE,429,all,0,0,0,0,0
03_04_2021_vero #1_task_round 1_otter.ai,17224,Participant 429,17064,Yeah. Maybe start a fire,21,47,NA,17223,3,429,116,1307,taskwork,1,FALSE,399,399,1,0,0,0,0
03_04_2021_vero #1_task_round 1_otter.ai,17225,Participant 399,17064,Maybe to start a fire. Might not be effective. But yeah.,21,51,NA,17224,3,399,116,1311,taskwork,1,FALSE,429,all,0,0,0,0,0
03_04_2021_vero #1_task_round 1_otter.ai,17226,Participant 429,17064,Maybe as a soap dish.,21,58,NA,17225,3,429,116,1318,taskwork,1,FALSE,399,all,0,0,0,0,0
03_04_2021_vero #1_task_round 1_otter.ai,17227,Participant 399,17064,As a soap dish.,22,2,NA,17226,3,399,116,1322,taskwork,1,FALSE,429,429,0,0,0,0,0
03_04_2021_vero #1_task_round 1_otter.ai,17228,Participant 429,17064,Maybe just put a bar of soap at the top.,22,5,NA,17227,3,429,116,1325,taskwork,1,FALSE,399,all,0,0,0,0,0
03_04_2021_vero #1_task_round 1_otter.ai,17229,Participant 399,17064,"Yeah. Oh, yes.",22,7,NA,17228,3,399,116,1327,taskwork,1,FALSE,429,429,1,0,0,0,0
03_04_2021_vero #1_task_round 1_otter.ai,17230,Participant 399,17064,"It can be like a little, you know, to put stuff inside the little holes. I mean, it depends on the kind of break but some bricks have a big hole. Like as a place to hide drugs and the",22,7,NA,17229,3,399,116,1327,taskwork,1,FALSE,399,all,0,0,0,0,0
03_04_2021_vero #1_task_round 1_otter.ai,17231,Participant 429,17064,container?,22,27,NA,17230,3,429,116,1347,taskwork,1,FALSE,399,399,0,0,0,0,0
03_04_2021_vero #1_task_round 1_otter.ai,17232,Participant 342,17064,"container. Yeah,",22,30,NA,17231,3,342 (392),116,1350,taskwork,1,FALSE,429,429,0,0,0,0,0
03_04_2021_vero #1_task_round 1_otter.ai,17233,Participant 399,17064,"I just remember one time in my life. I saw cops putting what seemed to be drugs in a wall. Oh, my strange memories. So like I was saying I'm like, it was a strange time. I was very young What are they doing putting in that brick",22,33,NA,17232,3,399,116,1353,taskwork,1,FALSE,342 (392),all,0,0,0,0,0
03_04_2021_vero #1_task_round 1_otter.ai,17234,Participant 429,17064,"Could it be used as a part of flooring? in a house? I mean, maybe print floors",22,52,NA,17233,3,429,116,1372,taskwork,1,FALSE,399,all,0,0,0,0,0
03_04_2021_vero #1_task_round 1_otter.ai,17235,Participant 429,17064,Maybe like a pathway in front of your house? Maybe the pathway up to the door?,22,52,NA,17234,3,429,116,1372,taskwork,1,FALSE,429,all,0,0,0,0,0
03_04_2021_vero #1_task_round 1_otter.ai,17236,Participant 399,17064,For the Pathway Yeah.,23,7,NA,17235,3,399,116,1387,taskwork,1,FALSE,429,429,0,0,0,0,0
03_04_2021_vero #1_task_round 1_otter.ai,17237,Participant 342,17064,It says...What does it say? I can't read the little notes.,23,13,NA,17236,3,342 (392),116,1393,taskwork,1,FALSE,399,all,0,0,0,0,0
03_04_2021_vero #1_task_round 1_otter.ai,17238,Participant 429,17064,The time is up for the creativity test. Please stop the test. Repeat. Submit your responses as a team now and move on to the survey on the next page.,23,16,NA,17237,3,429,116,1396,taskwork,1,FALSE,342 (392),all,0,0,0,0,0
03_04_2021_vero #1_task_round 1_otter.ai,17239,Participant 342,17064,"Oh, did it give us a password?",23,27,NA,17238,3,342 (392),116,1407,taskwork,1,FALSE,429,all,0,0,0,0,0
03_04_2021_vero #1_task_round 1_otter.ai,17240,Participant 429,17064,I guess we'll wait on that one again.,23,29,NA,17239,3,429,116,1409,taskwork,1,FALSE,342 (392),342,0,0,0,0,0
03_04_2021_vero #1_task_round 1_otter.ai,17241,Participant 342,17064,"Oh, here we go.",23,32,NA,17240,3,342 (392),116,1412,taskwork,1,FALSE,429,all,0,0,0,0,0
03_04_2021_vero #1_task_round 1_otter.ai,17242,Participant 399,17064,"Okay, I'm confused.",23,34,NA,17241,3,399,116,1414,taskwork,1,FALSE,342 (392),all,0,0,0,0,0
03_04_2021_vero #1_task_round 1_otter.ai,17243,Participant 399,17064,I don't understand it. How submitting the answers is different from the password like if you have to wait. Just to submit.,23,34,NA,17242,3,399,116,1414,taskwork,1,FALSE,399,all,0,0,0,0,0
03_04_2021_vero #1_task_round 1_otter.ai,17244,Participant 429,17064,No.,23,45,NA,17243,3,429,116,1425,taskwork,1,FALSE,399,399,0,0,0,0,0
03_04_2021_vero #1_task_round 1_otter.ai,17245,Participant 429,17064,"Should we try to click the Submit? Yeah. Oh, it says pack pack",23,45,NA,17244,3,429,116,1425,taskwork,1,FALSE,429,all,0,0,0,0,0
03_04_2021_vero #1_task_round 1_otter.ai,17246,Participant 399,17064,You will not be asked to provide your perception of your team and all the tests you just complete. Did you respond to these questions individually?Okay.,23,56,NA,17245,3,399,116,1436,taskwork,1,FALSE,429,all,0,0,0,0,0
03_04_2021_vero #1_task_round 1_otter.ai,17247,Participant 429,17064,Do we not talk about these doing?,24,5,0,17246,3,429,116,1445,taskwork,1,FALSE,399,all,0,0,0,0,0
03_04_2021_vero #1_task_round 1_otter.ai,17248,Participant 399,17064,No.,24,7,0,17247,3,399,116,1447,taskwork,1,FALSE,429,429,0,0,0,0,0
03_04_2021_vero #1_task_round 1_otter.ai,17249,Participant 429,17064,Okay.,24,8,0,17248,3,429,116,1448,taskwork,1,FALSE,399,399,0,0,0,0,0
