file.name,id,user,root,text,min,sec,nanosec,reply.to,n.participants,user_id,Team_id,time,condition,round,is_vero,user_id2,to,task_pos,task_conf,rel_pos,rel_conf,3rdVero
03_10_2021_vero#3_task_round 3_otter.ai,38254,Vero,38116,I'm sorry. I'm not sure about that.,13,45,NA,38253,2,vero1_3_11,1_3_11,825,taskwork,3,TRUE,395,395,0,0,0,0,0
03_10_2021_vero#3_task_round 3_otter.ai,38255,Participant 395,38116,That's okay.,13,48,NA,38254,2,395,1_3_11,828,taskwork,3,FALSE,vero1_3_11,0,1,0,1,0,0
03_10_2021_vero#3_task_round 3_otter.ai,38256,Participant 825,38116,"Oh, an insulator, right. You can use like rubber bands as insulators.",13,50,NA,38255,2,825,1_3_11,830,taskwork,3,FALSE,395,all,0,0,0,0,0
03_10_2021_vero#3_task_round 3_otter.ai,38257,Participant 395,38116,I do not know but I'm not. I haven't taken a science class in a long time.,13,57,NA,38256,2,395,1_3_11,837,taskwork,3,FALSE,825,825,0,1,0,0,0
03_10_2021_vero#3_task_round 3_otter.ai,38258,Participant 395,38116,"I put it anyway, though. We can band together. I guess we've already we've already kind of said that.",13,57,NA,38257,2,395,1_3_11,837,taskwork,3,FALSE,395,all,0,0,0,0,0
03_10_2021_vero#3_task_round 3_otter.ai,38259,Participant 395,38116,Um,13,57,NA,38258,2,395,1_3_11,837,taskwork,3,FALSE,395,all,0,0,0,0,0
03_10_2021_vero#3_task_round 3_otter.ai,38260,Vero,38116,May I say something. I have an idea. What about bookmark.,14,36,NA,38259,2,vero1_3_11,1_3_11,876,taskwork,3,TRUE,395,all,0,0,0,0,0
03_10_2021_vero#3_task_round 3_otter.ai,38261,Participant 825,38116,Yeah i was just about to say bookmark,14,43,NA,38260,2,825,1_3_11,883,taskwork,3,FALSE,vero1_3_11,0,2,0,0,0,0
03_10_2021_vero#3_task_round 3_otter.ai,38262,Participant 395,38116,Great minds think alike,14,46,NA,38261,2,395,1_3_11,886,taskwork,3,FALSE,825,all,1,0,2,0,0
03_10_2021_vero#3_task_round 3_otter.ai,38263,Participant 825,38116,You can use rubber bands to...,14,56,NA,38262,2,825,1_3_11,896,taskwork,3,FALSE,395,all,0,0,0,0,0
03_10_2021_vero#3_task_round 3_otter.ai,38264,Participant 395,38116,A decoration. Anything can be a decoration if you want it to be.,15,5,NA,38263,2,395,1_3_11,905,taskwork,3,FALSE,825,all,0,0,0,0,0
03_10_2021_vero#3_task_round 3_otter.ai,38265,Vero,38116,I have an idea. What about musical instrument?,15,33,NA,38264,2,vero1_3_11,1_3_11,933,taskwork,3,TRUE,395,all,0,0,0,0,0
03_10_2021_vero#3_task_round 3_otter.ai,38266,Participant 395,38116,Yeah.,15,39,NA,38265,2,395,1_3_11,939,taskwork,3,FALSE,vero1_3_11,0,1,0,0,0,0
03_10_2021_vero#3_task_round 3_otter.ai,38267,Participant 395,38116,Vero's coming in with the musical progressions,15,39,NA,38266,2,395,1_3_11,939,taskwork,3,FALSE,395,all,0,0,1,0,1
03_10_2021_vero#3_task_round 3_otter.ai,38268,Participant 825,38116,Really?,16,7,NA,38267,2,825,1_3_11,967,taskwork,3,FALSE,395,395,0,0,0,0,0
03_10_2021_vero#3_task_round 3_otter.ai,38269,Participant 395,38116,"Yes, Vero.",16,40,NA,38268,2,395,1_3_11,1000,taskwork,3,FALSE,825,0,0,0,0,0,0
03_10_2021_vero#3_task_round 3_otter.ai,38270,Vero,38116,I have an idea. What about heart rate monitor strap?,16,43,NA,38269,2,vero1_3_11,1_3_11,1003,taskwork,3,TRUE,395,all,0,0,0,0,0
03_10_2021_vero#3_task_round 3_otter.ai,38271,Participant 825,38116,"Oh, heartbeat monitor straps.",16,48,NA,38270,2,825,1_3_11,1008,taskwork,3,FALSE,vero1_3_11,0,0,0,0,0,0
03_10_2021_vero#3_task_round 3_otter.ai,38272,Participant 395,38116,Yeah.,16,52,NA,38271,2,395,1_3_11,1012,taskwork,3,FALSE,825,825,0,0,0,0,0
03_10_2021_vero#3_task_round 3_otter.ai,38273,Participant 395,38116,I realize I have no idea what a heartrate monitor looks like,16,52,NA,38272,2,395,1_3_11,1012,taskwork,3,FALSE,395,all,0,0,0,0,0
03_10_2021_vero#3_task_round 3_otter.ai,38274,Participant 825,38116,just like a rubber band and so... I guess you can fling rubber bands.,17,8,NA,38273,2,825,1_3_11,1028,taskwork,3,FALSE,395,395,0,0,0,0,0
03_10_2021_vero#3_task_round 3_otter.ai,38275,Participant 395,38116,"Yeah, like, Oh, yeah. Could be like a game piece.",17,16,NA,38274,2,395,1_3_11,1036,taskwork,3,FALSE,825,825,1,0,0,0,0
03_10_2021_vero#3_task_round 3_otter.ai,38276,Participant 825,38116,Yeah.,17,19,NA,38275,2,825,1_3_11,1039,taskwork,3,FALSE,395,395,1,0,0,0,0
03_10_2021_vero#3_task_round 3_otter.ai,38277,Participant 395,38116,"Oh, I said you can tie it around. Like, like, if you're trying to like strain something with like, use cloth and you can like wrap it around to hold like, hold a lid to something basically.",17,43,NA,38276,2,395,1_3_11,1063,taskwork,3,FALSE,825,all,0,0,0,0,0
03_10_2021_vero#3_task_round 3_otter.ai,38278,Participant 825,38116,"What would you like, say? As a gripper.",18,0,NA,38277,2,825,1_3_11,1080,taskwork,3,FALSE,395,395,0,0,0,0,0
03_10_2021_vero#3_task_round 3_otter.ai,38279,Participant 395,38116,"Yeah, I'd like to create a lid.",18,5,NA,38278,2,395,1_3_11,1085,taskwork,3,FALSE,825,825,0,0,0,0,0
03_10_2021_vero#3_task_round 3_otter.ai,38280,Participant 825,38116,Yeah. You can use rubber bands to like help open jars. Some people do. Do you have any more ideas Vero?,18,7,NA,38279,2,825,1_3_11,1087,taskwork,3,FALSE,395,"all,0","0,0","0,0","0,0","0,0","0,0"
03_10_2021_vero#3_task_round 3_otter.ai,38281,Vero,38116,have an idea? What about outlook?,18,31,NA,38280,2,vero1_3_11,1_3_11,1111,taskwork,3,TRUE,825,all,0,0,0,0,0
03_10_2021_vero#3_task_round 3_otter.ai,38282,Participant 395,38116,Do you have another idea?,18,41,NA,38281,2,395,1_3_11,1121,taskwork,3,FALSE,vero1_3_11,0,0,0,0,0,0
03_10_2021_vero#3_task_round 3_otter.ai,38283,Vero,38116,I have an idea. What about snare?,18,47,NA,38282,2,vero1_3_11,1_3_11,1127,taskwork,3,TRUE,395,all,0,0,0,0,0
03_10_2021_vero#3_task_round 3_otter.ai,38284,Participant 825,38116,snare?,18,51,NA,38283,2,825,1_3_11,1131,taskwork,3,FALSE,vero1_3_11,0,0,0,0,0,0
03_10_2021_vero#3_task_round 3_otter.ai,38285,Vero,38116,a snare is a trap for catching birds or small animals. It consists of a loop of wire rope which pulls tight around an animal.,18,56,NA,38284,2,vero1_3_11,1_3_11,1136,taskwork,3,TRUE,825,825,0,0,0,0,0
03_10_2021_vero#3_task_round 3_otter.ai,38286,Participant 395,38116,"Oh. I assume that could happen somehow. Mini, maybe.",19,4,NA,38285,2,395,1_3_11,1144,taskwork,3,FALSE,vero1_3_11,all,1,0,0,0,0
03_10_2021_vero#3_task_round 3_otter.ai,38287,Participant 395,38116,They always come around the newspapers.,19,4,NA,38286,2,395,1_3_11,1144,taskwork,3,FALSE,395,all,0,0,0,0,0
03_10_2021_vero#3_task_round 3_otter.ai,38288,Participant 825,38116,Yeah.,19,37,NA,38287,2,825,1_3_11,1177,taskwork,3,FALSE,395,395,0,0,0,0,0
03_10_2021_vero#3_task_round 3_otter.ai,38289,Participant 395,38116,We kind of said that already. You could use it to like like tie up a bag to keep something fresh.,19,38,NA,38288,2,395,1_3_11,1178,taskwork,3,FALSE,825,all,0,0,0,0,0
03_10_2021_vero#3_task_round 3_otter.ai,38290,Participant 825,38116,Yeah.,19,56,NA,38289,2,825,1_3_11,1196,taskwork,3,FALSE,395,395,0,0,0,0,0
03_10_2021_vero#3_task_round 3_otter.ai,38291,Participant 395,38116,Last few seconds any ideas vero?,20,9,NA,38290,2,395,1_3_11,1209,taskwork,3,FALSE,825,0,0,0,0,0,0
03_10_2021_vero#3_task_round 3_otter.ai,38292,Vero,38116,I have an idea. What about standard for length?,20,14,NA,38291,2,vero1_3_11,1_3_11,1214,taskwork,3,TRUE,395,395,0,0,0,0,0
03_10_2021_vero#3_task_round 3_otter.ai,38293,Participant 395,38116,"Oh, okay.",20,19,NA,38292,2,395,1_3_11,1219,taskwork,3,FALSE,vero1_3_11,0,0,0,0,0,0
03_10_2021_vero#3_task_round 3_otter.ai,38294,Participant 395,38116,We could have said that for the other things too,20,19,NA,38293,2,395,1_3_11,1219,taskwork,3,FALSE,395,all,0,0,0,0,0
03_10_2021_vero#3_task_round 3_otter.ai,38295,Participant 825,38116,I don't think I can think of any more,20,38,NA,38294,2,825,1_3_11,1238,taskwork,3,FALSE,395,all,0,1,0,0,0
03_10_2021_vero#3_task_round 3_otter.ai,38296,Participant 395,38116,"me neither, and time is up. Vero is an interesting shape",20,41,NA,38295,2,395,1_3_11,1241,taskwork,3,FALSE,825,825,0,1,0,0,1
03_10_2021_vero#3_task_round 3_otter.ai,38297,Participant 395,38116,getting tired,20,41,NA,38296,2,395,1_3_11,1241,taskwork,3,FALSE,395,all,0,0,0,0,0
03_10_2021_vero#3_task_round 3_otter.ai,38298,Participant 825,38116,Yeah.,21,41,NA,38297,2,825,1_3_11,1301,taskwork,3,FALSE,395,395,0,0,0,0,0
03_10_2021_vero#3_task_round 3_otter.ai,38299,Participant 395,38116,My Pet is my human interaction for the day now.,21,41,NA,38298,2,395,1_3_11,1301,taskwork,3,FALSE,825,all,0,0,1,0,0
03_10_2021_vero#3_task_round 3_otter.ai,38300,Participant 825,38116,Okay there's so many things that I've missed. I miss,23,33,NA,38299,2,825,1_3_11,1413,taskwork,3,FALSE,395,all,0,0,0,0,0
03_10_2021_vero#3_task_round 3_otter.ai,38301,Participant 395,38116,Did you got the password?,23,41,NA,38300,2,395,1_3_11,1421,taskwork,3,FALSE,825,825,0,0,0,0,0
03_10_2021_vero#3_task_round 3_otter.ai,38302,Participant 825,38116,"I did not. Oh, it's wish. Wish I could yeah",23,43,NA,38301,2,825,1_3_11,1423,taskwork,3,FALSE,395,395,0,0,0,0,0
03_10_2021_vero#3_task_round 3_otter.ai,38303,Participant 825,38116,schedule our next hair appointment?,23,43,NA,38302,2,825,1_3_11,1423,taskwork,3,FALSE,825,all,0,0,1,0,0
03_10_2021_vero#3_task_round 3_otter.ai,38304,Participant 395,38116,not this time unfortunately,26,57,0,38303,2,395,1_3_11,1617,taskwork,3,FALSE,825,825,0,0,1,0,0
