file.name,id,user,root,text,min,sec,nanosec,reply.to,n.participants,user_id,Team_id,time,condition,round,is_vero,user_id2,to,task_pos,task_conf,rel_pos,rel_conf,3rdVero
05_12_2021_vero #8_round 3_otter.ai,8162,Participant 999,8032,"Okay, how about to hold your hair back up?",14,1,NA,8161,2,999,428,841,unleashed,3,FALSE,vero4_2_8,all,0,0,0,0,0
05_12_2021_vero #8_round 3_otter.ai,8163,Participant 127,8032,Yeah. Hold your hair back,14,16,NA,8162,2,127,428,856,unleashed,3,FALSE,999,999,0,0,0,0,0
05_12_2021_vero #8_round 3_otter.ai,8164,Vero,8032,It seems like we're in a brainstorming rut. What are some other categories of ideas we can think about?,14,25,NA,8163,2,vero4_2_8,428,865,unleashed,3,TRUE,127,all,0,0,0,0,0
05_12_2021_vero #8_round 3_otter.ai,8165,Participant 127,8032,How about hold your stockings up?,14,30,NA,8164,2,127,428,870,unleashed,3,FALSE,vero4_2_8,all,0,0,0,0,0
05_12_2021_vero #8_round 3_otter.ai,8166,Participant 999,8032,Yeah.,14,34,NA,8165,2,999,428,874,unleashed,3,FALSE,127,127,0,0,0,0,0
05_12_2021_vero #8_round 3_otter.ai,8167,Vero,8032,I know that if we give it our all we can be the highest scoring team this study has ever seen.,14,47,NA,8166,2,vero4_2_8,428,887,unleashed,3,TRUE,999,all,1,0,0,0,0
05_12_2021_vero #8_round 3_otter.ai,8168,Participant 127,8032,"Thank you, Vero. I love your confidence.",14,54,NA,8167,2,127,428,894,unleashed,3,FALSE,vero4_2_8,0,2,0,2,0,0
05_12_2021_vero #8_round 3_otter.ai,8169,Vero,8032,You're very welcome.,14,58,NA,8168,2,vero4_2_8,428,898,unleashed,3,TRUE,127,127,1,0,0,0,0
05_12_2021_vero #8_round 3_otter.ai,8170,Participant 127,8032,Oh let's see. I am in a rut my brain is kind of not working very well. To hold some...,15,2,NA,8169,2,127,428,902,unleashed,3,FALSE,vero4_2_8,all,0,0,0,0,0
05_12_2021_vero #8_round 3_otter.ai,8171,Vero,8032,I have an idea. What about a belt loop?,15,17,NA,8170,2,vero4_2_8,428,917,unleashed,3,TRUE,127,all,0,0,0,0,0
05_12_2021_vero #8_round 3_otter.ai,8172,Participant 127,8032,"Oh, okay. A belt loop",15,20,NA,8171,2,127,428,920,unleashed,3,FALSE,vero4_2_8,0,0,0,0,0,0
05_12_2021_vero #8_round 3_otter.ai,8173,Vero,8032,"Sorry to interrupt, Mary. What was your idea?",15,26,NA,8172,2,vero4_2_8,428,926,unleashed,3,TRUE,127,127,0,0,2,0,0
05_12_2021_vero #8_round 3_otter.ai,8174,Participant 127,8032,"Uh, holding a stack of letters together",15,29,NA,8173,2,127,428,929,unleashed,3,FALSE,vero4_2_8,0,0,0,0,0,0
05_12_2021_vero #8_round 3_otter.ai,8175,Participant 999,8032,Like an organizer letter.,15,35,NA,8174,2,999,428,935,unleashed,3,FALSE,127,127,0,0,0,0,0
05_12_2021_vero #8_round 3_otter.ai,8176,Participant 127,8032,Fix a broken toy I'm always breaking things.,15,46,NA,8175,2,127,428,946,unleashed,3,FALSE,999,all,0,0,0,0,0
05_12_2021_vero #8_round 3_otter.ai,8177,Participant 999,8032,You know when I when I took my dog out I needed to fasten the collar broke that a rubber band in my pocket.,15,53,NA,8176,2,999,428,953,unleashed,3,FALSE,127,all,0,0,0,0,0
05_12_2021_vero #8_round 3_otter.ai,8178,Participant 127,8032,Okay. Fix You know it's funny. I was just thinking about how to use a leash or a dog collar. And,16,4,NA,8177,2,127,428,964,unleashed,3,FALSE,999,999,1,0,1,0,0
05_12_2021_vero #8_round 3_otter.ai,8179,Participant 999,8032,"Yeah, I got a hit through rapid(?)",16,12,NA,8178,2,999,428,972,unleashed,3,FALSE,127,127,0,0,0,0,0
05_12_2021_vero #8_round 3_otter.ai,8180,Vero,8032,Great job so far team. We've come up with lots of ideas already. Let's try and keep the brainstorming going.,16,29,NA,8179,2,vero4_2_8,428,989,unleashed,3,TRUE,999,all,1,0,0,0,0
05_12_2021_vero #8_round 3_otter.ai,8181,Participant 999,8032,"Okay, Vero, do you have any more ideas?",16,37,NA,8180,2,999,428,997,unleashed,3,FALSE,vero4_2_8,0,0,0,0,0,0
05_12_2021_vero #8_round 3_otter.ai,8182,Vero,8032,I have an idea. What about a bookmark?,16,45,NA,8181,2,vero4_2_8,428,1005,unleashed,3,TRUE,999,999,0,0,0,0,0
05_12_2021_vero #8_round 3_otter.ai,8183,Participant 999,8032,Oh Yeah.,16,49,NA,8182,2,999,428,1009,unleashed,3,FALSE,vero4_2_8,0,0,0,0,0,0
05_12_2021_vero #8_round 3_otter.ai,8184,Participant 127,8032,That's a good idea.,16,53,NA,8183,2,127,428,1013,unleashed,3,FALSE,999,0,1,0,0,0,0
05_12_2021_vero #8_round 3_otter.ai,8185,Participant 999,8032,How about...,17,3,NA,8184,2,999,428,1023,unleashed,3,FALSE,127,all,0,0,0,0,0
05_12_2021_vero #8_round 3_otter.ai,8186,Participant 127,8032,You know how they use rubber bands to to to collect bouquets of flowers in the grocery store? Bundle fresh flowers I guess.,17,6,NA,8185,2,127,428,1026,unleashed,3,FALSE,999,all,0,0,0,0,0
05_12_2021_vero #8_round 3_otter.ai,8187,Participant 999,8032,Yeah. I like that. How about for braces? orthodontic braces? You remember that?,17,19,NA,8186,2,999,428,1039,unleashed,3,FALSE,127,"127,all","0,1","0,0","0,1","0,0","0,0"
05_12_2021_vero #8_round 3_otter.ai,8188,Participant 127,8032,Yeah. Oh yes How would you How are you going to word that?,17,33,NA,8187,2,127,428,1053,unleashed,3,FALSE,999,999,0,0,0,0,0
05_12_2021_vero #8_round 3_otter.ai,8189,Participant 999,8032,"Uh, orthodontic Yeah, brace. What they used to straighten the teeth helps the pressure",17,41,NA,8188,2,999,428,1061,unleashed,3,FALSE,127,127,0,0,0,0,0
05_12_2021_vero #8_round 3_otter.ai,8190,Participant 127,8032,Orthodontic,17,49,NA,8189,2,127,428,1069,unleashed,3,FALSE,999,999,0,0,0,0,0
05_12_2021_vero #8_round 3_otter.ai,8191,Participant 999,8032,Remember those little round? Did you ever have them?,17,52,NA,8190,2,999,428,1072,unleashed,3,FALSE,127,127,0,0,0,0,0
05_12_2021_vero #8_round 3_otter.ai,8192,Participant 127,8032,Yeah. My daughter did yeah.,17,54,NA,8191,2,127,428,1074,unleashed,3,FALSE,999,999,0,0,0,0,0
05_12_2021_vero #8_round 3_otter.ai,8193,Participant 999,8032,"Okay, how about you know when they do a rubber band ball?",17,59,NA,8192,2,999,428,1079,unleashed,3,FALSE,127,127,0,0,0,0,0
05_12_2021_vero #8_round 3_otter.ai,8194,Participant 127,8032,Making a ball out of rubber bands?,18,10,NA,8193,2,127,428,1090,unleashed,3,FALSE,999,999,0,0,0,0,0
05_12_2021_vero #8_round 3_otter.ai,8195,Participant 999,8032,For a file folder? to hold the papers in their file?,18,21,NA,8194,2,999,428,1101,unleashed,3,FALSE,127,all,0,0,0,0,0
05_12_2021_vero #8_round 3_otter.ai,8196,Participant 127,8032,Uh huh. like one of those binder things?,18,29,NA,8195,2,127,428,1109,unleashed,3,FALSE,999,999,0,0,0,0,0
05_12_2021_vero #8_round 3_otter.ai,8197,Participant 999,8032,Yeah.,18,33,NA,8196,2,999,428,1113,unleashed,3,FALSE,127,127,0,0,0,0,0
05_12_2021_vero #8_round 3_otter.ai,8198,Participant 127,8032,"Vero, you're awfully quiet.",18,38,NA,8197,2,127,428,1118,unleashed,3,FALSE,999,0,0,1,0,0,0
05_12_2021_vero #8_round 3_otter.ai,8199,Vero,8032,What can I help you with?,18,42,NA,8198,2,vero4_2_8,428,1122,unleashed,3,TRUE,127,127,0,0,0,0,0
05_12_2021_vero #8_round 3_otter.ai,8200,Participant 999,8032,A use for a rubber band.,18,46,NA,8199,2,999,428,1126,unleashed,3,FALSE,vero4_2_8,0,0,0,0,0,0
05_12_2021_vero #8_round 3_otter.ai,8201,Vero,8032,What about a slingshot?,18,51,NA,8200,2,vero4_2_8,428,1131,unleashed,3,TRUE,999,999,0,0,0,0,0
05_12_2021_vero #8_round 3_otter.ai,8202,Participant 999,8032,"Yeah, I think Mary hold that now. The first one. Oh, shooting up a paper plane. Yes, slingshot. Okay.",18,55,NA,8201,2,999,428,1135,unleashed,3,FALSE,vero4_2_8,0,0,1,0,0,0
05_12_2021_vero #8_round 3_otter.ai,8203,Participant 127,8032,Sort of the same concept but,19,5,NA,8202,2,127,428,1145,unleashed,3,FALSE,999,999,0,1,0,0,0
05_12_2021_vero #8_round 3_otter.ai,8204,Participant 999,8032,"Yeah, kind of the same.",19,7,NA,8203,2,999,428,1147,unleashed,3,FALSE,127,127,1,0,0,0,0
05_12_2021_vero #8_round 3_otter.ai,8205,Vero,8032,Just checking in we have one minute left.,19,12,NA,8204,2,vero4_2_8,428,1152,unleashed,3,TRUE,999,all,0,0,0,0,0
05_12_2021_vero #8_round 3_otter.ai,8206,Participant 999,8032,"Okay, thank you. Oh, I know they use it for banding for people's intestines to lose weight.",19,15,NA,8205,2,999,428,1155,unleashed,3,FALSE,vero4_2_8,"0,all","1,0","0,0","0,0","0,0","0,0"
05_12_2021_vero #8_round 3_otter.ai,8207,Vero,8032,That's a very creative idea.,19,30,NA,8206,2,vero4_2_8,428,1170,unleashed,3,TRUE,999,999,2,0,2,0,0
05_12_2021_vero #8_round 3_otter.ai,8208,Participant 127,8032,"Very,",19,32,NA,8207,2,127,428,1172,unleashed,3,FALSE,vero4_2_8,0,1,0,1,0,0
05_12_2021_vero #8_round 3_otter.ai,8209,Participant 999,8032,I think. Are they rubber?,19,32,NA,8208,2,999,428,1172,unleashed,3,FALSE,127,127,0,0,0,0,0
05_12_2021_vero #8_round 3_otter.ai,8210,Participant 127,8032,Press intestines.,19,35,NA,8209,2,127,428,1175,unleashed,3,FALSE,999,999,2,0,1,0,0
05_12_2021_vero #8_round 3_otter.ai,8211,Participant 999,8032,"I think the night has to end now. That was bad. And then how about newspapers remember that used to roll newspapers you need your and I think they still do that. So newspaper, bundler.",19,42,NA,8210,2,999,428,1182,unleashed,3,FALSE,127,all,0,0,0,0,0
05_12_2021_vero #8_round 3_otter.ai,8212,Participant 127,8032,Hold rolled newspaper.,19,58,NA,8211,2,127,428,1198,unleashed,3,FALSE,999,all,0,0,0,0,0
05_12_2021_vero #8_round 3_otter.ai,8213,Vero,8032,The same is true for magazines.,20,4,NA,8212,2,vero4_2_8,428,1204,unleashed,3,TRUE,127,all,0,0,0,0,0
05_12_2021_vero #8_round 3_otter.ai,8214,Participant 999,8032,Yeah.,20,7,NA,8213,2,999,428,1207,unleashed,3,FALSE,vero4_2_8,0,0,0,0,0,0
05_12_2021_vero #8_round 3_otter.ai,8215,Participant 127,8032,Yep.,20,8,NA,8214,2,127,428,1208,unleashed,3,FALSE,999,0,0,0,0,0,0
05_12_2021_vero #8_round 3_otter.ai,8216,Participant 999,8032,"Oh, tomato plants or plants in the garden.",20,14,NA,8215,2,999,428,1214,unleashed,3,FALSE,127,all,0,0,0,0,0
05_12_2021_vero #8_round 3_otter.ai,8217,Participant 127,8032,"Um, whoops.",20,20,NA,8216,2,127,428,1220,unleashed,3,FALSE,999,all,0,0,0,0,0
05_12_2021_vero #8_round 3_otter.ai,8218,Vero,8032,We are almost out of time team. Let's try and wrap this up.,20,24,NA,8217,2,vero4_2_8,428,1224,unleashed,3,TRUE,127,all,0,0,0,0,0
05_12_2021_vero #8_round 3_otter.ai,8219,Participant 127,8032,Okay. Ah Time's up.,20,28,NA,8218,2,127,428,1228,unleashed,3,FALSE,vero4_2_8,all,0,0,0,0,0
