file.name,id,user,root,text,min,sec,nanosec,reply.to,n.participants,user_id,Team_id,time,condition,round,is_vero,user_id2,to,task_pos,task_conf,rel_pos,rel_conf,3rdVero
05_12_2021_vero #8_round 1_otter.ai,7818,NA,7689,"Oh, yeah.",18,25,NA,7817,2,127,428,1105,unleashed,1,FALSE,127,NA,NA,NA,NA,NA,NA
05_12_2021_vero #8_round 1_otter.ai,7819,NA,7689,Or independently?,18,28,NA,7818,2,127,428,1108,unleashed,1,FALSE,127,NA,NA,NA,NA,NA,NA
05_12_2021_vero #8_round 1_otter.ai,7820,NA,7689,STRONG Team  18:29,18,28,NA,7819,2,127,428,1108,unleashed,1,FALSE,127,NA,NA,NA,NA,NA,NA
05_12_2021_vero #8_round 1_otter.ai,7821,NA,7689,"You're doing this as a team,",18,28,NA,7820,2,127,428,1108,unleashed,1,FALSE,127,NA,NA,NA,NA,NA,NA
05_12_2021_vero #8_round 1_otter.ai,7822,NA,7689,Okay.,18,31,NA,7821,2,127,428,1111,unleashed,1,FALSE,127,NA,NA,NA,NA,NA,NA
05_12_2021_vero #8_round 1_otter.ai,7823,Participant 999,7689,All right. So let's do it.,18,32,NA,7822,2,999,428,1112,unleashed,1,FALSE,127,all,1,0,0,0,0
05_12_2021_vero #8_round 1_otter.ai,7824,Participant 127,7689,First one let's do as a hammer,18,36,NA,7823,2,127,428,1116,unleashed,1,FALSE,999,all,0,0,0,0,0
05_12_2021_vero #8_round 1_otter.ai,7825,Participant 999,7689,"Yup, Yeah, I put that to actually I happen hammer tool. I have an arm weight.",18,40,NA,7824,2,999,428,1120,unleashed,1,FALSE,127,"127,all","2,0","0,0","0,0","0,0","0,0"
05_12_2021_vero #8_round 1_otter.ai,7826,Participant 127,7689,Arm weight.,18,50,NA,7825,2,127,428,1130,unleashed,1,FALSE,999,999,0,0,0,0,0
05_12_2021_vero #8_round 1_otter.ai,7827,Participant 999,7689,Okay. I have a weapon. I have a insect home.,18,51,NA,7826,2,999,428,1131,unleashed,1,FALSE,127,all,0,0,0,0,0
05_12_2021_vero #8_round 1_otter.ai,7828,Participant 127,7689,Insect what?,18,58,NA,7827,2,127,428,1138,unleashed,1,FALSE,999,999,0,0,0,0,0
05_12_2021_vero #8_round 1_otter.ai,7829,Participant 999,7689,Home? H o m e,18,59,NA,7828,2,999,428,1139,unleashed,1,FALSE,127,127,0,0,0,0,0
05_12_2021_vero #8_round 1_otter.ai,7830,Participant 127,7689,"Oh, m e. Okay.",19,1,NA,7829,2,127,428,1141,unleashed,1,FALSE,999,999,0,0,0,0,0
05_12_2021_vero #8_round 1_otter.ai,7831,Participant 999,7689,I have a stepstool like a you know to elevate you?,19,2,NA,7830,2,999,428,1142,unleashed,1,FALSE,127,all,0,0,0,0,0
05_12_2021_vero #8_round 1_otter.ai,7832,Participant 127,7689,Uh huh.,19,6,NA,7831,2,127,428,1146,unleashed,1,FALSE,999,999,0,0,0,0,0
05_12_2021_vero #8_round 1_otter.ai,7833,Participant 999,7689,I had a way to just hit something else. What do you have?,19,7,NA,7832,2,999,428,1147,unleashed,1,FALSE,127,"all,127","0,0","0,0","0,0","0,0","0,0"
05_12_2021_vero #8_round 1_otter.ai,7834,Participant 127,7689,"Well, I we have to have the same thing.",19,12,NA,7833,2,127,428,1152,unleashed,1,FALSE,999,999,0,1,0,0,0
05_12_2021_vero #8_round 1_otter.ai,7835,Participant 999,7689,Oh right. What are you thinking?,19,14,NA,7834,2,999,428,1154,unleashed,1,FALSE,127,127,1,0,0,0,0
05_12_2021_vero #8_round 1_otter.ai,7836,Participant 127,7689,I would use it as a tool to block a hole in something a hole in the wall or,19,16,NA,7835,2,127,428,1156,unleashed,1,FALSE,999,all,0,0,0,0,0
05_12_2021_vero #8_round 1_otter.ai,7837,Participant 999,7689,"Ok, block a hole. Okay.",19,23,NA,7836,2,999,428,1163,unleashed,1,FALSE,127,127,0,0,0,0,0
05_12_2021_vero #8_round 1_otter.ai,7838,Participant 127,7689,Um,19,28,NA,7837,2,127,428,1168,unleashed,1,FALSE,999,all,0,0,0,0,0
05_12_2021_vero #8_round 1_otter.ai,7839,Participant 999,7689,"How about uh oh, no, I guess the weight I said an arm weight but I was thinking like a weight to pull a paperweight or?",19,30,NA,7838,2,999,428,1170,unleashed,1,FALSE,127,all,0,0,0,0,0
05_12_2021_vero #8_round 1_otter.ai,7840,Participant 127,7689,"Okay, just a paperweight? Sounds good, Okay.",19,41,NA,7839,2,127,428,1181,unleashed,1,FALSE,999,999,1,0,0,0,0
05_12_2021_vero #8_round 1_otter.ai,7841,Participant 999,7689,"Oh, it's we use them to stop our boat from from moving, you know, down a hill. So, stop tire movement",19,46,NA,7840,2,999,428,1186,unleashed,1,FALSE,127,all,0,0,0,0,0
05_12_2021_vero #8_round 1_otter.ai,7842,Participant 127,7689,Stop tire movement. Yeah use it as a door stopper.,19,58,NA,7841,2,127,428,1198,unleashed,1,FALSE,999,"999,all","0,0","0,0","0,0","0,0","0,0"
05_12_2021_vero #8_round 1_otter.ai,7843,Participant 999,7689,Oh good doorstop okay,20,3,NA,7842,2,999,428,1203,unleashed,1,FALSE,127,127,1,0,0,0,0
05_12_2021_vero #8_round 1_otter.ai,7844,Participant 127,7689,How about door opener?,20,9,NA,7843,2,127,428,1209,unleashed,1,FALSE,999,all,0,0,0,0,0
05_12_2021_vero #8_round 1_otter.ai,7845,Participant 999,7689,"Hold the door open too. Alright um how about, let's see, stop movement...",20,12,NA,7844,2,999,428,1212,unleashed,1,FALSE,127,127,0,0,0,0,0
05_12_2021_vero #8_round 1_otter.ai,7846,Participant 127,7689,Did you say stop tire movement downhill on wheel,20,21,NA,7845,2,127,428,1221,unleashed,1,FALSE,999,999,0,0,0,0,0
05_12_2021_vero #8_round 1_otter.ai,7847,Participant 999,7689,Yeah yeah you can put yes downhill,20,24,NA,7846,2,999,428,1224,unleashed,1,FALSE,127,127,0,0,0,0,0
05_12_2021_vero #8_round 1_otter.ai,7848,Participant 127,7689,"Stop, Let's see. We have a one minute warning here we have",20,31,NA,7847,2,127,428,1231,unleashed,1,FALSE,999,all,0,0,0,0,0
05_12_2021_vero #8_round 1_otter.ai,7849,Participant 999,7689,"Wait, I have 358 left",20,39,NA,7848,2,999,428,1239,unleashed,1,FALSE,127,127,0,1,0,0,0
05_12_2021_vero #8_round 1_otter.ai,7850,Participant 127,7689,Oh no she just came I don't see any sheet I'm,20,43,NA,7849,2,127,428,1243,unleashed,1,FALSE,999,999,0,1,0,0,0
05_12_2021_vero #8_round 1_otter.ai,7851,Participant 999,7689,"Yeah, it's going 3:38, 37, 36 we're good we're good here for a minute. Um, How about can you use it... oh you can heat a brick for warmth",20,47,NA,7850,2,999,428,1247,unleashed,1,FALSE,127,"127,all","0,0","2,0","0,0","0,0","0,0"
05_12_2021_vero #8_round 1_otter.ai,7852,Participant 127,7689,"Alright, brick...",21,7,NA,7851,2,127,428,1267,unleashed,1,FALSE,999,999,0,0,0,0,0
05_12_2021_vero #8_round 1_otter.ai,7853,Participant 999,7689,"Yeah, heat it for a warmth warm",21,9,NA,7852,2,999,428,1269,unleashed,1,FALSE,127,127,0,0,0,0,0
05_12_2021_vero #8_round 1_otter.ai,7854,Participant 127,7689,Use it as a pillow.,21,21,NA,7853,2,127,428,1281,unleashed,1,FALSE,999,all,0,0,0,0,0
05_12_2021_vero #8_round 1_otter.ai,7855,Participant 999,7689,Oh well.,21,24,NA,7854,2,999,428,1284,unleashed,1,FALSE,127,127,1,0,0,0,0
05_12_2021_vero #8_round 1_otter.ai,7856,Participant 127,7689,Camping?,21,25,NA,7855,2,127,428,1285,unleashed,1,FALSE,999,999,0,0,0,0,0
05_12_2021_vero #8_round 1_otter.ai,7857,Participant 999,7689,You can prop it yeah prop.,21,26,NA,7856,2,999,428,1286,unleashed,1,FALSE,127,127,1,0,0,0,0
05_12_2021_vero #8_round 1_otter.ai,7858,Participant 127,7689,"Prop up your head. Yeah, my mind says 6:28 since I was starting after you s",21,29,NA,7857,2,127,428,1289,unleashed,1,FALSE,999,"999,all","0,0","0,0","0,0","0,0","0,0"
05_12_2021_vero #8_round 1_otter.ai,7859,Participant 999,7689,"So we get to do this. Oh, what else? Oh, okay.",21,42,NA,7858,2,999,428,1302,unleashed,1,FALSE,127,127,0,0,0,0,0
05_12_2021_vero #8_round 1_otter.ai,7860,Participant 127,7689,Could use it as a plate to eat on.,21,56,NA,7859,2,127,428,1316,unleashed,1,FALSE,999,all,0,0,0,0,0
05_12_2021_vero #8_round 1_otter.ai,7861,Participant 999,7689,"You know, I was thinking that I thought that was a little weird. But you know what we got to go out there place they're eating.",21,58,NA,7860,2,999,428,1318,unleashed,1,FALSE,127,127,1,0,2,0,0
05_12_2021_vero #8_round 1_otter.ai,7862,Participant 127,7689,Yep.,22,4,NA,7861,2,127,428,1324,unleashed,1,FALSE,999,999,0,0,0,0,0
05_12_2021_vero #8_round 1_otter.ai,7863,Participant 999,7689,"Could hold a tent flap down, a tent flap -",22,6,NA,7862,2,999,428,1326,unleashed,1,FALSE,127,all,0,0,0,0,0
