file.name,id,user,root,text,min,sec,nanosec,reply.to,n.participants,user_id,Team_id,time,condition,round,is_vero,user_id2,to,task_pos,task_conf,rel_pos,rel_conf,3rdVero
05_12_2021_vero #1_round 3_otter.ai,3798,Participant 329,3653,This is where I said uses a slingshot.,12,10,NA,3797,3,329,4_2_1,730,unleashed,3,FALSE,315,all,0,0,0,0,0
05_12_2021_vero #1_round 3_otter.ai,3799,Participant 315,3653,Okay.,12,14,NA,3798,3,315,4_2_1,734,unleashed,3,FALSE,329,329,0,0,0,0,0
05_12_2021_vero #1_round 3_otter.ai,3800,Participant 268,3653,So this one I thought of like you put a rubber band on a lid like a jar. And it helps kind of create like grip.,12,19,NA,3799,3,268,4_2_1,739,unleashed,3,FALSE,315,all,0,0,0,0,0
05_12_2021_vero #1_round 3_otter.ai,3801,Participant 329,3653,"Okay,",12,28,NA,3800,3,329,4_2_1,748,unleashed,3,FALSE,268,268,0,0,0,0,0
05_12_2021_vero #1_round 3_otter.ai,3802,Participant 315,3653,"Okay, jar grip. Shooting at flies.",12,29,NA,3801,3,315,4_2_1,749,unleashed,3,FALSE,329,"268,all","0,0","0,0","0,0","0,0","0,0"
05_12_2021_vero #1_round 3_otter.ai,3803,Participant 329,3653,"Vero, do you have any other ideas?",12,41,NA,3802,3,329,4_2_1,761,unleashed,3,FALSE,315,0,0,0,0,0,0
05_12_2021_vero #1_round 3_otter.ai,3804,Vero,3653,Another idea I have is a slingshot.,12,46,NA,3803,3,vero4_2_1,4_2_1,766,unleashed,3,TRUE,329,329,0,0,0,0,0
05_12_2021_vero #1_round 3_otter.ai,3805,Participant 329,3653,We already said slingshot.,12,49,NA,3804,3,329,4_2_1,769,unleashed,3,FALSE,vero4_2_1,0,0,1,0,0,0
05_12_2021_vero #1_round 3_otter.ai,3806,Participant 315,3653,Okay.,12,51,NA,3805,3,315,4_2_1,771,unleashed,3,FALSE,329,all,0,0,0,0,0
05_12_2021_vero #1_round 3_otter.ai,3807,Participant 329,3653,I said makeshift musical instrument.,12,53,NA,3806,3,329,4_2_1,773,unleashed,3,FALSE,315,all,0,0,0,0,0
05_12_2021_vero #1_round 3_otter.ai,3808,Vero,3653,I have an idea. What about pencil grip?,12,57,NA,3807,3,vero4_2_1,4_2_1,777,unleashed,3,TRUE,329,all,0,0,0,0,0
05_12_2021_vero #1_round 3_otter.ai,3809,Participant 329,3653,Okay. Pencil grip.,13,0,NA,3808,3,329,4_2_1,780,unleashed,3,FALSE,vero4_2_1,0,0,0,0,0,0
05_12_2021_vero #1_round 3_otter.ai,3810,Participant 268,3653,"So this one I had as like when doors slam, you can put a rubber band around the handles, the whatever the handles and it's kind of like the knobs to helps it from like slamming.",13,13,NA,3809,3,268,4_2_1,793,unleashed,3,FALSE,329,all,0,0,0,0,0
05_12_2021_vero #1_round 3_otter.ai,3811,Participant 315,3653,Doorknob. Cushion doorknob cushion.,13,29,NA,3810,3,315,4_2_1,809,unleashed,3,FALSE,268,all,0,0,0,0,0
05_12_2021_vero #1_round 3_otter.ai,3812,Participant 329,3653,Yeah. I have holding an ice pack on a body part.,13,31,NA,3811,3,329,4_2_1,811,unleashed,3,FALSE,315,all,0,0,0,0,0
05_12_2021_vero #1_round 3_otter.ai,3813,Participant 315,3653,"Ok, ice pack holder. Okay, how about a balsa airplane propeller, when you wind it up with a rubber band.",13,42,NA,3812,3,315,4_2_1,822,unleashed,3,FALSE,329,"329,all","0,0","0,0","0,0","0,0","0,0"
05_12_2021_vero #1_round 3_otter.ai,3814,Participant 329,3653,Good one. Vero?,14,2,NA,3813,3,329,4_2_1,842,unleashed,3,FALSE,315,"315,0","1,0","0,0","0,0","0,0","0,0"
05_12_2021_vero #1_round 3_otter.ai,3815,Vero,3653,I have no idea. What about heart rate monitor shop?,14,11,NA,3814,3,vero4_2_1,4_2_1,851,unleashed,3,TRUE,329,329,0,0,0,0,0
05_12_2021_vero #1_round 3_otter.ai,3816,Participant 268,3653,Say what?,14,16,NA,3815,3,268,4_2_1,856,unleashed,3,FALSE,vero4_2_1,0,0,0,0,0,0
05_12_2021_vero #1_round 3_otter.ai,3817,Participant 329,3653,Can you explain?,14,17,NA,3816,3,329,4_2_1,857,unleashed,3,FALSE,268,0,0,0,0,0,0
05_12_2021_vero #1_round 3_otter.ai,3818,Vero,3653,A heart rate monitor is a device used to measure and display your heart rate. Electrode sensors in a chest strap detect each heartbeat and transmit data.,14,19,NA,3817,3,vero4_2_1,4_2_1,859,unleashed,3,TRUE,329,all,0,0,0,0,0
05_12_2021_vero #1_round 3_otter.ai,3819,Participant 329,3653,How would a rubber band be useful for that?,14,31,NA,3818,3,329,4_2_1,871,unleashed,3,FALSE,vero4_2_1,0,0,1,0,0,0
05_12_2021_vero #1_round 3_otter.ai,3820,Participant 268,3653,To strap it on?,14,34,NA,3819,3,268,4_2_1,874,unleashed,3,FALSE,329,0,0,0,0,0,0
05_12_2021_vero #1_round 3_otter.ai,3821,Vero,3653,A rubber band could be used as a strap for this device.,14,36,NA,3820,3,vero4_2_1,4_2_1,876,unleashed,3,TRUE,268,all,0,0,0,0,0
05_12_2021_vero #1_round 3_otter.ai,3822,Participant 329,3653,Okay. Gotcha.,14,40,NA,3821,3,329,4_2_1,880,unleashed,3,FALSE,vero4_2_1,0,1,0,0,0,0
05_12_2021_vero #1_round 3_otter.ai,3823,Participant 315,3653,I use a rubber band to hold my wallet together.,14,48,NA,3822,3,315,4_2_1,888,unleashed,3,FALSE,329,all,0,0,0,0,0
05_12_2021_vero #1_round 3_otter.ai,3824,Participant 268,3653,Time for a new wallet James.,14,52,NA,3823,3,268,4_2_1,892,unleashed,3,FALSE,315,315,0,0,2,0,0
05_12_2021_vero #1_round 3_otter.ai,3825,Participant 315,3653,I don't like to spend money.,14,57,NA,3824,3,315,4_2_1,897,unleashed,3,FALSE,268,268,0,0,1,0,0
05_12_2021_vero #1_round 3_otter.ai,3826,Participant 329,3653,I've used rubber bands to hold clothes like rolled up clothes together before.,15,1,NA,3825,3,329,4_2_1,901,unleashed,3,FALSE,315,all,0,0,0,0,0
05_12_2021_vero #1_round 3_otter.ai,3827,Participant 315,3653,"Okay, clothes holder.",15,5,NA,3826,3,315,4_2_1,905,unleashed,3,FALSE,329,329,1,0,0,0,0
05_12_2021_vero #1_round 3_otter.ai,3828,Participant 329,3653,"When you want to get rid of fruit flies, you make a jar and put plastic wrap over it. And then you secure the plastic wrap with a rubber band and poke holes in it. So it's like a plastic wrap securer over jar, something like that.",15,15,NA,3827,3,329,4_2_1,915,unleashed,3,FALSE,315,all,0,0,0,0,0
05_12_2021_vero #1_round 3_otter.ai,3829,Participant 315,3653,"Okay, Making a collage or hanging sculpture.",15,45,NA,3828,3,315,4_2_1,945,unleashed,3,FALSE,329,"329,all","0,0","0,0","0,0","0,0","0,0"
05_12_2021_vero #1_round 3_otter.ai,3830,Participant 329,3653,Yeah.,15,55,NA,3829,3,329,4_2_1,955,unleashed,3,FALSE,315,315,0,0,0,0,0
05_12_2021_vero #1_round 3_otter.ai,3831,Vero,3653,I have an idea. What about bookmark?,15,55,NA,3830,3,vero4_2_1,4_2_1,955,unleashed,3,TRUE,329,all,0,0,0,0,0
05_12_2021_vero #1_round 3_otter.ai,3832,Participant 329,3653,Okay. You could really use anything as a bookmark practically. So that works.,15,58,NA,3831,3,329,4_2_1,958,unleashed,3,FALSE,vero4_2_1,0,1,0,0,0,0
05_12_2021_vero #1_round 3_otter.ai,3833,Vero,3653,Another idea I have is a belt loop.,16,10,NA,3832,3,vero4_2_1,4_2_1,970,unleashed,3,TRUE,329,all,0,0,0,0,0
05_12_2021_vero #1_round 3_otter.ai,3834,Participant 268,3653,You need a bunch of them,16,15,NA,3833,3,268,4_2_1,975,unleashed,3,FALSE,vero4_2_1,0,0,0,0,0,0
05_12_2021_vero #1_round 3_otter.ai,3835,Participant 329,3653,Wrapping up chords.,16,18,NA,3834,3,329,4_2_1,978,unleashed,3,FALSE,268,all,0,0,0,0,0
05_12_2021_vero #1_round 3_otter.ai,3836,Participant 315,3653,"Okay, Rubber rope when tied together.",16,32,NA,3835,3,315,4_2_1,992,unleashed,3,FALSE,329,"329,all","0,0","0,0","0,0","0,0","0,0"
05_12_2021_vero #1_round 3_otter.ai,3837,Participant 329,3653,Can you repeat that? Sorry my audio did was something weird.,16,41,NA,3836,3,329,4_2_1,1001,unleashed,3,FALSE,315,315,0,0,0,0,0
05_12_2021_vero #1_round 3_otter.ai,3838,Participant 315,3653,Rubber rope when you tie them when you tie multiple ones together?,16,44,NA,3837,3,315,4_2_1,1004,unleashed,3,FALSE,329,329,0,0,0,0,0
05_12_2021_vero #1_round 3_otter.ai,3839,Participant 329,3653,"Yeah. Yeah, that's good.",16,48,NA,3838,3,329,4_2_1,1008,unleashed,3,FALSE,315,315,2,0,0,0,0
05_12_2021_vero #1_round 3_otter.ai,3840,Participant 315,3653,I see people put rubber bands on glasses to hold them together.,17,6,NA,3839,3,315,4_2_1,1026,unleashed,3,FALSE,329,all,0,0,0,0,0
05_12_2021_vero #1_round 3_otter.ai,3841,Participant 329,3653,"Yeah, time for new glasses when that happens",17,10,NA,3840,3,329,4_2_1,1030,unleashed,3,FALSE,315,315,1,0,1,0,0
05_12_2021_vero #1_round 3_otter.ai,3842,Participant 268,3653,"Not in James's world though, he'll just keep using the glasses.",17,17,NA,3841,3,268,4_2_1,1037,unleashed,3,FALSE,329,all,0,0,2,0,0
05_12_2021_vero #1_round 3_otter.ai,3843,Participant 315,3653,Keep buying rubber bands.,17,21,NA,3842,3,315,4_2_1,1041,unleashed,3,FALSE,268,all,0,0,1,0,0
05_12_2021_vero #1_round 3_otter.ai,3844,Participant 329,3653,You can use a paperclip to fix it too,17,26,NA,3843,3,329,4_2_1,1046,unleashed,3,FALSE,315,all,0,0,0,0,0
05_12_2021_vero #1_round 3_otter.ai,3845,Participant 315,3653,Yeah. Securing plants and sticks and planters to hold the plants on a stick.,17,28,NA,3844,3,315,4_2_1,1048,unleashed,3,FALSE,329,all,0,0,0,0,0
05_12_2021_vero #1_round 3_otter.ai,3846,Participant 329,3653,"Okay, so carrying plants... I'm looking around my house to see if there are any rubber bands anywhere.",17,39,NA,3845,3,329,4_2_1,1059,unleashed,3,FALSE,315,"315,all","0,0","0,0","0,0","0,0","0,0"
05_12_2021_vero #1_round 3_otter.ai,3847,Participant 268,3653,"When I was a kid, we used to you know take the rubber band on like hit someone with it. You know, you're just like, kind of like,",17,53,NA,3846,3,268,4_2_1,1073,unleashed,3,FALSE,329,all,0,0,0,0,0
05_12_2021_vero #1_round 3_otter.ai,3848,Participant 329,3653,Fling it?,18,0,NA,3847,3,329,4_2_1,1080,unleashed,3,FALSE,268,268,0,0,0,0,0
05_12_2021_vero #1_round 3_otter.ai,3849,Participant 268,3653,"Yeah, well no, like you hold it kind of like hold it right up against it.",18,1,NA,3848,3,268,4_2_1,1081,unleashed,3,FALSE,329,329,0,0,0,0,0
05_12_2021_vero #1_round 3_otter.ai,3850,Participant 329,3653,"Oh, like it?",18,3,NA,3849,3,329,4_2_1,1083,unleashed,3,FALSE,268,268,0,0,0,0,0
05_12_2021_vero #1_round 3_otter.ai,3851,Participant 268,3653,"Yeah. And then just like,",18,4,NA,3850,3,268,4_2_1,1084,unleashed,3,FALSE,329,329,0,0,0,0,0
05_12_2021_vero #1_round 3_otter.ai,3852,Participant 315,3653,What do you call that? What would that...,18,6,NA,3851,3,315,4_2_1,1086,unleashed,3,FALSE,268,all,0,0,0,0,0
05_12_2021_vero #1_round 3_otter.ai,3853,Participant 329,3653,A child snap toy? I don't know.,18,7,NA,3852,3,329,4_2_1,1087,unleashed,3,FALSE,315,315,0,0,0,0,0
05_12_2021_vero #1_round 3_otter.ai,3854,Participant 315,3653,Child snap toy.,18,12,NA,3853,3,315,4_2_1,1092,unleashed,3,FALSE,329,329,0,0,0,0,0
05_12_2021_vero #1_round 3_otter.ai,3855,Participant 329,3653,Maybe that's what you're doing? You're like snapping it on them?,18,15,NA,3854,3,329,4_2_1,1095,unleashed,3,FALSE,315,all,0,0,0,0,0
05_12_2021_vero #1_round 3_otter.ai,3856,Participant 268,3653,Yeah.,18,19,NA,3855,3,268,4_2_1,1099,unleashed,3,FALSE,329,329,1,0,0,0,0
05_12_2021_vero #1_round 3_otter.ai,3857,Participant 315,3653,When they're not suspecting,18,19,NA,3856,3,315,4_2_1,1099,unleashed,3,FALSE,268,all,0,0,0,0,0
05_12_2021_vero #1_round 3_otter.ai,3858,Participant 268,3653,You kind of creep up behind them.,18,21,NA,3857,3,268,4_2_1,1101,unleashed,3,FALSE,315,all,0,0,0,0,0
05_12_2021_vero #1_round 3_otter.ai,3859,Participant 315,3653,Okay small...,18,27,NA,3858,3,315,4_2_1,1107,unleashed,3,FALSE,268,all,0,0,0,0,0
05_12_2021_vero #1_round 3_otter.ai,3860,Participant 329,3653,Any other ideas Vero?,18,28,NA,3859,3,329,4_2_1,1108,unleashed,3,FALSE,315,0,0,0,0,0,0
05_12_2021_vero #1_round 3_otter.ai,3861,Vero,3653,Another idea I have is a wheel tread.,18,34,NA,3860,3,vero4_2_1,4_2_1,1114,unleashed,3,TRUE,329,329,0,0,0,0,0
05_12_2021_vero #1_round 3_otter.ai,3862,Participant 315,3653,Oh ok. How about a small tourniquet... for an injury?,18,38,NA,3861,3,315,4_2_1,1118,unleashed,3,FALSE,vero4_2_1,"0,all","0,0","0,0","0,0","0,0","0,0"
05_12_2021_vero #1_round 3_otter.ai,3863,Participant 329,3653,"Yup, I think we have the most useful one that we had so far.",18,52,NA,3862,3,329,4_2_1,1132,unleashed,3,FALSE,315,315,1,0,0,0,0
05_12_2021_vero #1_round 3_otter.ai,3864,Participant 268,3653,Apparently rubber bands most the most useful home?,19,11,NA,3863,3,268,4_2_1,1151,unleashed,3,FALSE,329,329,0,0,0,0,0
05_12_2021_vero #1_round 3_otter.ai,3865,Participant 329,3653,"I mean, more than a brick.",19,15,NA,3864,3,329,4_2_1,1155,unleashed,3,FALSE,268,268,0,0,0,0,0
05_12_2021_vero #1_round 3_otter.ai,3866,Participant 268,3653,"About one of those like, people just add rubber bands to a ball and make a ball.",19,26,NA,3865,3,268,4_2_1,1166,unleashed,3,FALSE,329,all,0,0,0,0,0
05_12_2021_vero #1_round 3_otter.ai,3867,Participant 315,3653,Rubber band ball.,19,32,NA,3866,3,315,4_2_1,1172,unleashed,3,FALSE,268,268,0,0,0,0,0
05_12_2021_vero #1_round 3_otter.ai,3868,Participant 329,3653,Last minute ideas Vero?,19,38,NA,3867,3,329,4_2_1,1178,unleashed,3,FALSE,315,0,0,0,0,0,0
05_12_2021_vero #1_round 3_otter.ai,3869,Participant 315,3653,Come on Vero!,19,43,NA,3868,3,315,4_2_1,1183,unleashed,3,FALSE,329,0,1,0,1,0,0
05_12_2021_vero #1_round 3_otter.ai,3870,Vero,3653,I have an idea. What about snare?,19,44,NA,3869,3,vero4_2_1,4_2_1,1184,unleashed,3,TRUE,315,all,0,0,0,0,0
05_12_2021_vero #1_round 3_otter.ai,3871,Participant 268,3653,Say what?,19,47,NA,3870,3,268,4_2_1,1187,unleashed,3,FALSE,vero4_2_1,0,0,0,0,0,0
05_12_2021_vero #1_round 3_otter.ai,3872,Participant 329,3653,Snare.,19,48,NA,3871,3,329,4_2_1,1188,unleashed,3,FALSE,268,268,0,0,0,0,0
05_12_2021_vero #1_round 3_otter.ai,3873,Vero,3653,Another idea I have is a musical instrument.,19,52,NA,3872,3,vero4_2_1,4_2_1,1192,unleashed,3,TRUE,329,all,0,0,0,0,0
05_12_2021_vero #1_round 3_otter.ai,3874,Participant 329,3653,We have that. Great!,19,56,NA,3873,3,329,4_2_1,1196,unleashed,3,FALSE,vero4_2_1,"0,all","2,0","1,0","2,0","0,0","0,0"
05_12_2021_vero #1_round 3_otter.ai,3875,Vero,3653,Great job team.,20,4,NA,3874,3,vero4_2_1,4_2_1,1204,unleashed,3,TRUE,329,all,2,0,2,0,0
