file.name,id,user,root,text,min,sec,nanosec,reply.to,n.participants,user_id,Team_id,time,condition,round,is_vero,user_id2,to,task_pos,task_conf,rel_pos,rel_conf,3rdVero
05_20_2021_vero #5_round 2_otter.ai,17801,Vero,17674,We unfortunately are out of time.,11,38,NA,17800,2,vero4_5_5,4_5_5,698,unleashed,2,TRUE,987,all,0,0,0,0,0
05_20_2021_vero #5_round 2_otter.ai,17802,Participant 987,17674,"Do you know the creativity password, Vero?",11,41,NA,17801,2,987,4_5_5,701,unleashed,2,FALSE,vero4_5_5,0,0,0,0,0,0
05_20_2021_vero #5_round 2_otter.ai,17803,Vero,17674,"Yes, I do. The creativity password is slow. S l o w.",11,44,NA,17802,2,vero4_5_5,4_5_5,704,unleashed,2,TRUE,987,987,0,0,0,0,0
05_20_2021_vero #5_round 2_otter.ai,17804,Participant 987,17674,Okay. Sean?,11,50,NA,17803,2,987,4_5_5,710,unleashed,2,FALSE,vero4_5_5,188,0,0,0,0,0
05_20_2021_vero #5_round 2_otter.ai,17805,Participant 188,17674,Hope she's not talking about us.,11,51,NA,17804,2,188,4_5_5,711,unleashed,2,FALSE,987,987,0,0,2,0,2
05_20_2021_vero #5_round 2_otter.ai,17806,Participant 987,17674,"Yeah, that was exactly what I was thinking. Okay. See you in a little bit.",11,54,NA,17805,2,987,4_5_5,714,unleashed,2,FALSE,188,188,0,0,2,0,0
05_20_2021_vero #5_round 2_otter.ai,17807,Participant 188,17674,Sounds good.,11,59,NA,17806,2,188,4_5_5,719,unleashed,2,FALSE,987,987,1,0,0,0,0
05_20_2021_vero #5_round 2_otter.ai,17808,Participant 987,17674,"Oh, no, we got to do this paperclip, we're back.",12,2,NA,17807,2,987,4_5_5,722,unleashed,2,FALSE,188,all,0,0,0,0,0
05_20_2021_vero #5_round 2_otter.ai,17809,Participant 188,17674,A real- a real little bit.,12,5,NA,17808,2,188,4_5_5,725,unleashed,2,FALSE,987,all,0,0,0,0,0
05_20_2021_vero #5_round 2_otter.ai,17810,Participant 987,17674,"This is- oh, and Vero, are you still with us?",12,6,NA,17809,2,987,4_5_5,726,unleashed,2,FALSE,188,"all,0","0,0","0,0","0,0","0,0","0,0"
05_20_2021_vero #5_round 2_otter.ai,17811,Vero,17674,"Yes, I am. I will be your additional teammate for the remainder of the team task rounds.",12,12,NA,17810,2,vero4_5_5,4_5_5,732,unleashed,2,TRUE,987,987,0,0,0,0,0
05_20_2021_vero #5_round 2_otter.ai,17812,Participant 987,17674,Okay.,12,17,NA,17811,2,987,4_5_5,737,unleashed,2,FALSE,vero4_5_5,0,0,0,0,0,0
05_20_2021_vero #5_round 2_otter.ai,17813,Participant 188,17674,Okay.,12,17,NA,17812,2,188,4_5_5,737,unleashed,2,FALSE,987,0,0,0,0,0,0
05_20_2021_vero #5_round 2_otter.ai,17814,Participant 987,17674,"Sean, do you want to read off your ideas? Because I think this is gonna be the same thing, we don't have to put them in here.",12,19,NA,17813,2,987,4_5_5,739,unleashed,2,FALSE,188,188,0,0,0,0,0
05_20_2021_vero #5_round 2_otter.ai,17815,Participant 188,17674,"Yeah, that makes sense. Okay. Um, sure. Okay, um, oh, I misspelled- no I didn't. Okay. Uh, nose ring, earring, paper holder, stabbing weapon, hole punch, toy, hair clip, tie clip, coffee stirrer, spear, ear wax remover, nose picker, toothpick, back scratcher, artistic material, a tie for a bag or construction, shot for a slingshot, a comb, a plumb, like plumb with a B, level, and an electrical wire.",12,23,NA,17814,2,188,4_5_5,743,unleashed,2,FALSE,987,987,0,0,0,0,0
05_20_2021_vero #5_round 2_otter.ai,17816,Participant 987,17674,"I had holds papers together, close the bag of cereal, uncoil it and use to spread glue, uncoil it and wrap around a cord loop to keep it together, a keychain, hold safety pins together, a zipper pull, a bookmark, keep pages of a check register together, uncoil and use to unlock a door, and uncoil and use to release a seatbelt. Um, Vero, do you have any ideas that are different from what we have?",13,15,NA,17815,2,987,4_5_5,795,unleashed,2,FALSE,188,"all,0","0,0","0,0","0,0","0,0","0,0"
05_20_2021_vero #5_round 2_otter.ai,17817,Vero,17674,"Wow, great job, team. You've come up with so many great ideas already. Hm, could we use the paperclip as a conductor?",13,52,NA,17816,2,vero4_5_5,4_5_5,832,unleashed,2,TRUE,987,all,2,0,0,0,0
05_20_2021_vero #5_round 2_otter.ai,17818,Participant 987,17674,"Sure, conductor.",14,1,NA,17817,2,987,4_5_5,841,unleashed,2,FALSE,vero4_5_5,0,1,0,0,0,0
05_20_2021_vero #5_round 2_otter.ai,17819,Participant 188,17674,I wonder which symphony they're gonna lead.,14,6,NA,17818,2,188,4_5_5,846,unleashed,2,FALSE,987,all,0,0,1,0,0
05_20_2021_vero #5_round 2_otter.ai,17820,Participant 987,17674,So I wonder if we could use it as a pointer?,14,11,NA,17819,2,987,4_5_5,851,unleashed,2,FALSE,188,all,0,0,0,0,0
05_20_2021_vero #5_round 2_otter.ai,17821,Participant 188,17674,Ohh.,14,15,NA,17820,2,188,4_5_5,855,unleashed,2,FALSE,987,987,0,0,0,0,0
05_20_2021_vero #5_round 2_otter.ai,17822,Vero,17674,"That's a great idea, Tilly.",14,17,NA,17821,2,vero4_5_5,4_5_5,857,unleashed,2,TRUE,188,987,2,0,0,0,0
05_20_2021_vero #5_round 2_otter.ai,17823,Participant 188,17674,"We didn't get that one already. That's- yeah, why didn't I think of that? Agh.",14,18,NA,17822,2,188,4_5_5,858,unleashed,2,FALSE,vero4_5_5,987,0,0,0,0,0
05_20_2021_vero #5_round 2_otter.ai,17824,Participant 987,17674,"Anything else, Vero?",14,26,NA,17823,2,987,4_5_5,866,unleashed,2,FALSE,188,0,0,0,0,0,0
05_20_2021_vero #5_round 2_otter.ai,17825,Vero,17674,Hmm. Could we use the paperclip as a needle?,14,29,NA,17824,2,vero4_5_5,4_5_5,869,unleashed,2,TRUE,987,987,0,0,0,0,0
05_20_2021_vero #5_round 2_otter.ai,17826,Participant 987,17674,Doesn't have an eye.,14,35,NA,17825,2,987,4_5_5,875,unleashed,2,FALSE,vero4_5_5,0,0,2,0,0,0
05_20_2021_vero #5_round 2_otter.ai,17827,Vero,17674,Could it be a needle for knitting?,14,38,NA,17826,2,vero4_5_5,4_5_5,878,unleashed,2,TRUE,987,987,0,0,0,0,0
05_20_2021_vero #5_round 2_otter.ai,17828,Participant 987,17674,"Oh, a knitting needle. Yes.",14,41,NA,17827,2,987,4_5_5,881,unleashed,2,FALSE,vero4_5_5,0,1,0,0,0,0
05_20_2021_vero #5_round 2_otter.ai,17829,Participant 987,17674,"And then it could also be a crochet hook. For what other kinds of things, like a paint stirrer? I can't say stirrer very well, but like when you have to stir up little paints.",14,41,NA,17828,2,987,4_5_5,881,unleashed,2,FALSE,987,all,0,0,0,0,0
05_20_2021_vero #5_round 2_otter.ai,17830,Participant 188,17674,Yeah. Paint stirrer.,15,3,NA,17829,2,188,4_5_5,903,unleashed,2,FALSE,987,987,1,0,0,0,0
05_20_2021_vero #5_round 2_otter.ai,17831,Participant 987,17674,"Yeah. Um, Vero, any other ideas?",15,6,NA,17830,2,987,4_5_5,906,unleashed,2,FALSE,188,"188,0","0,0","0,0","0,0","0,0","0,0"
05_20_2021_vero #5_round 2_otter.ai,17832,Vero,17674,Could we use the paperclip to remove SIM cards?,15,18,NA,17831,2,vero4_5_5,4_5_5,918,unleashed,2,TRUE,987,all,0,0,0,0,0
05_20_2021_vero #5_round 2_otter.ai,17833,Participant 188,17674,Oh.,15,22,NA,17832,2,188,4_5_5,922,unleashed,2,FALSE,vero4_5_5,0,0,0,0,0,0
05_20_2021_vero #5_round 2_otter.ai,17834,Participant 987,17674,"Oh, yes. I know what a SIM card is.",15,23,NA,17833,2,987,4_5_5,923,unleashed,2,FALSE,188,0,1,0,0,0,0
05_20_2021_vero #5_round 2_otter.ai,17835,Participant 188,17674,"SIM card remover, I guess? Anything else like that?",15,29,NA,17834,2,188,4_5_5,929,unleashed,2,FALSE,987,all,0,0,0,0,0
05_20_2021_vero #5_round 2_otter.ai,17836,Participant 987,17674,I suppose you could use it to release the stylus from your smartphone.,15,38,NA,17835,2,987,4_5_5,938,unleashed,2,FALSE,188,all,0,0,0,0,0
05_20_2021_vero #5_round 2_otter.ai,17837,Participant 188,17674,"Okay, stylus releaser.",15,46,NA,17836,2,188,4_5_5,946,unleashed,2,FALSE,987,987,0,0,0,0,0
05_20_2021_vero #5_round 2_otter.ai,17838,Participant 987,17674,Stylus releaser.,15,48,NA,17837,2,987,4_5_5,948,unleashed,2,FALSE,188,all,0,0,0,0,0
05_20_2021_vero #5_round 2_otter.ai,17839,Participant 188,17674,I think I'm gonna-,15,52,NA,17838,2,188,4_5_5,952,unleashed,2,FALSE,987,all,0,0,0,0,0
05_20_2021_vero #5_round 2_otter.ai,17840,Vero,17674,#NAME?,15,54,NA,17839,2,vero4_5_5,4_5_5,954,unleashed,2,TRUE,188,all,0,0,0,0,0
05_20_2021_vero #5_round 2_otter.ai,17841,Participant 188,17674,"I think that in the same vein as the SIM card remover, we could use it as an SD card remover.",15,59,NA,17840,2,188,4_5_5,959,unleashed,2,FALSE,vero4_5_5,all,0,0,0,0,0
05_20_2021_vero #5_round 2_otter.ai,17842,Participant 987,17674,There we go.,16,8,NA,17841,2,987,4_5_5,968,unleashed,2,FALSE,188,188,1,0,0,0,0
05_20_2021_vero #5_round 2_otter.ai,17843,Participant 188,17674,Sometimes those get stuck. Sometimes my mind gets stuck.,16,9,NA,17842,2,188,4_5_5,969,unleashed,2,FALSE,987,all,0,0,0,0,0
05_20_2021_vero #5_round 2_otter.ai,17844,Participant 987,17674,"Vero, you're very helpful with planting some ideas for brainstorming.",16,23,NA,17843,2,987,4_5_5,983,unleashed,2,FALSE,188,0,3,0,1,0,0
05_20_2021_vero #5_round 2_otter.ai,17845,Participant 188,17674,"Thanks, Vero.",16,28,NA,17844,2,188,4_5_5,988,unleashed,2,FALSE,987,0,2,0,1,0,0
05_20_2021_vero #5_round 2_otter.ai,17846,Vero,17674,You're welcome.,16,30,NA,17845,2,vero4_5_5,4_5_5,990,unleashed,2,TRUE,188,all,2,0,1,0,0
05_20_2021_vero #5_round 2_otter.ai,17847,Participant 188,17674,"Um, Tilly, you want to read your list again? Because I feel like when I hear you talk, ideas just like pop into my head sometimes.",16,33,NA,17846,2,188,4_5_5,993,unleashed,2,FALSE,vero4_5_5,987,0,0,0,0,0
05_20_2021_vero #5_round 2_otter.ai,17848,Participant 987,17674,"Okay. I'm sitting here looking at a stapler, so you could- one could use it to remove a jammed staple?",16,40,NA,17847,2,987,4_5_5,1000,unleashed,2,FALSE,188,188,0,0,0,0,0
05_20_2021_vero #5_round 2_otter.ai,17849,Participant 188,17674,"Oh, yeah. So what will we call that, a staple remover? Jammed staple remover?",16,47,NA,17848,2,188,4_5_5,1007,unleashed,2,FALSE,987,987,0,0,0,0,0
05_20_2021_vero #5_round 2_otter.ai,17850,Participant 987,17674,"Remove a jammed staple? Um, so my list was hold papers together, close a bag of cereal, uncoil and use to spread glue, uncoil and wrap around a cord loop to keep it together. So I guess we could also maybe put in like a substitute zip tie?",16,53,NA,17849,2,987,4_5_5,1013,unleashed,2,FALSE,188,188,0,0,0,0,0
05_20_2021_vero #5_round 2_otter.ai,17851,Participant 188,17674,"Alright, yeah. Substitute zip tie. How about string for a necklace?",17,17,NA,17850,2,188,4_5_5,1037,unleashed,2,FALSE,987,987,0,0,0,0,0
05_20_2021_vero #5_round 2_otter.ai,17852,Participant 987,17674,"Ooh, yes.",17,28,NA,17851,2,987,4_5_5,1048,unleashed,2,FALSE,188,188,1,0,0,0,0
05_20_2021_vero #5_round 2_otter.ai,17853,Participant 188,17674,"I was thinking when you said cereal, I'm like, you could string cereal onto it.",17,32,NA,17852,2,188,4_5_5,1052,unleashed,2,FALSE,987,987,0,0,0,0,0
05_20_2021_vero #5_round 2_otter.ai,17854,Participant 987,17674,"You could also just loop them together from end to end. Zipper pull, hold safety pins together, keychain, bookmark, keep bags of a- keep pages of a check register together. Yes, I still use a check register. Uncoil and use to unlock a door, which is like that poking thing, like the SIM card and stuff. And uncoil-",17,38,NA,17853,2,987,4_5_5,1058,unleashed,2,FALSE,188,188,0,0,0,0,0
05_20_2021_vero #5_round 2_otter.ai,17855,Participant 987,17674,"Oh yeah, a burglar t- how about a burglary tool?",17,38,NA,17854,2,987,4_5_5,1058,unleashed,2,FALSE,987,all,0,0,0,0,0
05_20_2021_vero #5_round 2_otter.ai,17856,Participant 188,17674,A burg- a lockpick.,18,4,NA,17855,2,188,4_5_5,1084,unleashed,2,FALSE,987,987,0,0,0,0,0
05_20_2021_vero #5_round 2_otter.ai,17857,Participant 987,17674,"Lockpick, there we go.",18,6,NA,17856,2,987,4_5_5,1086,unleashed,2,FALSE,188,all,0,0,0,0,0
05_20_2021_vero #5_round 2_otter.ai,17858,Vero,17674,Are there any other things that could be unclogged with a paperclip?,18,11,NA,17857,2,vero4_5_5,4_5_5,1091,unleashed,2,TRUE,987,all,0,0,0,0,0
05_20_2021_vero #5_round 2_otter.ai,17859,Participant 987,17674,Unclogged?,18,16,NA,17858,2,987,4_5_5,1096,unleashed,2,FALSE,vero4_5_5,0,0,0,0,0,0
05_20_2021_vero #5_round 2_otter.ai,17860,Participant 188,17674,"Yeah, you could use it to, um, yeah, like a clog remo- we could just say clog, clog remover.",18,17,NA,17859,2,188,4_5_5,1097,unleashed,2,FALSE,987,0,0,0,0,0,0
05_20_2021_vero #5_round 2_otter.ai,17861,Participant 987,17674,You could use it to unclog like Elmer's glue.,18,28,NA,17860,2,987,4_5_5,1108,unleashed,2,FALSE,188,all,0,0,0,0,0
05_20_2021_vero #5_round 2_otter.ai,17862,Participant 188,17674,"Oh, yeah. I was thinking about like, my hair in the sink, but you know.",18,32,NA,17861,2,188,4_5_5,1112,unleashed,2,FALSE,987,987,1,0,0,0,0
05_20_2021_vero #5_round 2_otter.ai,17863,Participant 987,17674,"Well, that's true, too.",18,36,NA,17862,2,987,4_5_5,1116,unleashed,2,FALSE,188,188,1,0,0,0,0
05_20_2021_vero #5_round 2_otter.ai,17864,Participant 188,17674,"So, should we put like clog remover?",18,39,NA,17863,2,188,4_5_5,1119,unleashed,2,FALSE,987,all,0,0,0,0,0
05_20_2021_vero #5_round 2_otter.ai,17865,Participant 987,17674,"Yeah, well with clog remover, also specifically unclog Elmer's glue. You had toothpick, right?",18,41,NA,17864,2,987,4_5_5,1121,unleashed,2,FALSE,188,188,0,0,0,0,0
05_20_2021_vero #5_round 2_otter.ai,17866,Vero,17674,"Sean, could you please turn on your camera again?",18,53,NA,17865,2,vero4_5_5,4_5_5,1133,unleashed,2,TRUE,987,188,0,0,0,0,0
05_20_2021_vero #5_round 2_otter.ai,17867,Participant 188,17674,"Oh, no.",18,55,NA,17866,2,188,4_5_5,1135,unleashed,2,FALSE,vero4_5_5,0,0,0,0,0,0
05_20_2021_vero #5_round 2_otter.ai,17868,Participant 987,17674,"Uh oh, Sean.",18,56,NA,17867,2,987,4_5_5,1136,unleashed,2,FALSE,188,188,0,1,0,0,0
05_20_2021_vero #5_round 2_otter.ai,17869,Participant 188,17674,"My tech is failing, sorry. What in the world. Okay, um, where were we?",18,58,NA,17868,2,188,4_5_5,1138,unleashed,2,FALSE,987,all,0,0,0,0,0
05_20_2021_vero #5_round 2_otter.ai,17870,Participant 987,17674,"Unclogging- a clog remover, unclogging Elmer's glue.",19,14,NA,17869,2,987,4_5_5,1154,unleashed,2,FALSE,188,188,0,0,0,0,0
05_20_2021_vero #5_round 2_otter.ai,17871,Participant 188,17674,How about a scraper? We can use it to- did anyone say that already?,19,18,NA,17870,2,188,4_5_5,1158,unleashed,2,FALSE,987,all,0,0,0,0,0
05_20_2021_vero #5_round 2_otter.ai,17872,Participant 987,17674,"No, we could use it as a scraper. I",19,25,NA,17871,2,987,4_5_5,1165,unleashed,2,FALSE,188,188,0,0,0,0,0
05_20_2021_vero #5_round 2_otter.ai,17873,Participant 188,17674,"Cus, thinking we'd be like scraping that glue.",19,29,NA,17872,2,188,4_5_5,1169,unleashed,2,FALSE,987,all,0,0,0,0,0
05_20_2021_vero #5_round 2_otter.ai,17874,Participant 987,17674,Yes.,19,32,NA,17873,2,987,4_5_5,1172,unleashed,2,FALSE,188,188,1,0,0,0,0
05_20_2021_vero #5_round 2_otter.ai,17875,Vero,17674,We have one minute remaining.,19,36,NA,17874,2,vero4_5_5,4_5_5,1176,unleashed,2,TRUE,987,all,0,0,0,0,0
05_20_2021_vero #5_round 2_otter.ai,17876,Participant 987,17674,Oh.,19,38,NA,17875,2,987,4_5_5,1178,unleashed,2,FALSE,vero4_5_5,0,0,0,0,0,0
05_20_2021_vero #5_round 2_otter.ai,17877,Vero,17674,Could we use the paperclip as a conductor for electricity?,19,38,NA,17876,2,vero4_5_5,4_5_5,1178,unleashed,2,TRUE,987,all,0,0,0,0,0
05_20_2021_vero #5_round 2_otter.ai,17878,Participant 188,17674,I think-,19,44,NA,17877,2,188,4_5_5,1184,unleashed,2,FALSE,vero4_5_5,0,0,0,0,0,0
05_20_2021_vero #5_round 2_otter.ai,17879,Participant 987,17674,Ohh.,19,45,NA,17878,2,987,4_5_5,1185,unleashed,2,FALSE,188,0,0,0,0,0,0
05_20_2021_vero #5_round 2_otter.ai,17880,Participant 188,17674,"Didn't we already, didn't we already say conductor?",19,45,NA,17879,2,188,4_5_5,1185,unleashed,2,FALSE,987,all,0,1,0,0,0
05_20_2021_vero #5_round 2_otter.ai,17881,Participant 987,17674,"Well, let's clarify conductor. Conductor of orchestra, of music, conductor of music. And then-",19,49,NA,17880,2,987,4_5_5,1189,unleashed,2,FALSE,188,188,0,0,0,0,0
05_20_2021_vero #5_round 2_otter.ai,17882,Participant 188,17674,"So, it could be a baton for the conductor.",19,55,NA,17881,2,188,4_5_5,1195,unleashed,2,FALSE,987,987,0,0,0,0,0
05_20_2021_vero #5_round 2_otter.ai,17883,Participant 987,17674,Yeah.,20,0,NA,17882,2,987,4_5_5,1200,unleashed,2,FALSE,188,188,0,0,0,0,0
05_20_2021_vero #5_round 2_otter.ai,17884,Participant 188,17674,The little thing that they wave around.,20,1,NA,17883,2,188,4_5_5,1201,unleashed,2,FALSE,987,all,0,0,0,0,0
05_20_2021_vero #5_round 2_otter.ai,17885,Participant 987,17674,"The baton for the conductor, for-",20,3,NA,17884,2,987,4_5_5,1203,unleashed,2,FALSE,188,all,0,0,0,0,0
05_20_2021_vero #5_round 2_otter.ai,17886,Vero,17674,That's a good idea for distinguishing.,20,5,NA,17885,2,vero4_5_5,4_5_5,1205,unleashed,2,TRUE,987,all,2,0,0,0,0
05_20_2021_vero #5_round 2_otter.ai,17887,Participant 987,17674,#NAME?,20,7,NA,17886,2,987,4_5_5,1207,unleashed,2,FALSE,vero4_5_5,all,0,0,0,0,0
05_20_2021_vero #5_round 2_otter.ai,17888,Participant 188,17674,"Okay, what did you have as your first entry? What is the actual word you put?",20,13,NA,17887,2,188,4_5_5,1213,unleashed,2,FALSE,987,987,0,0,0,0,0
05_20_2021_vero #5_round 2_otter.ai,17889,Participant 987,17674,My actual word is baton for a conductor of music.,20,16,NA,17888,2,987,4_5_5,1216,unleashed,2,FALSE,188,188,0,0,0,0,0
05_20_2021_vero #5_round 2_otter.ai,17890,Participant 188,17674,Okay.,20,21,NA,17889,2,188,4_5_5,1221,unleashed,2,FALSE,987,987,0,0,0,0,0
05_20_2021_vero #5_round 2_otter.ai,17891,Participant 987,17674,How's that for-,20,22,NA,17890,2,987,4_5_5,1222,unleashed,2,FALSE,188,all,0,0,0,0,0
05_20_2021_vero #5_round 2_otter.ai,17892,Participant 188,17674,Baton for conductor of music.,20,23,NA,17891,2,188,4_5_5,1223,unleashed,2,FALSE,987,all,0,0,0,0,0
05_20_2021_vero #5_round 2_otter.ai,17893,Participant 987,17674,"And then the last thing I put is conductor of electricity. I don't know if this is true- what's the um, it could be a lightning rod? That's a pretty small lightning rod.",20,28,NA,17892,2,987,4_5_5,1228,unleashed,2,FALSE,188,all,0,0,0,0,0
05_20_2021_vero #5_round 2_otter.ai,17894,Vero,17674,See you guys soon in the next task.,20,43,NA,17893,2,vero4_5_5,4_5_5,1243,unleashed,2,TRUE,987,all,0,0,0,0,0
05_20_2021_vero #5_round 2_otter.ai,17895,Participant 987,17674,"Okay, thank you. Do we have to do anything?",20,45,NA,17894,2,987,4_5_5,1245,unleashed,2,FALSE,vero4_5_5,0,1,0,0,0,0
