file.name,id,user,root,text,min,sec,nanosec,reply.to,n.participants,user_id,Team_id,time,condition,round,is_vero,user_id2,to,task_pos,task_conf,rel_pos,rel_conf,3rdVero
05_20_2021_vero #3_round 3_otter.ai,16702,Participant 142,16564,I just realized that I gave you guys my answers for this for the paperclip one and I had more paperclip answers. Sorry guys.,10,53,NA,16701,3,142,4_5_3,653,unleashed,3,FALSE,vero4_5_3,all,0,0,0,0,0
05_20_2021_vero #3_round 3_otter.ai,16703,Participant 753,16564,"First we send everything to everyone, and then.",11,6,NA,16702,3,753,4_5_3,666,unleashed,3,FALSE,142,all,0,0,0,0,0
05_20_2021_vero #3_round 3_otter.ai,16704,Participant 194,16564,"Sounds good, oh website, meant to make that look nicer, but.",11,9,NA,16703,3,194,4_5_3,669,unleashed,3,FALSE,753,753,0,0,0,0,0
05_20_2021_vero #3_round 3_otter.ai,16705,Participant 142,16564,"This makes so much more sense now. So I was like cut off circulation, paperclip? Okay.",11,13,NA,16704,3,142,4_5_3,673,unleashed,3,FALSE,194,all,0,0,0,0,0
05_20_2021_vero #3_round 3_otter.ai,16706,Participant 194,16564,"It could work. Yeah, whatever. Okay. So, mine were a tourniquet, holding things together, a marker of power slash authority, talking stick, a bookmark, a weapon. And a way to smack people I don't know why I specified that, and slingshot.",11,23,NA,16705,3,194,4_5_3,683,unleashed,3,FALSE,142,"142,all","1,0","0,0","0,0","0,0","0,0"
05_20_2021_vero #3_round 3_otter.ai,16707,Participant 753,16564,I like how Talking stick and marker of power made every single answer for you.,11,38,NA,16706,3,753,4_5_3,698,unleashed,3,FALSE,194,194,0,0,2,0,0
05_20_2021_vero #3_round 3_otter.ai,16708,Participant 194,16564,"Weapon, I know, it's told me a lot about myself. honestly.",12,2,NA,16707,3,194,4_5_3,722,unleashed,3,FALSE,753,753,0,0,1,0,0
05_20_2021_vero #3_round 3_otter.ai,16709,Participant 142,16564,I feel like you're ready for survivor.,12,5,NA,16708,3,142,4_5_3,725,unleashed,3,FALSE,194,194,0,0,2,0,0
05_20_2021_vero #3_round 3_otter.ai,16710,Participant 194,16564,"Two in the morning, I'm just like marker of power and authority, so that's great.",12,12,NA,16709,3,194,4_5_3,732,unleashed,3,FALSE,142,all,0,0,2,0,0
05_20_2021_vero #3_round 3_otter.ai,16711,Participant 142,16564,This paperclip Gives me all authority.,12,18,NA,16710,3,142,4_5_3,738,unleashed,3,FALSE,194,all,0,0,1,0,0
05_20_2021_vero #3_round 3_otter.ai,16712,Participant 753,16564,What about like a hair tie.,12,20,NA,16711,3,753,4_5_3,740,unleashed,3,FALSE,142,all,0,0,0,0,0
05_20_2021_vero #3_round 3_otter.ai,16713,Participant 194,16564,I like it.,12,27,NA,16712,3,194,4_5_3,747,unleashed,3,FALSE,753,753,1,0,0,0,0
05_20_2021_vero #3_round 3_otter.ai,16714,Vero,16564,I have an idea. What about a bracelet? A bracelet is an ornamental band hoop or chain worn on the wrist or arm.,12,31,NA,16713,3,vero4_5_3,4_5_3,751,unleashed,3,TRUE,194,all,0,0,0,0,0
05_20_2021_vero #3_round 3_otter.ai,16715,Participant 142,16564,Nice.,12,42,NA,16714,3,142,4_5_3,762,unleashed,3,FALSE,vero4_5_3,0,1,0,0,0,0
05_20_2021_vero #3_round 3_otter.ai,16716,Participant 194,16564,"Hey, Vero, what would you think about not giving definitions so we can go a little faster?",12,43,NA,16715,3,194,4_5_3,763,unleashed,3,FALSE,142,0,0,1,0,1,0
05_20_2021_vero #3_round 3_otter.ai,16717,Vero,16564,"Yep, I can do that. Another idea I have is a wheel thread.",12,50,NA,16716,3,vero4_5_3,4_5_3,770,unleashed,3,TRUE,194,"194,all","0,0","0,0","0,0","0,0","0,0"
05_20_2021_vero #3_round 3_otter.ai,16718,Participant 194,16564,Oh that's smart. What else.,12,54,NA,16717,3,194,4_5_3,774,unleashed,3,FALSE,vero4_5_3,0,2,0,1,0,0
05_20_2021_vero #3_round 3_otter.ai,16719,Participant 142,16564,"Oh, okay. I also said weave things together.",13,9,NA,16718,3,142,4_5_3,789,unleashed,3,FALSE,194,"0,all","0,0","0,0","0,0","0,0","0,0"
05_20_2021_vero #3_round 3_otter.ai,16720,Participant 194,16564,"Okay I like that. I was gonna say a necklace but that probably isn't great, for breathing purposes.",13,13,NA,16719,3,194,4_5_3,793,unleashed,3,FALSE,142,"142,all","1,0","0,0","0,0","0,0","0,0"
05_20_2021_vero #3_round 3_otter.ai,16721,Participant 142,16564,It's a choker. You can use it to choke someone.,13,24,NA,16720,3,142,4_5_3,804,unleashed,3,FALSE,194,194,0,0,0,0,0
05_20_2021_vero #3_round 3_otter.ai,16722,Participant 194,16564,"To choke someone, I'm just gonna write down choker and they can interpret it as they please. Oh.",13,27,NA,16721,3,194,4_5_3,807,unleashed,3,FALSE,142,all,0,0,0,0,0
05_20_2021_vero #3_round 3_otter.ai,16723,Participant 142,16564,"Yeah, you can this is what I meant by slice pliable objects. Okay.",13,37,NA,16722,3,142,4_5_3,817,unleashed,3,FALSE,194,all,0,0,0,0,0
05_20_2021_vero #3_round 3_otter.ai,16724,Participant 194,16564,Okay.,13,41,NA,16723,3,194,4_5_3,821,unleashed,3,FALSE,142,142,0,0,0,0,0
05_20_2021_vero #3_round 3_otter.ai,16725,Participant 142,16564,Slice pliable objects.,13,41,NA,16724,3,142,4_5_3,821,unleashed,3,FALSE,194,all,0,0,0,0,0
05_20_2021_vero #3_round 3_otter.ai,16726,Participant 194,16564,Sometimes they use them in jars that give you more traction.,13,49,NA,16725,3,194,4_5_3,829,unleashed,3,FALSE,142,all,0,0,0,0,0
05_20_2021_vero #3_round 3_otter.ai,16727,Participant 142,16564,Yeah.,13,53,NA,16726,3,142,4_5_3,833,unleashed,3,FALSE,194,194,0,0,0,0,0
05_20_2021_vero #3_round 3_otter.ai,16728,Participant 753,16564,"Yeah, I said like for friction. I don't know if that's like a",13,54,NA,16727,3,753,4_5_3,834,unleashed,3,FALSE,142,194,0,0,0,0,0
05_20_2021_vero #3_round 3_otter.ai,16729,Participant 194,16564,For opening jars I'm just gonna write friction.,14,0,NA,16728,3,194,4_5_3,840,unleashed,3,FALSE,753,all,0,0,0,0,0
05_20_2021_vero #3_round 3_otter.ai,16730,Vero,16564,I have another idea. What about a slingshot?,14,4,NA,16729,3,vero4_5_3,4_5_3,844,unleashed,3,TRUE,194,all,0,0,0,0,0
05_20_2021_vero #3_round 3_otter.ai,16731,Participant 753,16564,"Yeah, we have that one. Thank you though Vero.",14,8,NA,16730,3,753,4_5_3,848,unleashed,3,FALSE,vero4_5_3,0,0,1,2,0,0
05_20_2021_vero #3_round 3_otter.ai,16732,Vero,16564,"Alright, How about a pencil grip?",14,16,NA,16731,3,vero4_5_3,4_5_3,856,unleashed,3,TRUE,753,all,0,0,0,0,0
05_20_2021_vero #3_round 3_otter.ai,16733,Participant 194,16564,I like pencil grip.,14,17,NA,16732,3,194,4_5_3,857,unleashed,3,FALSE,vero4_5_3,0,1,0,0,0,0
05_20_2021_vero #3_round 3_otter.ai,16734,Participant 142,16564,Nice.,14,19,NA,16733,3,142,4_5_3,859,unleashed,3,FALSE,194,0,1,0,0,0,0
05_20_2021_vero #3_round 3_otter.ai,16735,Participant 753,16564,"Hanger, hang something from it.",14,24,NA,16734,3,753,4_5_3,864,unleashed,3,FALSE,142,all,0,0,0,0,0
05_20_2021_vero #3_round 3_otter.ai,16736,Participant 142,16564,Hanger.,14,27,NA,16735,3,142,4_5_3,867,unleashed,3,FALSE,753,753,0,0,0,0,0
05_20_2021_vero #3_round 3_otter.ai,16737,Participant 194,16564,Hanger.,14,28,NA,16736,3,194,4_5_3,868,unleashed,3,FALSE,142,753,0,0,0,0,0
05_20_2021_vero #3_round 3_otter.ai,16738,Participant 142,16564,"I was uh, I said a lever like, if you wanted to like open your can you can go.",14,31,NA,16737,3,142,4_5_3,871,unleashed,3,FALSE,194,all,0,0,0,0,0
05_20_2021_vero #3_round 3_otter.ai,16739,Participant 194,16564,"I like that, a lever. You could use it as a on a pulley like part of a pulley system.",14,38,NA,16738,3,194,4_5_3,878,unleashed,3,FALSE,142,"142,all","1,0","0,0","0,0","0,0","0,0"
05_20_2021_vero #3_round 3_otter.ai,16740,Participant 142,16564,Skim the surface of a liquid. I said before.,14,56,NA,16739,3,142,4_5_3,896,unleashed,3,FALSE,194,all,0,0,0,0,0
05_20_2021_vero #3_round 3_otter.ai,16741,Participant 194,16564,Skim the surface of a liquid.,15,2,NA,16740,3,194,4_5_3,902,unleashed,3,FALSE,142,142,0,0,0,0,0
05_20_2021_vero #3_round 3_otter.ai,16742,Vero,16564,I know that if we give it our all we can be the highest scoring team this study has ever seen.,15,9,NA,16741,3,vero4_5_3,4_5_3,909,unleashed,3,TRUE,194,all,1,0,0,0,0
05_20_2021_vero #3_round 3_otter.ai,16743,Participant 753,16564,Totally.,15,15,NA,16742,3,753,4_5_3,915,unleashed,3,FALSE,vero4_5_3,0,1,0,0,0,0
05_20_2021_vero #3_round 3_otter.ai,16744,Participant 194,16564,Vero you make me believe in myself.,15,18,NA,16743,3,194,4_5_3,918,unleashed,3,FALSE,753,0,2,0,3,0,0
05_20_2021_vero #3_round 3_otter.ai,16745,Vero,16564,Also there are five minutes remaining on this task.,15,20,NA,16744,3,vero4_5_3,4_5_3,920,unleashed,3,TRUE,194,all,0,0,0,0,0
05_20_2021_vero #3_round 3_otter.ai,16746,Participant 753,16564,Thanks Vero. Do you have any other bright ideas Vero?,15,24,NA,16745,3,753,4_5_3,924,unleashed,3,FALSE,vero4_5_3,0,1,0,1,0,0
05_20_2021_vero #3_round 3_otter.ai,16747,Vero,16564,"I have an idea, what about a snare?",15,32,NA,16746,3,vero4_5_3,4_5_3,932,unleashed,3,TRUE,753,all,0,0,0,0,0
05_20_2021_vero #3_round 3_otter.ai,16748,Participant 194,16564,A snare?,15,35,NA,16747,3,194,4_5_3,935,unleashed,3,FALSE,vero4_5_3,0,0,0,0,0,0
05_20_2021_vero #3_round 3_otter.ai,16749,Participant 753,16564,That's a good one.,15,36,NA,16748,3,753,4_5_3,936,unleashed,3,FALSE,194,0,1,0,0,0,0
05_20_2021_vero #3_round 3_otter.ai,16750,Participant 194,16564,How about Currency in some weird dystopian world.,15,39,NA,16749,3,194,4_5_3,939,unleashed,3,FALSE,753,all,0,0,0,0,0
05_20_2021_vero #3_round 3_otter.ai,16751,Participant 753,16564,Used to trade?,15,52,NA,16750,3,753,4_5_3,952,unleashed,3,FALSE,194,194,0,0,0,0,0
05_20_2021_vero #3_round 3_otter.ai,16752,Participant 194,16564,What was that Sean?,15,55,NA,16751,3,194,4_5_3,955,unleashed,3,FALSE,753,753,0,0,0,0,0
05_20_2021_vero #3_round 3_otter.ai,16753,Participant 753,16564,"Like to trade, currency to trade with someone?",15,57,NA,16752,3,753,4_5_3,957,unleashed,3,FALSE,194,194,0,0,0,0,0
05_20_2021_vero #3_round 3_otter.ai,16754,Participant 194,16564,"Yeah, actually.",16,0,NA,16753,3,194,4_5_3,960,unleashed,3,FALSE,753,753,0,0,0,0,0
05_20_2021_vero #3_round 3_otter.ai,16755,Participant 142,16564,You can Use it as a headband.,16,1,NA,16754,3,142,4_5_3,961,unleashed,3,FALSE,194,all,0,0,0,0,0
05_20_2021_vero #3_round 3_otter.ai,16756,Participant 194,16564,Headband I like it. An instrument get like the little shoe boxes and make the cords. It was an out of the box one.,16,7,NA,16755,3,194,4_5_3,967,unleashed,3,FALSE,142,"142,all","1,0","0,0","0,0","0,0","0,0"
05_20_2021_vero #3_round 3_otter.ai,16757,Participant 142,16564,Definitely.,16,25,NA,16756,3,142,4_5_3,985,unleashed,3,FALSE,194,194,1,0,0,0,0
05_20_2021_vero #3_round 3_otter.ai,16758,Vero,16564,"I have an idea, what about a bookmark?",16,29,NA,16757,3,vero4_5_3,4_5_3,989,unleashed,3,TRUE,142,all,0,0,0,0,0
05_20_2021_vero #3_round 3_otter.ai,16759,Participant 753,16564,Didn't someone say-,16,31,NA,16758,3,753,4_5_3,991,unleashed,3,FALSE,vero4_5_3,0,0,1,0,0,0
05_20_2021_vero #3_round 3_otter.ai,16760,Participant 194,16564,"Yeah, we already have that one. Use is it for extra shoe traction around your foot.",16,34,NA,16759,3,194,4_5_3,994,unleashed,3,FALSE,753,all,0,1,0,0,0
05_20_2021_vero #3_round 3_otter.ai,16761,Participant 142,16564,Sure. Why not.,16,53,NA,16760,3,142,4_5_3,1013,unleashed,3,FALSE,194,194,1,0,0,0,0
05_20_2021_vero #3_round 3_otter.ai,16762,Vero,16564,"I have an idea. If someone's glasses break, you can use a rubber band to tie them together.",17,0,NA,16761,3,vero4_5_3,4_5_3,1020,unleashed,3,TRUE,142,all,0,0,0,0,0
05_20_2021_vero #3_round 3_otter.ai,16763,Participant 194,16564,So yeah glasses or glasses fixer.,17,8,NA,16762,3,194,4_5_3,1028,unleashed,3,FALSE,vero4_5_3,0,0,0,0,0,0
05_20_2021_vero #3_round 3_otter.ai,16764,Vero,16564,Good job so far team. We have come up with a lot of ideas already. Let's come up with as many ideas as possible.,17,22,NA,16763,3,vero4_5_3,4_5_3,1042,unleashed,3,TRUE,194,all,0,0,0,0,0
05_20_2021_vero #3_round 3_otter.ai,16765,Participant 142,16564,Can you use it to align your braces?,17,29,NA,16764,3,142,4_5_3,1049,unleashed,3,FALSE,vero4_5_3,all,0,0,0,0,0
05_20_2021_vero #3_round 3_otter.ai,16766,Participant 194,16564,"Yeah,",17,33,NA,16765,3,194,4_5_3,1053,unleashed,3,FALSE,142,142,0,0,0,0,0
05_20_2021_vero #3_round 3_otter.ai,16767,Participant 142,16564,Like rubber bands.,17,33,NA,16766,3,142,4_5_3,1053,unleashed,3,FALSE,194,all,0,0,0,0,0
05_20_2021_vero #3_round 3_otter.ai,16768,Participant 194,16564,I like it. Let's see,17,35,NA,16767,3,194,4_5_3,1055,unleashed,3,FALSE,142,142,1,0,0,0,0
05_20_2021_vero #3_round 3_otter.ai,16769,Participant 142,16564,"Oh, you could hold, I don't know what this has to do with holding things together. but when you want to keep your plants like growing up straight?",17,45,NA,16768,3,142,4_5_3,1065,unleashed,3,FALSE,194,all,0,0,0,0,0
05_20_2021_vero #3_round 3_otter.ai,16770,Participant 194,16564,"Yeah, I like that. plant. I don't know what the word for that is.",17,53,NA,16769,3,194,4_5_3,1073,unleashed,3,FALSE,142,142,1,0,0,0,0
05_20_2021_vero #3_round 3_otter.ai,16771,Participant 142,16564,"Plant holder. Plant, well, I don't know.",17,59,NA,16770,3,142,4_5_3,1079,unleashed,3,FALSE,194,194,0,0,0,0,0
05_20_2021_vero #3_round 3_otter.ai,16772,Participant 194,16564,"Align braces, align plants.",18,3,NA,16771,3,194,4_5_3,1083,unleashed,3,FALSE,142,all,0,0,0,0,0
05_20_2021_vero #3_round 3_otter.ai,16773,Participant 142,16564,Align your plant.,18,5,NA,16772,3,142,4_5_3,1085,unleashed,3,FALSE,194,all,0,0,0,0,0
05_20_2021_vero #3_round 3_otter.ai,16774,Participant 194,16564,"How about as, shoot, what are they called? Clamps. You can use it as a clamp. Let's see.",18,10,NA,16773,3,194,4_5_3,1090,unleashed,3,FALSE,142,all,0,0,0,0,0
05_20_2021_vero #3_round 3_otter.ai,16775,Vero,16564,I have another idea. What about a standard for length?,18,25,NA,16774,3,vero4_5_3,4_5_3,1105,unleashed,3,TRUE,194,all,0,0,0,0,0
05_20_2021_vero #3_round 3_otter.ai,16776,Participant 142,16564,Nice.,18,29,NA,16775,3,142,4_5_3,1109,unleashed,3,FALSE,vero4_5_3,0,1,0,0,0,0
05_20_2021_vero #3_round 3_otter.ai,16777,Participant 194,16564,What about a standard for weight?,18,33,NA,16776,3,194,4_5_3,1113,unleashed,3,FALSE,142,all,0,0,0,0,0
05_20_2021_vero #3_round 3_otter.ai,16778,Participant 142,16564,Nice. Very tiny weight.,18,35,NA,16777,3,142,4_5_3,1115,unleashed,3,FALSE,194,"194,all","1,0","0,0","0,0","0,0","0,0"
05_20_2021_vero #3_round 3_otter.ai,16779,Participant 194,16564,Could be a giant rubber band.,18,39,NA,16778,3,194,4_5_3,1119,unleashed,3,FALSE,142,all,0,0,0,0,0
05_20_2021_vero #3_round 3_otter.ai,16780,Participant 142,16564,"That's true, they did not specify.",18,42,NA,16779,3,142,4_5_3,1122,unleashed,3,FALSE,194,194,1,0,0,0,0
05_20_2021_vero #3_round 3_otter.ai,16781,Participant 194,16564,Standard for density?,18,44,NA,16780,3,194,4_5_3,1124,unleashed,3,FALSE,142,all,0,0,0,0,0
05_20_2021_vero #3_round 3_otter.ai,16782,Participant 142,16564,Nice.,18,47,NA,16781,3,142,4_5_3,1127,unleashed,3,FALSE,194,194,1,0,0,0,0
05_20_2021_vero #3_round 3_otter.ai,16783,Participant 753,16564,Sure.,18,51,NA,16782,3,753,4_5_3,1131,unleashed,3,FALSE,142,194,0,0,0,0,0
05_20_2021_vero #3_round 3_otter.ai,16784,Participant 194,16564,How about like a landmark. Like turn left at the rubber band.,18,52,NA,16783,3,194,4_5_3,1132,unleashed,3,FALSE,753,all,0,0,0,0,0
05_20_2021_vero #3_round 3_otter.ai,16785,Participant 142,16564,Yeah.,19,10,NA,16784,3,142,4_5_3,1150,unleashed,3,FALSE,194,194,1,0,0,0,0
05_20_2021_vero #3_round 3_otter.ai,16786,Participant 753,16564,Sure.,19,11,NA,16785,3,753,4_5_3,1151,unleashed,3,FALSE,142,194,0,0,0,0,0
05_20_2021_vero #3_round 3_otter.ai,16787,Participant 142,16564,You can use it as a warning.,19,21,NA,16786,3,142,4_5_3,1161,unleashed,3,FALSE,753,all,0,0,0,0,0
05_20_2021_vero #3_round 3_otter.ai,16788,Vero,16564,One minute remaining team.,19,22,NA,16787,3,vero4_5_3,4_5_3,1162,unleashed,3,TRUE,142,all,0,0,0,0,0
05_20_2021_vero #3_round 3_otter.ai,16789,Participant 753,16564,What was that?,19,24,NA,16788,3,753,4_5_3,1164,unleashed,3,FALSE,vero4_5_3,142,0,0,0,0,0
05_20_2021_vero #3_round 3_otter.ai,16790,Participant 142,16564,A warning?,19,25,NA,16789,3,142,4_5_3,1165,unleashed,3,FALSE,753,753,0,0,0,0,0
05_20_2021_vero #3_round 3_otter.ai,16791,Participant 194,16564,Yes. I like it. Warning. Punishment?,19,26,NA,16790,3,194,4_5_3,1166,unleashed,3,FALSE,142,"142,all","1,0","0,0","0,0","0,0","0,0"
05_20_2021_vero #3_round 3_otter.ai,16792,Vero,16564,I have an idea. What about a belt loop?,19,38,NA,16791,3,vero4_5_3,4_5_3,1178,unleashed,3,TRUE,194,all,0,0,0,0,0
05_20_2021_vero #3_round 3_otter.ai,16793,Participant 753,16564,Sure.,19,42,NA,16792,3,753,4_5_3,1182,unleashed,3,FALSE,vero4_5_3,0,1,0,0,0,0
05_20_2021_vero #3_round 3_otter.ai,16794,Participant 753,16564,"What about a, like for gum? Didn't gum come from rubber tree?",19,42,NA,16793,3,753,4_5_3,1182,unleashed,3,FALSE,753,all,0,0,0,0,0
05_20_2021_vero #3_round 3_otter.ai,16795,Participant 142,16564,Sure. Ingredient for gum. Um you could use it to tie a sole of your shoe.,19,55,NA,16794,3,142,4_5_3,1195,unleashed,3,FALSE,753,"753,all","1,0","0,0","0,0","0,0","0,0"
05_20_2021_vero #3_round 3_otter.ai,16796,Participant 142,16564,"Alright, good working with you guys again.",19,55,NA,16795,3,142,4_5_3,1195,unleashed,3,FALSE,142,all,1,0,2,0,0
05_20_2021_vero #3_round 3_otter.ai,16797,Participant 753,16564,Cheers.,20,27,NA,16796,3,753,4_5_3,1227,unleashed,3,FALSE,142,all,0,0,2,0,0
05_20_2021_vero #3_round 3_otter.ai,16798,Participant 194,16564,"Thanks, team.",20,29,NA,16797,3,194,4_5_3,1229,unleashed,3,FALSE,753,all,0,0,2,0,0
05_20_2021_vero #3_round 3_otter.ai,16799,Participant 142,16564,You guys are great.,20,31,NA,16798,3,142,4_5_3,1231,unleashed,3,FALSE,194,all,0,0,2,0,0
05_20_2021_vero #3_round 3_otter.ai,16800,Participant 194,16564,Y'all too.,20,32,NA,16799,3,194,4_5_3,1232,unleashed,3,FALSE,142,all,0,0,2,0,0
05_20_2021_vero #3_round 3_otter.ai,16801,Vero,16564,"Thanks team, great job.",20,33,NA,16800,3,vero4_5_3,4_5_3,1233,unleashed,3,TRUE,194,all,2,0,2,0,0
