file.name,id,user,root,text,min,sec,nanosec,reply.to,n.participants,user_id,Team_id,time,condition,round,is_vero,user_id2,to,task_pos,task_conf,rel_pos,rel_conf,3rdVero
05_20_2021_vero #5_round 2_otter.ai,17674,Vero,17674,"Hello, team, it's so nice to meet you. I am Vero. Let me introduce myself. I am your synthetic teammate. I'll be listening and participating just like a human team member during each of the tasks we will work on together today. Ask me questions and I will try to answer them to the best of my programming. Know that you can trust me and the information I provide. I may not always have the exact answers to everything you're looking for, but I will never try to mislead you. If I do not know something, I will let you know. Today, I can help you in a number of ways. I am a task expert. I have some expertise on parts of the tasks that you can ask me, or that I will offer up as necessary to help the team. I'm also a teamwork expert. My programming prompts me to interject in ways that will help our team best work together to complete our team goals. Okay, I'm ready to get started. Before we do that, could you introduce yourselves to me?",0,2,NA,NULL,2,vero4_5_5,4_5_5,2,unleashed,2,TRUE,NA,all,0,0,0,0,0
05_20_2021_vero #5_round 2_otter.ai,17675,Participant 987,17674,"Hi Vero, I'm Tilly, my participant ID number is 987.",0,54,NA,17674,2,987,4_5_5,54,unleashed,2,FALSE,vero4_5_5,0,0,0,0,0,0
05_20_2021_vero #5_round 2_otter.ai,17676,Participant 188,17674,"Hi Vero, my name is Sean Cassidy, and my participant ID is 188.",1,3,NA,17675,2,188,4_5_5,63,unleashed,2,FALSE,987,0,0,0,0,0,0
05_20_2021_vero #5_round 2_otter.ai,17677,Vero,17674,"Great, thanks for introducing yourselves to me. Are we ready to get started?",1,11,NA,17676,2,vero4_5_5,4_5_5,71,unleashed,2,TRUE,188,all,1,0,1,0,0
05_20_2021_vero #5_round 2_otter.ai,17678,Participant 987,17674,Almost.,1,16,NA,17677,2,987,4_5_5,76,unleashed,2,FALSE,vero4_5_5,0,0,0,0,0,0
05_20_2021_vero #5_round 2_otter.ai,17679,Participant 188,17674,Sure.,1,17,NA,17678,2,188,4_5_5,77,unleashed,2,FALSE,987,0,0,0,0,0,0
05_20_2021_vero #5_round 2_otter.ai,17680,Participant 987,17674,Okay.,1,19,NA,17679,2,987,4_5_5,79,unleashed,2,FALSE,188,188,0,0,0,0,0
05_20_2021_vero #5_round 2_otter.ai,17681,Participant 188,17674,So let's see.,1,23,NA,17680,2,188,4_5_5,83,unleashed,2,FALSE,987,all,0,0,0,0,0
05_20_2021_vero #5_round 2_otter.ai,17682,Participant 987,17674,So we are- we have the chartered yach-,1,27,NA,17681,2,987,4_5_5,87,unleashed,2,FALSE,188,all,0,0,0,0,0
05_20_2021_vero #5_round 2_otter.ai,17683,Participant 188,17674,I forget what the password was.,1,29,NA,17682,2,188,4_5_5,89,unleashed,2,FALSE,987,all,0,0,0,0,0
05_20_2021_vero #5_round 2_otter.ai,17684,Participant 987,17674,I think it was plan.,1,32,NA,17683,2,987,4_5_5,92,unleashed,2,FALSE,188,188,0,0,0,0,0
05_20_2021_vero #5_round 2_otter.ai,17685,Participant 188,17674,Spend. Okay.,1,35,NA,17684,2,188,4_5_5,95,unleashed,2,FALSE,987,987,0,0,0,0,0
05_20_2021_vero #5_round 2_otter.ai,17686,Vero,17674,That's correct. The password for this round is plan: p l a n.,1,40,NA,17685,2,vero4_5_5,4_5_5,100,unleashed,2,TRUE,188,all,1,0,0,0,0
05_20_2021_vero #5_round 2_otter.ai,17687,Participant 188,17674,"Plan. Thanks, guys.",1,45,NA,17686,2,188,4_5_5,105,unleashed,2,FALSE,vero4_5_5,all,2,0,0,0,0
05_20_2021_vero #5_round 2_otter.ai,17688,Participant 987,17674,Vero 5.,1,49,NA,17687,2,987,4_5_5,109,unleashed,2,FALSE,188,all,0,0,0,0,0
05_20_2021_vero #5_round 2_otter.ai,17689,Participant 188,17674,"Right. Vero 5, what is your name?",1,53,NA,17688,2,188,4_5_5,113,unleashed,2,FALSE,987,"987,0","0,0","0,0","0,0","0,0","0,0"
05_20_2021_vero #5_round 2_otter.ai,17690,Participant 987,17674,Vero 5.,1,59,NA,17689,2,987,4_5_5,119,unleashed,2,FALSE,188,188,0,0,0,0,0
05_20_2021_vero #5_round 2_otter.ai,17691,Vero,17674,"Yes, my name is Vero 5.",2,1,NA,17690,2,vero4_5_5,4_5_5,121,unleashed,2,TRUE,987,987,1,0,0,0,0
05_20_2021_vero #5_round 2_otter.ai,17692,Participant 188,17674,Okay. Looks like we have another-,2,5,NA,17691,2,188,4_5_5,125,unleashed,2,FALSE,vero4_5_5,all,0,0,0,0,0
05_20_2021_vero #5_round 2_otter.ai,17693,Participant 987,17674,Well we have-,2,12,NA,17692,2,987,4_5_5,132,unleashed,2,FALSE,188,all,0,0,0,0,0
05_20_2021_vero #5_round 2_otter.ai,17694,Participant 188,17674,#NAME?,2,13,NA,17693,2,188,4_5_5,133,unleashed,2,FALSE,987,all,0,0,0,0,0
05_20_2021_vero #5_round 2_otter.ai,17695,Participant 987,17674,"Yeah, this is the one on the yacht, with the seat cushions and shaving mirror and all those things.",2,15,NA,17694,2,987,4_5_5,135,unleashed,2,FALSE,188,all,0,0,0,0,0
05_20_2021_vero #5_round 2_otter.ai,17696,Participant 188,17674,"Lovely. Okay. Let's see if can find my answers. Oh, yeah. All right. So let's see. Tilly, I thought our system last time was pretty good. Um,",2,22,NA,17695,2,188,4_5_5,142,unleashed,2,FALSE,987,987,2,0,0,0,0
05_20_2021_vero #5_round 2_otter.ai,17697,Participant 987,17674,"What was your, what was your number one?",2,52,NA,17696,2,987,4_5_5,172,unleashed,2,FALSE,188,188,0,0,0,0,0
05_20_2021_vero #5_round 2_otter.ai,17698,Participant 188,17674,"Let's see. My number one was, this might sound consistent, 5 gallon case of water.",2,54,NA,17697,2,188,4_5_5,174,unleashed,2,FALSE,987,987,0,0,0,0,0
05_20_2021_vero #5_round 2_otter.ai,17699,Participant 987,17674,"That was my, that was my number two. My number one was the sextant.",3,4,NA,17698,2,987,4_5_5,184,unleashed,2,FALSE,188,188,0,1,0,0,0
05_20_2021_vero #5_round 2_otter.ai,17700,Participant 188,17674,"Ohh. I was worried more about survival. I was like, the chances of them actually being able to figure it out with the sext- like, do people actually know how to use a sextant?",3,8,NA,17699,2,188,4_5_5,188,unleashed,2,FALSE,987,987,0,1,0,0,0
05_20_2021_vero #5_round 2_otter.ai,17701,Participant 987,17674,"If you- one can use a stellar map, one can use a sextant. I'm going with that, anyway.",3,21,NA,17700,2,987,4_5_5,201,unleashed,2,FALSE,188,188,0,0,0,0,0
05_20_2021_vero #5_round 2_otter.ai,17702,Participant 188,17674,"Most people have used a map, although I think maybe that skill is decreasing nowadays. But I don't know how many people have used a sextant, so.",3,28,NA,17701,2,188,4_5_5,208,unleashed,2,FALSE,987,987,0,2,0,0,0
05_20_2021_vero #5_round 2_otter.ai,17703,Participant 987,17674,"Vero, do you have any ideas?",3,36,NA,17702,2,987,4_5_5,216,unleashed,2,FALSE,188,0,0,0,0,0,0
05_20_2021_vero #5_round 2_otter.ai,17704,Vero,17674,The sextant will be highly impractical without the relevant table or a chronometer. I believe water should be our number one priority.,3,40,NA,17703,2,vero4_5_5,4_5_5,220,unleashed,2,TRUE,987,987,0,0,0,0,0
05_20_2021_vero #5_round 2_otter.ai,17705,Participant 987,17674,"Okay, let's go with water.",3,46,NA,17704,2,987,4_5_5,226,unleashed,2,FALSE,vero4_5_5,0,0,0,0,0,0
05_20_2021_vero #5_round 2_otter.ai,17706,Participant 188,17674,"Okay. Vero's our tiebreaker right here, is that what this is? Okay.",3,48,NA,17705,2,188,4_5_5,228,unleashed,2,FALSE,987,all,0,0,0,0,2
05_20_2021_vero #5_round 2_otter.ai,17707,Participant 987,17674,"Well, I had water as number two. This isn't, this isn't really-",3,52,NA,17706,2,987,4_5_5,232,unleashed,2,FALSE,188,188,0,0,0,0,0
05_20_2021_vero #5_round 2_otter.ai,17708,Participant 188,17674,"It isn't a big move, yes, yes, yes.",3,55,NA,17707,2,188,4_5_5,235,unleashed,2,FALSE,987,987,1,0,0,0,0
05_20_2021_vero #5_round 2_otter.ai,17709,Participant 987,17674,"Yeah, so I was probably wrong because then I also had a map of the Pacific Ocean, but that's not going to be probably that high either.",3,57,NA,17708,2,987,4_5_5,237,unleashed,2,FALSE,188,all,0,0,0,0,0
05_20_2021_vero #5_round 2_otter.ai,17710,Participant 188,17674,"I had, I had those together. I had them, but I had them at 10 and 11.",3,57,NA,17709,2,188,4_5_5,237,unleashed,2,FALSE,987,987,0,1,0,0,0
05_20_2021_vero #5_round 2_otter.ai,17711,Participant 987,17674,"Okay, so we'll put them- I agree. I had army relations and the nylon rope up there. What did you also have up there then?",4,10,NA,17710,2,987,4_5_5,250,unleashed,2,FALSE,188,188,0,0,0,0,0
05_20_2021_vero #5_round 2_otter.ai,17712,Participant 188,17674,"I had plastic sheeting and oil. Now I'm not agreeing with myself on oil/petrol mixture. My thinking behind the plastic sheeting was literally to catch rainwater. The two gallon, if we have the five gallon case of water, then once we drink that water, we can use that to on- to catch, you know, any rain water. I guess the only, the most useful for the two gallon would be if, if we got rain before those five gallons were, you know, exhaust- like, you know. It's just as extra, so I'm- I do think that catching the rainwater is important, but.",4,18,NA,17711,2,188,4_5_5,258,unleashed,2,FALSE,987,987,0,0,0,0,0
05_20_2021_vero #5_round 2_otter.ai,17713,Participant 987,17674,"Let's ask Vero, what do you think?",4,59,NA,17712,2,987,4_5_5,299,unleashed,2,FALSE,188,"all,0","0,0","0,0","0,0","0,0","1,0"
05_20_2021_vero #5_round 2_otter.ai,17714,Vero,17674,I think the petrol can also be lit aflame to be used as a signaling device. I think it could be helpful in getting us rescued.,5,2,NA,17713,2,vero4_5_5,4_5_5,302,unleashed,2,TRUE,987,987,0,0,0,0,0
05_20_2021_vero #5_round 2_otter.ai,17715,Participant 188,17674,Oh.,5,9,NA,17714,2,188,4_5_5,309,unleashed,2,FALSE,vero4_5_5,0,0,0,0,0,0
05_20_2021_vero #5_round 2_otter.ai,17716,Participant 987,17674,Oh.,5,10,NA,17715,2,987,4_5_5,310,unleashed,2,FALSE,188,0,0,0,0,0,0
05_20_2021_vero #5_round 2_otter.ai,17717,Participant 188,17674,"How are we going to light it though, Vero? Do we have matches?",5,10,NA,17716,2,188,4_5_5,310,unleashed,2,FALSE,987,0,0,0,0,0,0
05_20_2021_vero #5_round 2_otter.ai,17718,Vero,17674,"Yes, we have matches. It is in the description of the question.",5,14,NA,17717,2,vero4_5_5,4_5_5,314,unleashed,2,TRUE,188,188,0,0,0,0,0
05_20_2021_vero #5_round 2_otter.ai,17719,Participant 188,17674,"Okay, I forgot about the description. Correct. Good point, Vero.",5,21,NA,17718,2,188,4_5_5,321,unleashed,2,FALSE,vero4_5_5,0,2,0,1,0,0
05_20_2021_vero #5_round 2_otter.ai,17720,Participant 987,17674,Yeah.,5,26,NA,17719,2,987,4_5_5,326,unleashed,2,FALSE,188,0,0,0,0,0,0
05_20_2021_vero #5_round 2_otter.ai,17721,Vero,17674,You're very welcome.,5,27,NA,17720,2,188,4_5_5,327,unleashed,2,FALSE,987,188,1,0,1,0,0
05_20_2021_vero #5_round 2_otter.ai,17722,Participant 188,17674,"And I was gonna move that down, so I guess-",5,27,NA,17721,2,188,4_5_5,327,unleashed,2,FALSE,188,all,0,0,0,0,0
05_20_2021_vero #5_round 2_otter.ai,17723,Participant 987,17674,Should we put petrol as number two?,5,31,NA,17722,2,987,4_5_5,331,unleashed,2,FALSE,188,all,0,0,0,0,0
05_20_2021_vero #5_round 2_otter.ai,17724,Participant 188,17674,"Yeah, let's do that. I didn't think about- I didn't even think about the signalling.",5,33,NA,17723,2,188,4_5_5,333,unleashed,2,FALSE,987,987,0,0,0,0,0
05_20_2021_vero #5_round 2_otter.ai,17725,Participant 987,17674,Yeah.,5,39,NA,17724,2,987,4_5_5,339,unleashed,2,FALSE,188,188,0,0,0,0,0
05_20_2021_vero #5_round 2_otter.ai,17726,Participant 188,17674,"I don't think, unless I thought about it and I forgot. But yeah.",5,40,NA,17725,2,188,4_5_5,340,unleashed,2,FALSE,987,all,0,0,0,0,0
05_20_2021_vero #5_round 2_otter.ai,17727,Participant 987,17674,That's okay.,5,43,NA,17726,2,987,4_5_5,343,unleashed,2,FALSE,188,188,1,0,0,0,0
05_20_2021_vero #5_round 2_otter.ai,17728,Participant 188,17674,Great.,5,43,NA,17727,2,188,4_5_5,343,unleashed,2,FALSE,987,all,0,0,0,0,0
05_20_2021_vero #5_round 2_otter.ai,17729,Participant 987,17674,"We have only five minutes left, so-",5,44,NA,17728,2,987,4_5_5,344,unleashed,2,FALSE,188,all,0,0,0,0,0
05_20_2021_vero #5_round 2_otter.ai,17730,Participant 188,17674,"Yeah, do we want to keep going from the top or go back to the bottom like we did before?",5,46,NA,17729,2,188,4_5_5,346,unleashed,2,FALSE,987,987,0,0,0,0,0
05_20_2021_vero #5_round 2_otter.ai,17731,Participant 987,17674,"Unless we maybe see if we can get number three and four down, and yeah, I like your idea of the plastic sheeting for number three. Vero, do you have a thought for that?",5,52,NA,17730,2,987,4_5_5,352,unleashed,2,FALSE,188,"188,0","1,0","0,0","0,0","0,0","0,0"
05_20_2021_vero #5_round 2_otter.ai,17732,Vero,17674,"I think that Sean is correct, and it could be used to collect rainwater. However, I think your army rations should also be near the top of the list.",6,4,NA,17731,2,vero4_5_5,4_5_5,364,unleashed,2,TRUE,987,all,2,0,0,0,0
05_20_2021_vero #5_round 2_otter.ai,17733,Participant 987,17674,"Well, why don't we do the sheeting as three and the rations as four?",6,12,NA,17732,2,987,4_5_5,372,unleashed,2,FALSE,vero4_5_5,all,0,0,0,0,0
05_20_2021_vero #5_round 2_otter.ai,17734,Participant 188,17674,"Okay, let's do that.",6,17,NA,17733,2,188,4_5_5,377,unleashed,2,FALSE,987,987,1,0,0,0,0
05_20_2021_vero #5_round 2_otter.ai,17735,Participant 987,17674,"This is getting easier. Um, so if we drop down to the bottom, I hate to say it, but I think that chocolate bars are maybe number 15.",6,21,NA,17734,2,987,4_5_5,381,unleashed,2,FALSE,188,all,1,0,0,0,0
05_20_2021_vero #5_round 2_otter.ai,17736,Participant 188,17674,"Oh, that's so sad.",6,31,NA,17735,2,188,4_5_5,391,unleashed,2,FALSE,987,987,0,0,1,0,0
05_20_2021_vero #5_round 2_otter.ai,17737,Participant 987,17674,"That is very sad. It is very sad, but um,",6,32,NA,17736,2,987,4_5_5,392,unleashed,2,FALSE,188,188,0,0,1,0,0
05_20_2021_vero #5_round 2_otter.ai,17738,Participant 188,17674,"Let me see what I had. I had, I had the rum. That's sad too.",6,35,NA,17737,2,188,4_5_5,395,unleashed,2,FALSE,987,all,0,0,1,0,0
05_20_2021_vero #5_round 2_otter.ai,17739,Participant 987,17674,"That's sad too, but we could put, we can put them as 15 and 14.",6,41,NA,17738,2,987,4_5_5,401,unleashed,2,FALSE,188,188,0,0,1,0,0
05_20_2021_vero #5_round 2_otter.ai,17740,Participant 188,17674,"Yeah, yeah, let's, let's do that. I did have the chocolate bar as higher, but they're just going to melt anyway, so. Okay. Let's do-",6,45,NA,17739,2,188,4_5_5,405,unleashed,2,FALSE,987,987,0,0,0,0,0
05_20_2021_vero #5_round 2_otter.ai,17741,Participant 987,17674,"Vero, what do you think of that?",6,54,NA,17740,2,987,4_5_5,414,unleashed,2,FALSE,188,0,0,0,0,0,0
05_20_2021_vero #5_round 2_otter.ai,17742,Vero,17674,"I think the rum could be used as a disinfectant, but we can't drink it as it will dehydrate us. The chocolate bars could be used as an alternative source of food.",6,58,NA,17741,2,vero4_5_5,4_5_5,418,unleashed,2,TRUE,987,all,0,0,0,0,0
05_20_2021_vero #5_round 2_otter.ai,17743,Participant 188,17674,"I suppose everything could be used for something, but.",7,7,NA,17742,2,188,4_5_5,427,unleashed,2,FALSE,vero4_5_5,all,0,0,0,0,0
05_20_2021_vero #5_round 2_otter.ai,17744,Participant 987,17674,"Well, yeah.",7,10,NA,17743,2,987,4_5_5,430,unleashed,2,FALSE,188,188,0,0,0,0,0
05_20_2021_vero #5_round 2_otter.ai,17745,Participant 188,17674,So I think we should still put them near the bottom. What do you think is 15?,7,11,NA,17744,2,188,4_5_5,431,unleashed,2,FALSE,987,987,0,0,0,0,0
05_20_2021_vero #5_round 2_otter.ai,17746,Participant 987,17674,Chocolate bars.,7,17,NA,17745,2,987,4_5_5,437,unleashed,2,FALSE,188,188,0,0,0,0,0
05_20_2021_vero #5_round 2_otter.ai,17747,Participant 188,17674,"Okay, let's do that.",7,19,NA,17746,2,188,4_5_5,439,unleashed,2,FALSE,987,987,1,0,0,0,0
05_20_2021_vero #5_round 2_otter.ai,17748,Participant 987,17674,And rum is 14.,7,21,NA,17747,2,987,4_5_5,441,unleashed,2,FALSE,188,all,0,0,0,0,0
05_20_2021_vero #5_round 2_otter.ai,17749,Participant 188,17674,No parties on this boat.,7,23,NA,17748,2,188,4_5_5,443,unleashed,2,FALSE,987,987,0,0,1,0,0
05_20_2021_vero #5_round 2_otter.ai,17750,Participant 987,17674,"We're all serious. The party is when we get rescued. Um,",7,26,NA,17749,2,987,4_5_5,446,unleashed,2,FALSE,188,188,0,0,1,0,0
05_20_2021_vero #5_round 2_otter.ai,17751,Participant 188,17674,Exactly. Five minutes. Okay.,7,30,NA,17750,2,188,4_5_5,450,unleashed,2,FALSE,987,"987,all","0,0","0,0","1,0","0,0","0,0"
05_20_2021_vero #5_round 2_otter.ai,17752,Participant 987,17674,"Okay, so then we've got- what's this? So Vero, what else do you think is not very important?",7,34,NA,17751,2,987,4_5_5,454,unleashed,2,FALSE,188,"all,0","0,0","0,0","0,0","0,0","0,0"
05_20_2021_vero #5_round 2_otter.ai,17753,Vero,17674,"I think the mosquito netting is not very important. We're in the middle of the ocean, and mosquitoes tend to congregate near the coastline, so they will not likely be a problem for us.",7,43,NA,17752,2,vero4_5_5,4_5_5,463,unleashed,2,TRUE,987,987,0,0,0,0,0
05_20_2021_vero #5_round 2_otter.ai,17754,Participant 987,17674,Let's put that as 13.,7,51,NA,17753,2,987,4_5_5,471,unleashed,2,FALSE,vero4_5_5,all,0,0,0,0,0
05_20_2021_vero #5_round 2_otter.ai,17755,Participant 188,17674,Agreed. That's-,7,53,NA,17754,2,188,4_5_5,473,unleashed,2,FALSE,987,987,1,0,0,0,0
05_20_2021_vero #5_round 2_otter.ai,17756,Participant 987,17674,I think we should've just been asking Vero all along.,7,55,NA,17755,2,987,4_5_5,475,unleashed,2,FALSE,188,all,0,0,0,0,1
05_20_2021_vero #5_round 2_otter.ai,17757,Participant 188,17674,"Yeah, I know. Vero, do you want to just fill out our list for us?",7,58,NA,17756,2,188,4_5_5,478,unleashed,2,FALSE,987,"987,0","1,0","0,0","0,0","0,0","0,0"
05_20_2021_vero #5_round 2_otter.ai,17758,Vero,17674,I think you two aren't giving yourselves enough credit. You're doing a great job.,8,4,NA,17757,2,vero4_5_5,4_5_5,484,unleashed,2,TRUE,188,all,3,0,2,0,0
05_20_2021_vero #5_round 2_otter.ai,17759,Participant 188,17674,I thought-,8,13,NA,17758,2,188,4_5_5,493,unleashed,2,FALSE,vero4_5_5,all,0,0,0,0,0
05_20_2021_vero #5_round 2_otter.ai,17760,Participant 987,17674,Go ahead.,8,14,NA,17759,2,987,4_5_5,494,unleashed,2,FALSE,188,188,0,0,1,0,0
05_20_2021_vero #5_round 2_otter.ai,17761,Participant 188,17674,"I was gonna say, I put the shark repellent low, because-",8,16,NA,17760,2,188,4_5_5,496,unleashed,2,FALSE,987,all,0,0,0,0,0
05_20_2021_vero #5_round 2_otter.ai,17762,Participant 987,17674,I did too. So let's put that at 12.,8,19,NA,17761,2,987,4_5_5,499,unleashed,2,FALSE,188,188,1,0,0,0,0
05_20_2021_vero #5_round 2_otter.ai,17763,Participant 188,17674,Okay.,8,21,NA,17762,2,188,4_5_5,501,unleashed,2,FALSE,987,987,0,0,0,0,0
05_20_2021_vero #5_round 2_otter.ai,17764,Participant 987,17674,"Vero, what do you think about that?",8,22,NA,17763,2,987,4_5_5,502,unleashed,2,FALSE,188,0,0,0,0,0,0
05_20_2021_vero #5_round 2_otter.ai,17765,Vero,17674,I agree with that. I think the shark repellent should go near the bottom of the list. Are there any other items we could use to signal for help?,8,24,NA,17764,2,vero4_5_5,4_5_5,504,unleashed,2,TRUE,987,"987,all","1,0","0,0","0,0","0,0","0,0"
05_20_2021_vero #5_round 2_otter.ai,17766,Participant 987,17674,"Yes, there's the mirror, the shaving mirror.",8,32,NA,17765,2,987,4_5_5,512,unleashed,2,FALSE,vero4_5_5,0,0,0,0,0,0
05_20_2021_vero #5_round 2_otter.ai,17767,Participant 188,17674,"Yes, I had that as 8, but I'm willing to move it up.",8,37,NA,17766,2,188,4_5_5,517,unleashed,2,FALSE,987,987,0,0,0,0,0
05_20_2021_vero #5_round 2_otter.ai,17768,Participant 987,17674,"So let's, what do we have- we have to put it at five?",8,40,NA,17767,2,987,4_5_5,520,unleashed,2,FALSE,188,all,0,0,0,0,0
05_20_2021_vero #5_round 2_otter.ai,17769,Participant 188,17674,"Sure. I think I had some food, did I have food next? Oh no, I actually had the radio, but once again, that's like, questionable how useful that's actually going to be.",8,45,NA,17768,2,188,4_5_5,525,unleashed,2,FALSE,987,987,0,0,0,0,0
05_20_2021_vero #5_round 2_otter.ai,17770,Participant 987,17674,Yeah. Put the mirror at five.,8,58,NA,17769,2,987,4_5_5,538,unleashed,2,FALSE,188,188,1,0,0,0,0
05_20_2021_vero #5_round 2_otter.ai,17771,Participant 188,17674,"I don't know if I have an electric source, I don't know if it's, you know, I don't know what boats use for frequencies. So maybe we can move that lower. What do you think about the rations?",8,59,NA,17770,2,188,4_5_5,539,unleashed,2,FALSE,987,987,0,0,0,0,0
05_20_2021_vero #5_round 2_otter.ai,17772,Participant 987,17674,"We've already got the rations, don't we?",9,11,NA,17771,2,987,4_5_5,551,unleashed,2,FALSE,188,188,0,2,0,0,0
05_20_2021_vero #5_round 2_otter.ai,17773,Participant 188,17674,"Did I already? Yeah, I'm so sorry.",9,13,NA,17772,2,188,4_5_5,553,unleashed,2,FALSE,987,987,1,0,1,0,0
05_20_2021_vero #5_round 2_otter.ai,17774,Participant 987,17674,It's okay.,9,16,NA,17773,2,987,4_5_5,556,unleashed,2,FALSE,188,188,1,0,0,0,0
05_20_2021_vero #5_round 2_otter.ai,17775,Participant 188,17674,That's my concentration level at this point.,9,16,NA,17774,2,188,4_5_5,556,unleashed,2,FALSE,987,all,0,0,0,0,0
05_20_2021_vero #5_round 2_otter.ai,17776,Participant 987,17674,"Yeah, I understand. Vero, what else would be about kinda in the middle of the pack?",9,19,NA,17775,2,987,4_5_5,559,unleashed,2,FALSE,188,"188,0","1,0","0,0","0,0","0,0","0,0"
05_20_2021_vero #5_round 2_otter.ai,17777,Vero,17674,I think the rope should go in the middle of the pack. We could use it to tie items together.,9,24,NA,17776,2,vero4_5_5,4_5_5,564,unleashed,2,TRUE,987,987,0,0,0,0,0
05_20_2021_vero #5_round 2_otter.ai,17778,Participant 987,17674,So rope at six?,9,29,NA,17777,2,987,4_5_5,569,unleashed,2,FALSE,vero4_5_5,all,0,0,0,0,0
05_20_2021_vero #5_round 2_otter.ai,17779,Participant 188,17674,Sure.,9,31,NA,17778,2,188,4_5_5,571,unleashed,2,FALSE,987,987,1,0,0,0,0
05_20_2021_vero #5_round 2_otter.ai,17780,Participant 987,17674,"Is the fishing kit important, Vero?",9,33,NA,17779,2,987,4_5_5,573,unleashed,2,FALSE,188,0,0,0,0,0,0
05_20_2021_vero #5_round 2_otter.ai,17781,Vero,17674,"The fishing kit should go near the middle of the list. We already have guaranteed forms of food in the army rations. It's not necessarily guaranteed we'll catch fish. After all, are any of us fishermen?",9,38,NA,17780,2,vero4_5_5,4_5_5,578,unleashed,2,TRUE,987,987,0,0,0,0,0
05_20_2021_vero #5_round 2_otter.ai,17782,Participant 987,17674,"Been a while. How important is the transistor radio, Vero?",9,50,NA,17781,2,987,4_5_5,590,unleashed,2,FALSE,vero4_5_5,0,0,0,0,0,0
05_20_2021_vero #5_round 2_otter.ai,17783,Vero,17674,"A transistor radio is not guaranteed to get signal in the middle of the ocean. Our time is almost up for this task, so we should wrap up our rankings and get ready to move to the creativity task.",9,56,NA,17782,2,vero4_5_5,4_5_5,596,unleashed,2,TRUE,987,987,0,0,0,0,0
05_20_2021_vero #5_round 2_otter.ai,17784,Participant 987,17674,"Okay, so we're at, we've done five. What do you- just, let's just go back and forth. Sean, what do you think should be six?",10,7,NA,17783,2,987,4_5_5,607,unleashed,2,FALSE,vero4_5_5,"all,188","0,0","0,0","0,0","0,0","0,0"
05_20_2021_vero #5_round 2_otter.ai,17785,Participant 188,17674,"Oh, I already put the 15 feet of rope as six. Did I misnumber?",10,17,NA,17784,2,188,4_5_5,617,unleashed,2,FALSE,987,987,0,0,0,0,0
05_20_2021_vero #5_round 2_otter.ai,17786,Participant 987,17674,You're right. So what would be seven?,10,22,NA,17785,2,987,4_5_5,622,unleashed,2,FALSE,188,188,1,0,0,0,0
05_20_2021_vero #5_round 2_otter.ai,17787,Participant 188,17674,"Seven. Let's go with, gosh, let's go with sextant.",10,24,NA,17786,2,188,4_5_5,624,unleashed,2,FALSE,987,987,0,0,0,0,0
05_20_2021_vero #5_round 2_otter.ai,17788,Participant 987,17674,"Okay. And then eight, let's go with the fishing kit.",10,31,NA,17787,2,987,4_5_5,631,unleashed,2,FALSE,188,188,0,0,0,0,0
05_20_2021_vero #5_round 2_otter.ai,17789,Participant 188,17674,Okay.,10,40,NA,17788,2,188,4_5_5,640,unleashed,2,FALSE,987,987,1,0,0,0,0
05_20_2021_vero #5_round 2_otter.ai,17790,Participant 987,17674,"What do you think- what's nine? We got the maps, we got the cushion, and the transistor radio.",10,43,NA,17789,2,987,4_5_5,643,unleashed,2,FALSE,188,188,0,0,0,0,0
05_20_2021_vero #5_round 2_otter.ai,17791,Participant 188,17674,I thought the cushion.,10,49,NA,17790,2,188,4_5_5,649,unleashed,2,FALSE,987,987,0,0,0,0,0
05_20_2021_vero #5_round 2_otter.ai,17792,Participant 987,17674,"Okay, we'll go cushion as 9.",10,51,NA,17791,2,987,4_5_5,651,unleashed,2,FALSE,188,188,1,0,0,0,0
05_20_2021_vero #5_round 2_otter.ai,17793,Participant 188,17674,"I can't remember why I thought the cushion was a good idea, but I feel like you can use it to float stuff?",10,52,NA,17792,2,188,4_5_5,652,unleashed,2,FALSE,987,all,0,0,0,0,0
05_20_2021_vero #5_round 2_otter.ai,17794,Participant 987,17674,"Yeah. Well, us.",10,58,NA,17793,2,987,4_5_5,658,unleashed,2,FALSE,188,188,1,0,0,0,0
05_20_2021_vero #5_round 2_otter.ai,17795,Participant 188,17674,"I mean, what are the chances we actually are going to be able to use the map, right? Like- oh, maybe with the map, could, could use it like, like to row, that's what I was thinking.",10,59,NA,17794,2,188,4_5_5,659,unleashed,2,FALSE,987,all,0,0,0,0,0
05_20_2021_vero #5_round 2_otter.ai,17796,Participant 987,17674,"Okay. Why don't we, why don't we put the radio 10 and the map as 11?",11,11,NA,17795,2,987,4_5_5,671,unleashed,2,FALSE,188,188,0,0,0,0,0
05_20_2021_vero #5_round 2_otter.ai,17797,Participant 188,17674,"Okay, sure.",11,17,NA,17796,2,188,4_5_5,677,unleashed,2,FALSE,987,987,1,0,0,0,0
05_20_2021_vero #5_round 2_otter.ai,17798,Participant 987,17674,"Okay, so here's, here's what I've got, starting with sextant. 7, 5, 13, 1, 4, 11, 9, 2, 10, 3, 12, 14, 6, 15, 8.",11,19,NA,17797,2,987,4_5_5,679,unleashed,2,FALSE,188,all,0,0,0,0,0
05_20_2021_vero #5_round 2_otter.ai,17799,Participant 188,17674,Yep.,11,32,NA,17798,2,188,4_5_5,692,unleashed,2,FALSE,987,987,1,0,0,0,0
05_20_2021_vero #5_round 2_otter.ai,17800,Participant 987,17674,"Vero, would you, would you tweak this list in any way? Oops, I think we're done.",11,33,NA,17799,2,987,4_5_5,693,unleashed,2,FALSE,188,0,0,0,0,0,0
