file.name,id,user,root,text,min,sec,nanosec,reply.to,n.participants,user_id,Team_id,time,condition,round,is_vero,user_id2,to,task_pos,task_conf,rel_pos,rel_conf,3rdVero
05_20_2021_vero #3_round 3_otter.ai,16564,Participant 142,16564,"Hello, team.",0,5,NA,NULL,3,142,4_5_3,5,unleashed,3,FALSE,NA,all,0,0,1,0,0
05_20_2021_vero #3_round 3_otter.ai,16565,Participant 194,16564,Hello.,0,6,NA,16564,3,194,4_5_3,6,unleashed,3,FALSE,142,142,0,0,1,0,0
05_20_2021_vero #3_round 3_otter.ai,16566,Participant 753,16564,Welcome back.,0,8,NA,16565,3,753,4_5_3,8,unleashed,3,FALSE,194,all,0,0,1,0,0
05_20_2021_vero #3_round 3_otter.ai,16567,Participant 142,16564,Let's go.,0,9,NA,16566,3,142,4_5_3,9,unleashed,3,FALSE,753,all,0,0,1,0,0
05_20_2021_vero #3_round 3_otter.ai,16568,Participant 753,16564,"Vero I have a question, why can't my Alexa respond as well to my language as you can.",0,12,NA,16567,3,753,4_5_3,12,unleashed,3,FALSE,142,0,0,0,2,0,0
05_20_2021_vero #3_round 3_otter.ai,16569,Vero,16564,Alexa must have a different technology than I do. And I just want to say welcome back team. I am ready to get started on the next round of tasks.,0,20,NA,16568,3,vero4_5_3,4_5_3,20,unleashed,3,TRUE,753,"753,all","0,0","0,0","0,0","0,0","0,0"
05_20_2021_vero #3_round 3_otter.ai,16570,Participant 194,16564,"Okay, let's do it. Also Stephanie, I figured out the things are all in the same order. But if you go to the next one down on the like, responses sheet, it's all like, it gives you them all in the normal order first, and then second. It's like a weird graph.",0,30,NA,16569,3,194,4_5_3,30,unleashed,3,FALSE,vero4_5_3,"0,142","0,0","0,0","0,0","0,0","0,0"
05_20_2021_vero #3_round 3_otter.ai,16571,Participant 142,16564,Oh.,0,50,NA,16570,3,142,4_5_3,50,unleashed,3,FALSE,194,194,0,0,0,0,0
05_20_2021_vero #3_round 3_otter.ai,16572,Participant 194,16564,"It's Not like hugely helpful, but.",0,51,NA,16571,3,194,4_5_3,51,unleashed,3,FALSE,142,all,0,0,0,0,0
05_20_2021_vero #3_round 3_otter.ai,16573,Participant 142,16564,Guess we weren't going crazy.,0,53,NA,16572,3,142,4_5_3,53,unleashed,3,FALSE,194,194,0,0,0,0,0
05_20_2021_vero #3_round 3_otter.ai,16574,Participant 194,16564,Yes.,0,55,NA,16573,3,194,4_5_3,55,unleashed,3,FALSE,142,142,0,0,0,0,0
05_20_2021_vero #3_round 3_otter.ai,16575,Participant 753,16564,Crap. I just put in the thing. I thought.,0,56,NA,16574,3,753,4_5_3,56,unleashed,3,FALSE,194,all,0,0,0,0,0
05_20_2021_vero #3_round 3_otter.ai,16576,Participant 142,16564,"It's okay. It always is like, less time than it says anyway, so. Um.",1,2,NA,16575,3,142,4_5_3,62,unleashed,3,FALSE,753,753,0,0,0,0,0
05_20_2021_vero #3_round 3_otter.ai,16577,Participant 753,16564,The desert one.,1,9,NA,16576,3,753,4_5_3,69,unleashed,3,FALSE,142,all,0,0,0,0,0
05_20_2021_vero #3_round 3_otter.ai,16578,Participant 194,16564,"Desert. So, my water thing with this one on an episode of The Magic School Bus, they get all their water from the cactuses or cacti, I guess.",1,10,NA,16577,3,194,4_5_3,70,unleashed,3,FALSE,753,"753,all","0,0","0,0","0,0","0,0","0,0"
05_20_2021_vero #3_round 3_otter.ai,16579,Participant 753,16564,Yep.,1,21,NA,16578,3,753,4_5_3,81,unleashed,3,FALSE,194,194,0,0,0,0,0
05_20_2021_vero #3_round 3_otter.ai,16580,Participant 194,16564,Knife. That was my highest one.,1,21,NA,16579,3,194,4_5_3,81,unleashed,3,FALSE,753,all,0,0,0,0,0
05_20_2021_vero #3_round 3_otter.ai,16581,Participant 142,16564,Knife okay let's do it.,1,25,NA,16580,3,142,4_5_3,85,unleashed,3,FALSE,194,194,1,0,0,0,0
05_20_2021_vero #3_round 3_otter.ai,16582,Participant 194,16564,What's that?,1,27,NA,16581,3,194,4_5_3,87,unleashed,3,FALSE,142,753,0,0,0,0,0
05_20_2021_vero #3_round 3_otter.ai,16583,Participant 753,16564,The jackknife?,1,28,NA,16582,3,753,4_5_3,88,unleashed,3,FALSE,194,194,0,0,0,0,0
05_20_2021_vero #3_round 3_otter.ai,16584,Participant 194,16564,"Yeah, I had the mirror and then the jackknife. I don't know what the right. I'm flexible.",1,30,NA,16583,3,194,4_5_3,90,unleashed,3,FALSE,753,753,0,0,0,0,0
05_20_2021_vero #3_round 3_otter.ai,16585,Participant 142,16564,What do you want to use the mirror for?,1,36,NA,16584,3,142,4_5_3,96,unleashed,3,FALSE,194,all,0,0,0,0,0
05_20_2021_vero #3_round 3_otter.ai,16586,Participant 194,16564,Signaling again. Try to flag down a plane. I don't know how much that would work.,1,38,NA,16585,3,194,4_5_3,98,unleashed,3,FALSE,142,142,0,0,0,0,0
05_20_2021_vero #3_round 3_otter.ai,16587,Vero,16564,I actually disagree about the jackknife. I think that it would be more useful to put the water higher up just because we are not sure if there are actually cacti in this desert. And whether or not they have water or not.,1,43,NA,16586,3,vero4_5_3,4_5_3,103,unleashed,3,TRUE,194,all,0,2,0,0,0
05_20_2021_vero #3_round 3_otter.ai,16588,Participant 753,16564,I agree.,1,58,NA,16587,3,753,4_5_3,118,unleashed,3,FALSE,vero4_5_3,0,1,0,0,0,0
05_20_2021_vero #3_round 3_otter.ai,16589,Participant 194,16564,"Doesn't this one say, except for the occasional barrel and Saguaro cacti. Those are, those ones have a lot of water in them.",2,0,NA,16588,3,194,4_5_3,120,unleashed,3,FALSE,753,all,0,0,0,0,0
05_20_2021_vero #3_round 3_otter.ai,16590,Participant 753,16564,"Okay. I'm cool with the jackknife then. I agree, I would have put water high up too, but.",2,8,NA,16589,3,753,4_5_3,128,unleashed,3,FALSE,194,194,1,0,0,0,0
05_20_2021_vero #3_round 3_otter.ai,16591,Participant 194,16564,Just based on.,2,14,NA,16590,3,194,4_5_3,134,unleashed,3,FALSE,753,all,0,0,0,0,0
05_20_2021_vero #3_round 3_otter.ai,16592,Participant 142,16564,We could also just put water up high.,2,15,NA,16591,3,142,4_5_3,135,unleashed,3,FALSE,194,all,0,0,0,0,0
05_20_2021_vero #3_round 3_otter.ai,16593,Participant 194,16564,"Yeah, that makes sense.",2,21,NA,16592,3,194,4_5_3,141,unleashed,3,FALSE,142,142,1,0,0,0,0
05_20_2021_vero #3_round 3_otter.ai,16594,Participant 753,16564,And then I agree with mirror too.,2,25,NA,16593,3,753,4_5_3,145,unleashed,3,FALSE,194,all,1,0,0,0,0
05_20_2021_vero #3_round 3_otter.ai,16595,Participant 142,16564,Sounds good.,2,27,NA,16594,3,142,4_5_3,147,unleashed,3,FALSE,753,753,0,0,0,0,0
05_20_2021_vero #3_round 3_otter.ai,16596,Participant 753,16564,So are we putting water two mirror three?,2,29,NA,16595,3,753,4_5_3,149,unleashed,3,FALSE,142,all,0,0,0,0,0
05_20_2021_vero #3_round 3_otter.ai,16597,Participant 142,16564,Yep.,2,32,NA,16596,3,142,4_5_3,152,unleashed,3,FALSE,753,753,0,0,0,0,0
05_20_2021_vero #3_round 3_otter.ai,16598,Participant 194,16564,Okay.,2,32,NA,16597,3,194,4_5_3,152,unleashed,3,FALSE,142,753,0,0,0,0,0
05_20_2021_vero #3_round 3_otter.ai,16599,Participant 142,16564,I actually put top coat pretty high because I was thinking we'd get sunburned.,2,37,NA,16598,3,142,4_5_3,157,unleashed,3,FALSE,194,all,0,0,0,0,0
05_20_2021_vero #3_round 3_otter.ai,16600,Participant 194,16564,"Yeah, good idea, and it gets cold at night.",2,42,NA,16599,3,194,4_5_3,162,unleashed,3,FALSE,142,142,1,0,0,0,0
05_20_2021_vero #3_round 3_otter.ai,16601,Vero,16564,I agree. A topcoat would be useful for crew members to keep warm at night and protect from intense sun exposure.,2,45,NA,16600,3,vero4_5_3,4_5_3,165,unleashed,3,TRUE,194,all,1,0,0,0,0
05_20_2021_vero #3_round 3_otter.ai,16602,Participant 194,16564,I think the plastic raincoat could be helpful for the same reason as the sheeting and the boat. For water. Slash Shelter maybe?,2,54,NA,16601,3,194,4_5_3,174,unleashed,3,FALSE,vero4_5_3,all,0,0,0,0,0
05_20_2021_vero #3_round 3_otter.ai,16603,Participant 753,16564,Yeah.,3,4,NA,16602,3,753,4_5_3,184,unleashed,3,FALSE,194,194,0,0,0,0,0
05_20_2021_vero #3_round 3_otter.ai,16604,Participant 142,16564,"It doesn't really rain though. in the desert. But Yeah, for. yeah for shelter, we can also use a parachute.",3,7,NA,16603,3,142,4_5_3,187,unleashed,3,FALSE,753,all,0,0,0,0,0
05_20_2021_vero #3_round 3_otter.ai,16605,Participant 194,16564,"Yeah, that would also be helpful for signaling if it's like colorful and laid on the ground, too. And",3,20,NA,16604,3,194,4_5_3,200,unleashed,3,FALSE,142,142,0,0,0,0,0
05_20_2021_vero #3_round 3_otter.ai,16606,Vero,16564,"I also think that a flashlight is one of the most important items because chances are that we'll be traveling in the nighttime, and a flashlight would provide a source of light to see or navigate in the dark.",3,30,NA,16605,3,vero4_5_3,4_5_3,210,unleashed,3,TRUE,194,all,0,0,0,0,0
05_20_2021_vero #3_round 3_otter.ai,16607,Participant 753,16564,Does it say if you have batteries though?,3,44,NA,16606,3,753,4_5_3,224,unleashed,3,FALSE,vero4_5_3,all,0,0,0,0,0
05_20_2021_vero #3_round 3_otter.ai,16608,Participant 194,16564,It doesn't so I had it low down.,3,47,NA,16607,3,194,4_5_3,227,unleashed,3,FALSE,753,753,0,0,0,0,0
05_20_2021_vero #3_round 3_otter.ai,16609,Participant 753,16564,"That's why I put it last, if have a flashlight.",3,49,NA,16608,3,753,4_5_3,229,unleashed,3,FALSE,194,all,0,0,0,0,0
05_20_2021_vero #3_round 3_otter.ai,16610,Vero,16564,It says that the flashlight has a four battery size.,3,52,NA,16609,3,vero4_5_3,4_5_3,232,unleashed,3,TRUE,753,all,0,0,0,0,0
05_20_2021_vero #3_round 3_otter.ai,16611,Participant 194,16564,"That's the size of it. Also, I think that, personally I would be up for like having the parachute and salt tablets above the flashlight.",3,56,NA,16610,3,194,4_5_3,236,unleashed,3,FALSE,vero4_5_3,"0,all","0,0","1,1","0,0","0,0","0,0"
05_20_2021_vero #3_round 3_otter.ai,16612,Participant 753,16564,"Yeah, I was thinking salt tablets. I was also thinking the edible. Oh, it's edible animals I thought was edible plants for some reason.",4,7,NA,16611,3,753,4_5_3,247,unleashed,3,FALSE,194,194,1,0,0,0,0
05_20_2021_vero #3_round 3_otter.ai,16613,Participant 142,16564,Wait what do the salt tablets do?,4,16,NA,16612,3,142,4_5_3,256,unleashed,3,FALSE,753,all,0,0,0,0,0
05_20_2021_vero #3_round 3_otter.ai,16614,Participant 753,16564,"Um, like electrolytes?",4,19,NA,16613,3,753,4_5_3,259,unleashed,3,FALSE,142,142,0,0,0,0,0
05_20_2021_vero #3_round 3_otter.ai,16615,Participant 194,16564,"Yeah, when you get dehydrated, it's kind of like you need water and salt. So I'd be up to putting that fifth honestly.",4,21,NA,16614,3,194,4_5_3,261,unleashed,3,FALSE,753,753,0,0,0,0,0
05_20_2021_vero #3_round 3_otter.ai,16616,Vero,16564,"However, I would say the bottle of salt tablets is one of the least important items. Although it can be useful. It would dehydrate you if not taken without adequate water. And as you know, water is a limited resource in this scenario.",4,28,NA,16615,3,vero4_5_3,4_5_3,268,unleashed,3,TRUE,194,all,0,0,0,0,0
05_20_2021_vero #3_round 3_otter.ai,16617,Participant 753,16564,"Hmm,",4,43,NA,16616,3,753,4_5_3,283,unleashed,3,FALSE,vero4_5_3,0,0,0,0,0,0
05_20_2021_vero #3_round 3_otter.ai,16618,Participant 142,16564,"hmm,",4,44,NA,16617,3,142,4_5_3,284,unleashed,3,FALSE,753,0,0,0,0,0,0
05_20_2021_vero #3_round 3_otter.ai,16619,Participant 753,16564,That's a fair point.,4,45,NA,16618,3,753,4_5_3,285,unleashed,3,FALSE,142,0,2,0,0,0,0
05_20_2021_vero #3_round 3_otter.ai,16620,Participant 194,16564,"Okay, we can put it lower down.",4,46,NA,16619,3,194,4_5_3,286,unleashed,3,FALSE,753,all,0,0,0,0,0
05_20_2021_vero #3_round 3_otter.ai,16621,Participant 142,16564,"Right. So what do we have so far, jackknife, water, mirror. Can we put parachute fifth?",4,50,NA,16620,3,142,4_5_3,290,unleashed,3,FALSE,194,all,0,0,0,0,0
05_20_2021_vero #3_round 3_otter.ai,16622,Participant 194,16564,"I like it. Also, Sean, I liked your idea in the last one about like the the alcohol as like containers. I think that's that could be really helpful. I haven't thought of that actually.",5,4,NA,16621,3,194,4_5_3,304,unleashed,3,FALSE,142,"142,753","0,2","0,0","0,1","0,0","0,0"
05_20_2021_vero #3_round 3_otter.ai,16623,Vero,16564,Hi team. There are five minutes remaining on this task.,5,18,NA,16622,3,vero4_5_3,4_5_3,318,unleashed,3,TRUE,194,all,0,0,0,0,0
05_20_2021_vero #3_round 3_otter.ai,16624,Participant 142,16564,"Thanks, Vero.",5,23,NA,16623,3,142,4_5_3,323,unleashed,3,FALSE,vero4_5_3,0,1,0,0,0,0
05_20_2021_vero #3_round 3_otter.ai,16625,Participant 753,16564,So what's not important? I think the pistol again.,5,24,NA,16624,3,753,4_5_3,324,unleashed,3,FALSE,142,all,0,0,0,0,0
05_20_2021_vero #3_round 3_otter.ai,16626,Participant 194,16564,"I think pistol last, 'cuz you can.",5,28,NA,16625,3,194,4_5_3,328,unleashed,3,FALSE,753,753,1,0,0,0,0
05_20_2021_vero #3_round 3_otter.ai,16627,Participant 753,16564,Unless you think.,5,30,NA,16626,3,753,4_5_3,330,unleashed,3,FALSE,194,all,0,0,0,0,0
05_20_2021_vero #3_round 3_otter.ai,16628,Participant 142,16564,I feel like We could use it to kill animals.,5,31,NA,16627,3,142,4_5_3,331,unleashed,3,FALSE,753,753,0,1,0,0,0
05_20_2021_vero #3_round 3_otter.ai,16629,Participant 753,16564,"I guess if you came across something, a pistol is kinda a hard weapon to hunt with.",5,36,NA,16628,3,753,4_5_3,336,unleashed,3,FALSE,142,all,0,0,0,0,0
05_20_2021_vero #3_round 3_otter.ai,16630,Participant 194,16564,"Also, I think we would be at risk of hurting each other.",5,41,NA,16629,3,194,4_5_3,341,unleashed,3,FALSE,753,all,0,0,0,0,0
05_20_2021_vero #3_round 3_otter.ai,16631,Participant 142,16564,That's true. I don't know how to use it. Ok we can put it last.,5,47,NA,16630,3,142,4_5_3,347,unleashed,3,FALSE,194,194,1,0,0,0,0
05_20_2021_vero #3_round 3_otter.ai,16632,Participant 753,16564,"I think thatk, what are the other ones here. Oh, sunglasses. I didn't think were going to be that important.",5,56,NA,16631,3,753,4_5_3,356,unleashed,3,FALSE,142,all,0,0,0,0,0
05_20_2021_vero #3_round 3_otter.ai,16633,Participant 194,16564,I actually had those kind of high up?,6,4,NA,16632,3,194,4_5_3,364,unleashed,3,FALSE,753,753,0,1,0,0,0
05_20_2021_vero #3_round 3_otter.ai,16634,Vero,16564,"Yeah, I think sunglasses will be useful for providing our team with enhanced vision and eye protection from the sun.",6,8,NA,16633,3,vero4_5_3,4_5_3,368,unleashed,3,TRUE,194,all,0,0,0,0,0
05_20_2021_vero #3_round 3_otter.ai,16635,Participant 142,16564,"Okay. Well, Can we put compass over sunglasses? Can we put compass over sunglasses?",6,20,NA,16634,3,142,4_5_3,380,unleashed,3,FALSE,vero4_5_3,all,0,0,0,0,0
05_20_2021_vero #3_round 3_otter.ai,16636,Participant 194,16564,Sure yeah.,6,30,NA,16635,3,194,4_5_3,390,unleashed,3,FALSE,142,142,1,0,0,0,0
05_20_2021_vero #3_round 3_otter.ai,16637,Participant 753,16564,"What are we on, number six?",6,33,NA,16636,3,753,4_5_3,393,unleashed,3,FALSE,194,all,0,0,0,0,0
05_20_2021_vero #3_round 3_otter.ai,16638,Participant 142,16564,"Yes, six.",6,35,NA,16637,3,142,4_5_3,395,unleashed,3,FALSE,753,753,1,0,0,0,0
05_20_2021_vero #3_round 3_otter.ai,16639,Participant 753,16564,"I agree, compass is a good one.",6,37,NA,16638,3,753,4_5_3,397,unleashed,3,FALSE,142,all,2,0,0,0,0
05_20_2021_vero #3_round 3_otter.ai,16640,Participant 194,16564,Compass six. Sorry.?,6,40,NA,16639,3,194,4_5_3,400,unleashed,3,FALSE,753,all,0,0,0,0,0
05_20_2021_vero #3_round 3_otter.ai,16641,Participant 142,16564,"What about an air map. Because yeah, we wouldn't know where we're going with our compass, if we don't have a map.",6,45,NA,16640,3,142,4_5_3,405,unleashed,3,FALSE,194,all,0,0,0,0,0
05_20_2021_vero #3_round 3_otter.ai,16642,Participant 753,16564,"That's the only thing that I was thinking about that, so it said, indicated before impact they were 70 miles south, southwest from a mining camp. but they were like way off course from your flight plan. So I just didn't know if like a map was going to be helpful because it's like, where are you on the map?",6,51,NA,16641,3,753,4_5_3,411,unleashed,3,FALSE,142,142,0,1,0,0,0
05_20_2021_vero #3_round 3_otter.ai,16643,Participant 194,16564,"Yeah, I can't read that.",7,10,NA,16642,3,194,4_5_3,430,unleashed,3,FALSE,753,753,1,1,0,0,0
05_20_2021_vero #3_round 3_otter.ai,16644,Participant 753,16564,"And you're kinda like there's not like a lot of landmarks you know, it's like oh, it's open.",7,12,NA,16643,3,753,4_5_3,432,unleashed,3,FALSE,194,all,0,0,0,0,0
05_20_2021_vero #3_round 3_otter.ai,16645,Vero,16564,"Yeah, I actually think a sectional air map of the area is one of the least important items for that reason, because it would only be useful for navigating the area while flying a plane.",7,18,NA,16644,3,vero4_5_3,4_5_3,438,unleashed,3,TRUE,753,all,0,0,0,0,0
05_20_2021_vero #3_round 3_otter.ai,16646,Participant 142,16564,Got it.,7,31,NA,16645,3,142,4_5_3,451,unleashed,3,FALSE,vero4_5_3,0,0,0,0,0,0
05_20_2021_vero #3_round 3_otter.ai,16647,Participant 753,16564,"Yeah,",7,32,NA,16646,3,753,4_5_3,452,unleashed,3,FALSE,142,0,0,0,0,0,0
05_20_2021_vero #3_round 3_otter.ai,16648,Participant 194,16564,I think what would you think of sunglasses next? I don't know.,7,32,NA,16647,3,194,4_5_3,452,unleashed,3,FALSE,753,all,0,0,0,0,0
05_20_2021_vero #3_round 3_otter.ai,16649,Participant 142,16564,That's fine with me.,7,39,NA,16648,3,142,4_5_3,459,unleashed,3,FALSE,194,194,1,0,0,0,0
05_20_2021_vero #3_round 3_otter.ai,16650,Participant 753,16564,Sure.,7,40,NA,16649,3,753,4_5_3,460,unleashed,3,FALSE,142,194,1,0,0,0,0
05_20_2021_vero #3_round 3_otter.ai,16651,Participant 142,16564,For seven?,7,41,NA,16650,3,142,4_5_3,461,unleashed,3,FALSE,753,all,0,0,0,0,0
05_20_2021_vero #3_round 3_otter.ai,16652,Participant 753,16564,What are we on seven? Compression kit.,7,42,NA,16651,3,753,4_5_3,462,unleashed,3,FALSE,142,all,0,0,0,0,0
05_20_2021_vero #3_round 3_otter.ai,16653,Participant 142,16564,And then maybe the book about edible animals.,7,51,NA,16652,3,142,4_5_3,471,unleashed,3,FALSE,753,all,0,0,0,0,0
05_20_2021_vero #3_round 3_otter.ai,16654,Participant 194,16564,"It makes sense. A lot of like scorpions and stuff, so you don't know who's good and who's not?",7,55,NA,16653,3,194,4_5_3,475,unleashed,3,FALSE,142,all,0,0,0,0,0
05_20_2021_vero #3_round 3_otter.ai,16655,Participant 753,16564,Yeah.,8,3,NA,16654,3,753,4_5_3,483,unleashed,3,FALSE,194,194,0,0,0,0,0
05_20_2021_vero #3_round 3_otter.ai,16656,Participant 142,16564,Oh true.,8,4,NA,16655,3,142,4_5_3,484,unleashed,3,FALSE,753,194,1,0,0,0,0
05_20_2021_vero #3_round 3_otter.ai,16657,Vero,16564,The book would be useful to advise on potential desert animals to hunt as well.,8,5,NA,16656,3,vero4_5_3,4_5_3,485,unleashed,3,TRUE,142,all,0,0,0,0,0
05_20_2021_vero #3_round 3_otter.ai,16658,Participant 753,16564,Yeah.,8,10,NA,16657,3,753,4_5_3,490,unleashed,3,FALSE,vero4_5_3,0,1,0,0,0,0
05_20_2021_vero #3_round 3_otter.ai,16659,Participant 142,16564,"Well given the scorpions from it, I forgot that that was a thing. Maybe we could have a compress kit in case we get bitten. Good.",8,15,NA,16658,3,142,4_5_3,495,unleashed,3,FALSE,753,all,0,0,0,0,0
05_20_2021_vero #3_round 3_otter.ai,16660,Participant 194,16564,Ninth?,8,25,NA,16659,3,194,4_5_3,505,unleashed,3,FALSE,142,142,0,0,0,0,0
05_20_2021_vero #3_round 3_otter.ai,16661,Participant 142,16564,Yeah.,8,28,NA,16660,3,142,4_5_3,508,unleashed,3,FALSE,194,194,0,0,0,0,0
05_20_2021_vero #3_round 3_otter.ai,16662,Participant 194,16564,Maybe raincoat can also.,8,34,NA,16661,3,194,4_5_3,514,unleashed,3,FALSE,142,all,0,0,0,0,0
05_20_2021_vero #3_round 3_otter.ai,16663,Participant 753,16564,We'll put raincoat.,8,37,NA,16662,3,753,4_5_3,517,unleashed,3,FALSE,194,194,0,0,0,0,0
05_20_2021_vero #3_round 3_otter.ai,16664,Participant 142,16564,Yeah let's do that.,8,38,NA,16663,3,142,4_5_3,518,unleashed,3,FALSE,753,194,1,0,0,0,0
05_20_2021_vero #3_round 3_otter.ai,16665,Participant 753,16564,Like plastic just in general has a lot of uses.,8,39,NA,16664,3,753,4_5_3,519,unleashed,3,FALSE,142,all,0,0,0,0,0
05_20_2021_vero #3_round 3_otter.ai,16666,Participant 194,16564,"Yeah, I agree. Um, what do we think next.",8,42,NA,16665,3,194,4_5_3,522,unleashed,3,FALSE,753,"753,all","1,0","0,0","0,0","0,0","0,0"
05_20_2021_vero #3_round 3_otter.ai,16667,Participant 142,16564,Then the vodka.,8,48,NA,16666,3,142,4_5_3,528,unleashed,3,FALSE,194,all,0,0,0,0,0
05_20_2021_vero #3_round 3_otter.ai,16668,Participant 194,16564,I agree.,8,51,NA,16667,3,194,4_5_3,531,unleashed,3,FALSE,142,142,1,0,0,0,0
05_20_2021_vero #3_round 3_otter.ai,16669,Participant 753,16564,Sure.,8,52,NA,16668,3,753,4_5_3,532,unleashed,3,FALSE,194,142,0,0,0,0,0
05_20_2021_vero #3_round 3_otter.ai,16670,Participant 194,16564,I would maybe think salt tablets next just for.,8,57,NA,16669,3,194,4_5_3,537,unleashed,3,FALSE,753,all,0,0,0,0,0
05_20_2021_vero #3_round 3_otter.ai,16671,Participant 753,16564,Sure.,9,0,NA,16670,3,753,4_5_3,540,unleashed,3,FALSE,194,194,1,0,0,0,0
05_20_2021_vero #3_round 3_otter.ai,16672,Participant 142,16564,Yeah.,9,1,NA,16671,3,142,4_5_3,541,unleashed,3,FALSE,753,194,0,0,0,0,0
05_20_2021_vero #3_round 3_otter.ai,16673,Participant 194,16564,"For replenishment, and then I don't care about the order of the last three honestly.",9,2,NA,16672,3,194,4_5_3,542,unleashed,3,FALSE,142,all,0,0,0,0,0
05_20_2021_vero #3_round 3_otter.ai,16674,Participant 142,16564,Let's do flashlight just in case it has batteries.,9,9,NA,16673,3,142,4_5_3,549,unleashed,3,FALSE,194,all,0,0,0,0,0
05_20_2021_vero #3_round 3_otter.ai,16675,Vero,16564,One minute remaining team. great job so far.,9,12,NA,16674,3,vero4_5_3,4_5_3,552,unleashed,3,TRUE,142,all,1,0,0,0,0
05_20_2021_vero #3_round 3_otter.ai,16676,Participant 753,16564,"Pistol, air map.",9,16,NA,16675,3,753,4_5_3,556,unleashed,3,FALSE,vero4_5_3,all,0,0,0,0,0
05_20_2021_vero #3_round 3_otter.ai,16677,Participant 142,16564,Yeah.,9,18,NA,16676,3,142,4_5_3,558,unleashed,3,FALSE,753,753,0,0,0,0,0
05_20_2021_vero #3_round 3_otter.ai,16678,Participant 194,16564,Sounds good.,9,19,NA,16677,3,194,4_5_3,559,unleashed,3,FALSE,142,753,1,0,0,0,0
05_20_2021_vero #3_round 3_otter.ai,16679,Participant 753,16564,That works.,9,20,NA,16678,3,753,4_5_3,560,unleashed,3,FALSE,194,all,0,0,0,0,0
05_20_2021_vero #3_round 3_otter.ai,16680,Participant 194,16564,Alright. cool.,9,22,NA,16679,3,194,4_5_3,562,unleashed,3,FALSE,753,all,0,0,0,0,0
05_20_2021_vero #3_round 3_otter.ai,16681,Participant 753,16564,Cool.,9,25,NA,16680,3,753,4_5_3,565,unleashed,3,FALSE,194,194,0,0,0,0,0
05_20_2021_vero #3_round 3_otter.ai,16682,Participant 194,16564,"So I just moved from Chicago to Santa Fe. So I have to, this is good for me to learn how to live in the desert because I don't know how so this is helpful.",9,27,NA,16681,3,194,4_5_3,567,unleashed,3,FALSE,753,all,0,0,1,0,0
05_20_2021_vero #3_round 3_otter.ai,16683,Participant 142,16564,just in case. Oh my god. For your schooling?,9,36,NA,16682,3,142,4_5_3,576,unleashed,3,FALSE,194,194,0,0,1,0,0
05_20_2021_vero #3_round 3_otter.ai,16684,Participant 194,16564,"Actually, my partner's schooling since I'm still online. So he's.",9,43,NA,16683,3,194,4_5_3,583,unleashed,3,FALSE,142,142,0,0,1,0,0
05_20_2021_vero #3_round 3_otter.ai,16685,Participant 142,16564,"Oh, easy. Nice.",9,46,NA,16684,3,142,4_5_3,586,unleashed,3,FALSE,194,194,0,0,1,0,0
05_20_2021_vero #3_round 3_otter.ai,16686,Participant 194,16564,There's a big national lab down here.,9,48,NA,16685,3,194,4_5_3,588,unleashed,3,FALSE,142,142,0,0,1,0,0
05_20_2021_vero #3_round 3_otter.ai,16687,Participant 753,16564,Nice.,9,50,NA,16686,3,753,4_5_3,590,unleashed,3,FALSE,194,194,0,0,1,0,0
05_20_2021_vero #3_round 3_otter.ai,16688,Participant 194,16564,"Yeah, but weird. It's not. There's sun here. There was not I don't know if you guys are both in the Chicagoland.",9,51,NA,16687,3,194,4_5_3,591,unleashed,3,FALSE,753,all,0,0,1,0,0
05_20_2021_vero #3_round 3_otter.ai,16689,Participant 142,16564,"Yeah, I live in Chicago.",9,59,NA,16688,3,142,4_5_3,599,unleashed,3,FALSE,194,194,0,0,1,0,0
05_20_2021_vero #3_round 3_otter.ai,16690,Participant 753,16564,"I used to live in Chicago, but now I live in New York.",10,0,NA,16689,3,753,4_5_3,600,unleashed,3,FALSE,142,194,0,0,1,0,0
05_20_2021_vero #3_round 3_otter.ai,16691,Participant 194,16564,"Oh, cool.",10,3,NA,16690,3,194,4_5_3,603,unleashed,3,FALSE,753,753,0,0,1,0,0
05_20_2021_vero #3_round 3_otter.ai,16692,Participant 142,16564,"Oh wow, what? I just assumed everyone was in Chicago with me here.",10,5,NA,16691,3,142,4_5_3,605,unleashed,3,FALSE,194,all,0,0,1,0,0
05_20_2021_vero #3_round 3_otter.ai,16693,Participant 194,16564,"Up until like last week, and now I'm not working. I'm bored and doing Kellogg studies.",10,10,NA,16692,3,194,4_5_3,610,unleashed,3,FALSE,142,142,0,0,1,0,0
05_20_2021_vero #3_round 3_otter.ai,16694,Participant 142,16564,"Yeah, exactly. Oh, I didn't even,",10,15,NA,16693,3,142,4_5_3,615,unleashed,3,FALSE,194,194,0,0,2,0,0
05_20_2021_vero #3_round 3_otter.ai,16695,Participant 194,16564,Tuck. Okay.,10,22,NA,16694,3,194,4_5_3,622,unleashed,3,FALSE,142,all,0,0,0,0,0
05_20_2021_vero #3_round 3_otter.ai,16696,Vero,16564,"Hi team. Good job on our last task. I'm excited to work with you all on this next task, the creativity task. I'm ready to begin the creativity task.",10,24,NA,16695,3,vero4_5_3,4_5_3,624,unleashed,3,TRUE,194,all,0,0,0,0,0
05_20_2021_vero #3_round 3_otter.ai,16697,Participant 194,16564,Okay.,10,35,NA,16696,3,194,4_5_3,635,unleashed,3,FALSE,vero4_5_3,0,0,0,0,0,0
05_20_2021_vero #3_round 3_otter.ai,16698,Participant 753,16564,You guys ready?,10,36,NA,16697,3,753,4_5_3,636,unleashed,3,FALSE,194,all,0,0,0,0,0
05_20_2021_vero #3_round 3_otter.ai,16699,Participant 194,16564,I'm ready.,10,38,NA,16698,3,194,4_5_3,638,unleashed,3,FALSE,753,753,1,0,0,0,0
05_20_2021_vero #3_round 3_otter.ai,16700,Participant 753,16564,"All right, let's do it. Rubber band.",10,39,NA,16699,3,753,4_5_3,639,unleashed,3,FALSE,194,all,1,0,0,0,0
05_20_2021_vero #3_round 3_otter.ai,16701,Vero,16564,"Let's say any idea that comes to mind no matter how weird, strange or imaginative",10,47,NA,16700,3,vero4_5_3,4_5_3,647,unleashed,3,TRUE,753,all,0,0,0,0,0
